3月12日 12:45,病毒大概率起源于美国了！可怕        ,1
3月12日 12:45,美国,1
3月12日 12:47,西班牙流感，1918年开始流行，由于西班牙第一个诚实地报出本国爆发了流感，得名“西班牙流感”。后经研究，该流感发源于美国堪萨斯州赖利堡的芬斯顿训练营，由美军带到欧洲大地。 ,1
3月12日 12:45,希望这场疫情过后，国家能设立一个“传染病防治宣传日”，每年一次，只为缅怀逝者，告慰牺牲的英雄，更警示后人。古人云“三者为多”，中国已经历了两次，不要再让噩梦重演了。        ,1
3月12日 12:45,纸包不住火 ,1
3月12日 12:45,瞒不住了吧 ,1
3月12日 12:46,这是终于承认了吗        ,1
3月12日 12:46,所以去年的新闻美国因为电子烟得了肺炎是错的 是感染了病毒 如果是真的 最开始爆发的地方就是美国。        ,1
3月12日 12:52,美国流感～武汉军运会～新型冠状肺炎        ,1
3月12日 12:46,你让川建国很尴尬啊        ,1
3月12日 12:46,其实闹电子烟那会儿美国可能就开始传染了        ,1
3月12日 12:48,美国肺炎欲说还休？中国蝙蝠沉冤得血。        ,1
3月12日 12:58,这个病毒源头确定是美国无疑，美国去年9月份开始有这种白肺病，10月份大量感染。美国不敢检测，这就说明美国心中有鬼，怕全世界找他们算帐，美国有一流的医疗专家，每年都有流感病毒，所以他们防控是有经验的，在1.6万人死亡中有不少是死于新冠肺炎，美国一惯做错了事都是往人家身上推，美国病得不轻了        ,1
3月12日 13:15,还得感谢日本媒体的质疑        ,1
3月12日 12:48,公知集体沉默        ,2
3月12日 12:45,自由民主美利坚        ,2
3月12日 12:46,嘴不硬了，是啥就是啥，纸包不住火🔥        ,2
3月12日 12:47,美国乔治敦大学传染病专家丹尼尔·卢西表示，考虑到病毒潜伏期等因素，首个新冠病毒感染者可能在2019年11月或更早时候就已经出现了。        ,2
3月12日 12:46,从未见过如此厚颜无耻之人 ,2
3月12日 12:46,美國肺炎        ,2
3月12日 14:16,建议将钟南山院士选为世卫组织或卫健委的重要官员，同意的请点赞！        ,2
3月12日 12:46,瘟疫之灾美利坚        ,2
3月12日 13:39,原来中国人和蝙蝠之间的中间宿主是美国人        ,2
3月12日 12:46,要松口了。。。承认了。。。 ,2
3月12日 12:47,所以其实2019年最后一个季度，美利坚肺炎就已经开始世界小范围传播了        ,2
3月12日 12:45,真的是从美国传染来的天哪        ,2
3月12日 13:37,美国实际感染人数很可能大于上报人数，流感的误判、高昂的检测费用、白宫的掉以轻心、媒体带有偏见的宣传，等等。是不是阴谋论尚未可知，不过自食其果倒是真的。老美的阴险世人皆知，自家后院着火不忘反泼对手一身脏水，警惕美国趁机煽动国际上的反华仇化情绪，干扰一带一路的顺利推进。        ,2
3月12日 21:42,去年七月美关闭了一家病毒研究所，八月死了上万白肺，解释成电子烟，经过白鼠试验，白鼠不会白肺死去。那上万的死因到底是不是新冠？十月去武汉的五名美军以痢疾入住武汉的医院，发烧腹泻是新冠和痢疾共同的症状，十一月武汉出现不知名肺炎感染。只有两种低代病株，美国有全部五代病株，请找到瘟疫源头        ,3
3月12日 13:02,突然让我想到了去年10月份武汉军运会 ,3
3月12日 12:45,说实话了吧        ,3
3月12日 12:47,好像突然明白为什么美国不检测了，因为他们心知肚明 ,3
3月12日 12:50,我们武汉终于沉冤得雪了 ,3
3月12日 12:47,真想慢慢露出水面🙏🙏🙏🙏🙏        ,3
3月12日 12:46,不挤牙膏不说实话！        ,3
3月12日 13:17,哦哦，明白了，美国肺炎        ,3
3月12日 12:47,2019年这个源头它要是弄不清楚，全世界以后别想消停。@美国驻华大使馆 ,3
3月12日 12:49,这回变成被美国坑死了，全球都被他们坑了        ,3
3月12日 12:45,终于。。。。        ,3
3月12日 12:47,哦豁  从未见过如此厚颜无耻之人 ,3
3月12日 12:45,终于承认了？        ,3
3月12日 20:06,还记得去年电子烟致癌事件，大规模感染流感，高死亡率是否均与新冠有关，请美正视问题，解决问题，而不是歧视和甩锅。        ,3
3月12日 12:58,所以是从美国传出来的喽？是不是要给中国补偿？        ,4
3月12日 12:54,瞒不住了吧 病毒大概率源于美国了        ,4
3月12日 12:48,五毒俱全不要妄图甩锅，先好好查查自己！        ,4
3月12日 12:45,纸包不住火了吧。。。        ,4
3月12日 19:44,什么时候他们能承认病毒来自美国。什么时候能有大国的担当，只会当搅屎棍污蔑他国，自私，双标        ,4
3月12日 12:49,呵呵呵，终于打算承认了        ,4
3月12日 12:58,看来我之前的直觉是对的！        ,4
3月12日 14:19,什么电子烟致肺炎，霉病毒研究所关闭，流感死亡人数等等……        ,4
3月12日 12:45,哦，承认了        ,4
3月12日 12:47,流感就是流感 特朗普说的！！！        ,4
3月12日 19:44,美国就是最大的病毒源        ,4
3月12日 12:47,病毒发源地，米国就是病毒发源地……还扯啥扯…… ,4
3月12日 12:45,中国,4
3月12日 17:51,不搞阴谋论，但是希望美方拿出力度来检测和防疫，不要怕真实的病例数和库存的病例数公开，还真相于公众。        ,4
3月12日 12:50,纽约时报快来表扬一下美国把新冠当流感的高端医术！        ,4
3月12日 13:05,这么说来蝙蝠和穿山甲到底给谁背了锅        ,5
3月12日 12:48,所以说，新冠到底是哪来的？我们可不背这个锅 ,5
3月12日 12:46, ,5
3月12日 19:42,之前我就这样认为，大概在春节后几天，美国朋友说流感死很多人，我就是是不是新冠死而不是流感死，如果是这样的花钱，钟南山说新冠在武汉传播不一定在中国起源这个论证是对的        ,5
3月12日 12:55,美国佬挺实在，要是国内打死也不说！既然失误，为啥不遭弹劾，国内官员有这种情况会被口诛笔伐继而下台。        ,5
3月12日 14:59,美国人最擅长的就是撒谎，去年7月紧急关闭病毒研究所，武汉军运会，秋冬季大流行，12月武汉爆发，时间线正好连上。所以病毒缘自中国，这锅我们不背？        ,5
3月12日 14:53,终于承认了  我们武汉这锅背的太沉重了         ,5
3月12日 15:48,中国为世界争取了两个月的时间，他们用来嘲笑中国        ,5
3月12日 12:59,病毒名字可能是   U.SA virus        ,5
3月12日 14:48,美国肺炎        ,5
3月12日 12:46,怎么说呢？        ,5
3月12日 12:45,所以是起源于哪呢 ,5
3月12日 12:53,等一个真相        ,5
3月12日 12:57,美国，请你大胆说出来 ,5
3月12日 15:05,一道亮丽的风景线！加油你是最多的！答应我一定要超过当季流感哦！北美病夫，实至名归！这下制造业要回流中国了！        ,6
3月12日 12:46,嗯        ,6
3月12日 21:01,所以伊朗也这么多 ,6
3月12日 14:18,看看看看，我就说嘛，跟海鲜市场没有关系。非说来源于动物，现在来源于啥动物都没搞清，就算是蝙蝠、穿山甲……一直说有中间宿主，可是却没证据，全凭猜测！！！也是服了，科学家们说话都负点责！负点责！！！连累了中国多少养殖户！！！一句话就是多少人的命运！！！        ,6
3月13日 09:08,还是有说实话的人的        ,6
3月12日 13:57,热评？全都是猜测，谣言就是这么起的。        ,6
3月12日 13:25,武汉新冠病毒的源头得从美国病毒查实了。        ,6
3月12日 23:47,我特马就大胆的说，是它是它就是它        ,6
3月12日 19:43,美国,6
3月12日 19:42,所以承认了？        ,6
3月12日 18:51,新冠肺炎发源地就是美国        ,6
3月12日 16:43,没有调查就没有发言权，这个新闻也只是说明了现在有些美国人患新冠肺炎而被误诊为流感，这和新冠肺炎的发源地有什么关系？难道是我没看懂？        ,6
3月12日 14:34,真相要大白于天下        ,6
3月12日 14:18,是不是可以叫美国病毒了？        ,6
3月12日 19:41,当时他们流感致死率那么高就很奇怪了        ,6
3月12日 19:34,原来蝙蝠是美国的中间宿主  ,7
3月12日 18:45,包不住了吧！还要说80%的人能自愈吗？那先恭喜你们！        ,7
3月12日 15:50,说了半天，还是他们那边过来的，正是怀疑是不是军运会带到我们武汉来的，害死人！而且，美国不是一直号称医疗体系完备先进么？那么多人患病，通过CT影像就能发现相同的异常，化验就会发现是不明病毒，那么久，病死那么多人，居然没有查出来？也没有专家怀疑，就坚信是流感？        ,7
3月12日 14:58,承认了承认了………        ,7
3月12日 13:54,有没有PS高手，把那啥星条旗改改？        ,7
3月12日 13:35,美国肺炎？        ,7
3月12日 12:56,？要反转了吗？        ,7
3月12日 12:50,谎言的大嘴。。过几天还咋说？？？        ,7
3月12日 12:49,细思极恐        ,7
3月12日 12:46,特朗普,7
3月13日 01:17,我有个大胆的想法，美国🇺🇸要爆发了，可能比我们还要可怕 ,7
3月13日 00:35,天大的阴谋 ,7
3月13日 00:08,打脸在即        ,7
3月12日 23:09,🇨🇳,8
3月12日 23:05,一定是美国带到武汉的，可能有潜伏期，所以才拖到12月份发现的第一粒        ,8
3月12日 13:10,鸵鸟        ,8
3月12日 13:08,特朗普,8
3月12日 12:53,很有可能新冠肺炎起源于美国！        ,8
3月12日 12:48,咦这个背景音乐 ,8
3月12日 13:05,评论区一群白痴        ,8
3月12日 12:51,自信点，把可能去掉        ,8
3月12日 21:58,要向全世界还中国人民一个清白        ,8
3月12日 19:44,美国的朋友跟我说，普通流感跟新冠不能并存，所以只要得了流感都不会感染，我？？？        ,8
3月12日 13:02,美国,8
3月12日 12:47,说实话吧 ,8
3月12日 23:30,如果是美国起的话人数不会这么少了 我们国内一起就爆发了        ,8
3月12日 12:47,#方方疫情日记# 方方在日记中写道，1月29号通过关系把侄女送出国，这就是厅级干部的特权吧        ,8
3月13日 20:08,川建国,8
