3月29日 00:38,中国人再怎么讨厌美国人，也就是在网上骂骂，不会专门针对美国人犯罪。正是美国人最鄙视的“文明未开化的封闭国家”的人民更文明。而自称民主的国家的人民更野蛮。讽刺不讽刺 ,17
3月29日 00:36,那么小的小孩子。。        ,17
3月29日 00:34,欧美主要媒体就主要祸害        ,17
3月29日 00:32,种族歧视引发美国内战争，扩散到世界 ,17
3月29日 00:31,FBI应该警告的是特朗普，不是民众！应该警告特朗普，再乱搞就狙杀他！        ,17
3月29日 00:30,煤粉纷纷迎接民主的子弹        ,18
3月29日 00:29,北方工业可以援助一批成本价的95式步枪民用版给留学生 ,18
3月29日 00:27,这仇恨来源却是川普！为了仇中，什么话都说，舆论导向误导公民！        ,18
3月29日 00:27,他们不是中国人，是美国人        ,18
3月29日 00:26,把病毒和亚裔联系最紧密的就是川普了        ,18
3月29日 00:25,其实最反中的，是那些认为自己不是中国人，确有中国人血统的人，wanwan，港独，早早就移民去外国的人（亚裔美国人），谁能在自己的土壤上好好混愿意去国外呢？肯定是在中国混不下去才出国的，去了美国，就要接受成为二等公民的事实        ,18
3月29日 00:24,还不是你们西方媒体引导的仇恨        ,18
3月29日 00:24,特朗普最先煽动仇恨        ,18
3月29日 00:19,臭不要脸的，这不就是考试给你讲个星期准备，你临时抱佛脚挂科了呗，甩锅第一 ,18
3月29日 00:18,路是他们选的，含着泪都自己走下去，别来中国        ,18
3月29日 00:18,我tm？！        ,18
3月29日 00:15,fbi warning        ,18
3月29日 00:14,应该是因为他认为这家人是中国人吧，因此读我读几遍不通 ,18
3月29日 00:14,把武器买起来        ,19
3月29日 00:13,也就美国能干出这事        ,19
3月29日 00:11,是你们自己说的中国病毒，真是双标，自己误导大众，又让大众克制        ,19
3月28日 23:51,嘿嘿嘿冥冥之中自由天意，原来是想搞事情的，结果有可能把自己搞乱了，别忘了那些也是美国人撒 ,19
3月28日 23:49,改了国籍也改不了你的皮肤，永远是群没有根的人。        ,19
3月28日 23:49,看看美国入籍宣言吧，看完就知道为啥讨厌美籍华人        ,19
3月28日 23:49,国内经济下行，贫富差距伴随经济危机进一步拉大，地缘政治频遭挑战……由此唤醒了激进的民粹主义，本质上不过是被恐惧无力挫败感占领的可悲的上层阶级的垫脚石，送你们一首义勇军进行曲挑战金融军工阶级吧未来可期        ,19
3月28日 23:47,美国真可怕        ,19
3月28日 23:45,留学生回不回国是一回事 但减少航班不让留学生回国就是你们保护中国留学生的方式吗        ,19
3月28日 23:45,这只是形式而已，实际上fbi自己也仇视亚裔        ,19
3月28日 23:44,反正都是美国国籍，可别过来哈，自己在那边玩就行了，注意安全，再见        ,19
3月28日 23:42,美国人的敌人明明是川普，明明是川普耽误了治疗，他说一句话就能转移注意力也是醉了        ,19
3月28日 23:42,飞翔的亚裔        ,19
3月28日 23:41,那些人不是喜欢人家美国吗？去吧，去舔        ,20
3月28日 23:39,难道我们就一直任由美国乱扣帽子，没有一丁点反击吗？？？        ,20
3月28日 23:39,亚裔社区要组建民团了，加强巡逻，做好狙击的准备，保护好家人和财产        ,20
3月28日 23:39,特朗普你个憨憨，赶紧想办法对付病毒吧 ,20
3月28日 23:38,还不是你们这个特不靠谱的总统造成的！！！ ,20
3月28日 23:38,问问美国总统自己之前干了说了什么 ,20
3月28日 23:37,怪我们吗？你们自己瞎跑还聚会好吗        ,20
3月28日 23:37,都21世纪了，美国竟然还有这么愚蠢的国民 ,20
3月28日 23:37,亚裔是外国人了 有不是中国人 随便外国人欺负也没中国人的事 美国内部问题        ,20
3月28日 23:37,你说有些人贱不贱，歧视黄种人，还一个劲的往美国跑，真是舔狗        ,20
3月28日 23:36,川普挑的事儿吧        ,20
3月28日 23:34,华裔们，准备好枪，和美国鬼子来一场痛痛快快的对决吧！        ,20
3月28日 23:34,//@额就是个素人:亚裔囤枪早就不是新闻了，警告什么，警察都告病假了，指望你们黄花菜都凉了 ,20
3月28日 23:33,都怪特朗普说是中国病毒！唯恐天下不乱！        ,20
4月6日 22:05,转发微博        ,21
4月5日 23:02,@筱smalllllll 美🐶，不容易啊，看在你不遗余力黑中国的份上，好心提醒你注意安全 ,21
4月4日 21:58,亚裔总觉得比国人高上一等        ,21
4月3日 22:44, ,21
3月31日 16:26,留学生要保护        ,21
3月30日 16:29,在二月歧视湖北人时，我就知道这一天也会到。当然部分战狼们觉得和他们没关系，心里肯定还乐着谁让亚洲人不在亚洲呢，活该！别急…因果循环可能晚到，但一定不缺席！        ,21
3月30日 06:19,自己为什么改国籍，纯属当年太年轻吗？ 改了国籍的人自己领悟得到这。        ,21
3月30日 02:22,原来的国家和新移民国家都不待见的人 二鬼子        ,21
3月30日 00:53,坦然面对，顺应自然和时事吧，既然有选择，做了选择，就必须承担和接受选择的后果。生来为人，不可能好事均沾，坏事全免！        ,21
3月30日 00:36,中国人就少出去亚裔的就不管他反正都移民了就是米国人了属于内战 ,21
3月29日 23:52,@财新网 @新京报 对这种事，对不断挑拨这种矛盾的美国政府，不知道你们有没有点骨气的谴责一下呢？！        ,21
3月29日 23:49,@芒果泰黃了 你来看一看呀        ,21
