2月7日 00:44,专家说接触传播多要勤洗手，邮政又不是传染病专家，快递转手最多，万一传染呢        ,13
2月7日 00:31,上面发的命令，到了下面地方领导颁布的一些措施及其不切实际，也不符合科学和客观规律。老百姓苦不堪言，如果真的是为民所想，我真的希望领导们不要拍拍脑袋就决定去做一件事，多听听百姓，和专家？        ,13
2月7日 00:30,严重支持！给快递小哥发口罩，进小区送吧。在外面等着一个个去拿，扎堆儿更危险        ,13
2月6日 23:39,我觉得还是像以前放丰巢柜方便些这走去大门口一帮人拿快递反而不安全        ,14
2月6日 23:31,我干快递的，我最受不了的就是明明快递柜就在小区大门口里面一点就是不让放，客户不在家还不让放门岗        ,14
2月6日 23:14,我们家小区就是集中堆在门口现在        ,14
2月6日 23:06,武汉一直封城，快递进不去怎么办        ,14
2月6日 22:58,请给快递小哥配防护服        ,14
2月6日 22:50,快递小哥被迫被一堆人围观        ,14
2月6日 22:41,快递不传染，快递员不一定啊，我很感谢快递员现在还奋斗在一线，但是当我接快递时，并不知道快递员之前接触过谁，并且不是每个快递员都是有素质的，例如今天碰到的那个…        ,14
2月6日 22:31,送水和送外卖的也是，本来放门口就行了，谁也接触不了谁，这下还得去小区门口去取，这感染风险不就更大了吗 ,14
2月6日 22:21,是呀，本来快递小哥带着口罩上门放家门口离开三米，我再开门取，全程无接触挺好的，这两天不让进小区，大冬天小哥在外面等的辛苦，看着都快不好意思网购了，还变成小区门口扎堆取快递 ,14
2月6日 22:19,请呼吁在各大电商买的口罩商赶紧发货吧，药店买不到口罩，网上年前买的口罩到现在还没发货！        ,14
2月6日 22:15,你们还在意时效？？？？？EMS无故丢件，明明快递出来，就说没有这个单子，能结束下吗？？？十几箱的东西，说没就没了！那个电话永远打不通        ,14
2月6日 22:11,邮政现在压根就不派送        ,14
2月6日 22:07,哇！这个领导说话很有范儿，一点也不油腻啊        ,14
2月6日 21:57,为什么不用智能快递柜呢        ,14
2月6日 21:54,世界最遥远的距离莫过于下楼到小区门口取快递和外卖！        ,15
2月6日 21:49,我的邮政快递已经一周多没动了！！！        ,15
2月6日 21:47,我只是觉得侯延波还挺帅 ,15
2月6日 21:45,副司长声音有点好听啊，我是不是关注错了重点        ,15
2月6日 21:45,对啊外卖小哥也一起进来吧 ,15
2月6日 21:36,我业主都进不去。        ,15
2月6日 21:36,我们小区现在快递外卖都得自己出去拿，前两天顺丰的快递到了都是自己出去拿，但是今天到了个邮政快递是送进小区驿站的 ,15
2月6日 21:35,支持，口罩买了也到不了，娃的奶粉有的超市买不到，奶粉又不是那么随意好更换的，有娃的应该都知道。        ,15
2月6日 21:35,其实不进去快递员最开心了，特别是楼梯小区，别问我怎么知道的，我就是知道        ,15
2月6日 21:26,同意，进来放丰巢柜，自己挑时间去拿就挺好，我倒垃圾拿快递一步到位，这样出去好几次        ,15
2月6日 21:22,附议！！！挤在一起拿真的也不安全！希望管理方法不要一刀切😭        ,15
2月6日 21:19,也请让下了班的医务人员可以回家好吗 ,15
2月6日 21:12,买的猫砂 那么重 从小区门口抬进来的 ,15
2月6日 21:06,有快递柜的真的会比人对人拿方便吧，见的人还能少一点        ,15
2月6日 21:06,我们没出去拿大家都扎堆，还面对面了！进小区敲门丢门口相反还没有接触的可能，现在变得不得不接触了！        ,16
2月6日 21:04,我们这里邮政从来不快递上门的 ,16
2月6日 21:01,最近都让我去邮局拿。。我害怕，不敢去！但是买的是酒精棉，要用 ,16
2月6日 20:57,我们小区里有快递柜 还不让快递小哥进        ,16
2月6日 20:47,#国家邮政局呼吁让快递员进小区# 快递柜容量有限，投放至快递柜很容易出现快递柜放满的情况。快递员怎么处理无法放到快递柜的快递？集中放置在一个区域，也需要有专人管理，和直接面对快递员取快递差不多。管理人员同时需要面对所有快递员和取快递的人群，防护设施需要有充分保障。        ,16
2月6日 20:45,现在也只有邮政还能发快递，其他都没有开工        ,16
2月6日 20:42,声音真好听 ,16
2月6日 20:42,我的邮政4号到了，今天也没能进来，我的酒精啊        ,16
2月6日 18:30,候？侯延波        ,16
3月10日 21:52,丰巢在小区里 小区不让快递公司进 问门卫需要什么手续 一问三不知 非常蛮横 就是不让进 哈尔滨市松北区南京路大众国际小区新辰物业        ,16
2月16日 09:14,ballball你们 明明有更好的解决方式 不要脑子一昏一刀切好吗        ,16
2月15日 14:38,怎么办啊还不解决这都几号了        ,16
2月13日 08:01,支持支持        ,16
2月8日 10:47,@佛山日报 本来接触一个人的事情，非要弄到扎堆取件，有病吧        ,16
2月8日 10:14,原本很多民众就是因为特殊时期不想出门去菜市场超市所以选择网上购物，现在快递员不让进，大家都得跑到社区小区门口取快递等同变相聚集。当前疫情严峻，口罩供应紧缺，原本不出门可以省口罩，现在出一次门拿快递就得浪费一个口罩……这种做法是不是有点矫枉过正了？希望能出来更方便有效的方式        ,16
2月8日 04:46,我家楼层低，每次顺个筐拉上来就行，这自从不让快递进来，一天浪费两三个口罩，关键口罩也不保证一定安全啊！门口一堆人取快递，真的太危险了！        ,17
2月8日 04:43,希望明天就有让快递进小区的官方通知        ,17
2月7日 22:54,快递就应该停，整个物流线多少人接触，而且一个快递员感染，要接触多少人，就跟之前那个外卖的感觉一样        ,17
2月7日 18:57,转发微博        ,17
2月7日 16:08,支持，没有快递文明都要退化了。        ,17
2月7日 15:59,@快乐的千千r: 物业很辛苦  天天小区消毒 入口管理 都是在配合社区工作 他们也是为了业主好 还这么多人不理解 他们自己不都是接触各种人吗？进出方便又要说管理不善了 特殊时期配合一下        ,17
2月7日 15:58,非要买快递赖谁?        ,17
2月7日 15:46,原本快递放门口 等快递员走了开门拿 就可以无接触，现在下楼反而会遇到很多人，而且大件快递自己根本提不动 ,17
2月7日 14:35,一边不要出门，一边不让快递无接触式送货，然后大家都需要带着口罩出去拿，聚集在一处搞个聚集式传染么？        ,17
2月7日 12:30,所以什么时候可以发湖北 ,17
2月7日 11:48,是啊！我没口罩        ,17
2月7日 11:35,我收快递都是让快递小哥放家楼梯口，等他走了我再去拿。        ,17
2月7日 11:21,我们小区放蜂巢智能柜，这个智能柜也是刚安的        ,17
2月7日 11:07,不进小区太麻烦了，取快递我们浪费一个，多买几个快递多浪费几个，小区有柜子可以放，这样完全没有接触，而且拿快递人就扎堆。这样搞好多人干脆不买了，不买的后果就是得出门买，这不是隔离容易感染，好不容易待家里不出门了，现在又赶我们出去吗        ,17
2月7日 11:04,就是啊，应该让进，安全些        ,17
2月7日 10:49,百分百同意，快递拿不了快憋疯了        ,18
2月7日 10:24,发言人好帅！有气质！ ,18
2月7日 10:21,为侯司长点赞。        ,18
2月7日 10:18,默默的让快递员给我改了时间，啥时候能放箱子或者驿站啥时候投递，吃的买的京东的，乡镇房子就在路边开车路过放路边就走        ,18
2月7日 10:15,你们竟然还能去收到快递？我老公说我不怕死天天买，现在杜绝我网购了        ,18
2月7日 10:14,三个邮政快递不给我打电话就签收了，半个月都自动确认收货了，我还不知道快递在哪 ,18
2月7日 09:58,浪费我的出行卡啊……        ,18
2月7日 09:57,真的 在新疆买了口罩补邮费顺丰一路飞机 结果卡到了本地的快递点不让送真的        ,18
2月7日 09:55,别买东西呗。快递去的地方多，见到的人也多。传染高        ,18
2月7日 09:38,我的东西在隔壁丰巢5天了，硬是不给我进去拿快递，快递员也不给进。。。        ,18
2月7日 09:34,想请丰巢，速递易到小区多多装点柜子        ,18
2月7日 09:08,这种时候就应该让快递员进小区，以前我家这里不让进，快递员在外面等，拿快递就是一堆人在那里拿，更危险        ,18
2月7日 09:06,对啊，全部出去门口还是聚集在一起啊，快递量体温进来放门口，还可以省好多口罩啊。现在取个快递都要浪费一个个口罩        ,18
2月7日 09:00,坚决不让        ,18
2月7日 08:43,我们这除了邮政都快递不送了，关键是大家也不购物了，买啥？口罩啥的网上都征用了该退款的都退了，这个时候还在家里买衣服？        ,19
2月7日 08:33,同意！！        ,19
2月7日 08:27,我老公就是送快递的，不让进门，他都说这样不好        ,19
2月7日 08:20,强烈支持        ,19
2月7日 08:18,花白头发        ,19
2月7日 08:18, ,19
2月7日 08:11,真的是！快递不让进，我还在上班，现在什么都不敢买了        ,19
2月7日 07:42,可怕的是不是快递包裹，而是快递员是不是潜在病毒携带者，有可能他也不知道自己什么时候感染的。        ,19
2月7日 07:39,所有快递京东都不能进小区，一个电话，我们都得出去，出去拿快递，又得碰到一群人，唉……        ,19
2月7日 07:39,一点都不相信这些开新闻发布会的人说出来的话 ,19
2月7日 07:27,有驿站却没上班，快递员不送上门，只能在外面拿 ,19
2月7日 07:22,我们小区三个门都不让进车 拿个快件戴上口罩骑着小电驴去小区门口 快递小哥从障碍物上扔进来我再拿 ,19
2月7日 07:19,现在寄快递好麻烦，我们这里邮政不上门取件，说是他们领导要求的，疫情严重要减少接触。而且这时候寄快递每一个快递加收10块钱。        ,19
2月7日 07:13,放门口不行吗        ,19
2月7日 05:30,昨天两个快递分批来的，浪费了两个口罩，回来就是消毒，里外衣服全洗，然后洗澡，最主要是每个人都聚到一起取快递，风险更大了。        ,20
2月7日 05:28,附议        ,20
2月7日 04:40,快递员也是人啊        ,20
2月7日 03:29,还是算了 收快递到现在只有邮政的是要把我的快件放到隔壁小区的快递柜 从没让我失望过 也只有这次疫情爆发后 是送到我们小区门卫室了        ,20
2月7日 03:12,你能做到吗？你听明白了吗？ ​​​        ,20
2月7日 02:57,我的快递已经好几天没有更新过消息了。。。        ,20
2月7日 01:57,就是啊！好不容易蹲到的口罩还要靠邮政过来阿里大药房不肯改顺丰 ,20
2月7日 01:47,同意，明明我们小区有丰巢柜，病毒又不会在快递里面，不需要快递员面对面不是更好避免吗？现在快递每天在外面等，根本送不了多少        ,20
2月7日 01:35,我们这里封城了，尿不湿奶粉快递到半路停了        ,20
2月7日 01:22,强烈同意！！！        ,20
2月7日 01:03,我快递三天没动静了🙃        ,20
2月7日 00:56,快递集中接收点→人群聚集接触点→高风险传播点        ,20
2月7日 00:41,门都不让出了，还能有快递        ,20
2月7日 00:41,我们小区有速递易 快递员还是进不来        ,20
2月7日 00:39,不让进丢门口地上更可怕        ,20
2月7日 00:39,🎖🎖🎖建议把小区内的蜂巢箱子搬到小区门口 这样无人接触 或者保安设置领快递一米隔一米排队线        ,21
3月10日 21:52,丰巢在小区里 小区不让快递公司进 问门卫需要什么手续 一问三不知 非常蛮横 就是不让进 哈尔滨市松北区南京路大众国际小区新辰物业        ,21
3月10日 18:12,为啥国家邮政总局的呼吁被当做放屁没人愿意执行！        ,21
3月10日 18:10,我们小区不让快递员进小区！物品都堆放在门口被偷后居委说这个不负责任的！还有快递员不能进小区却让房产中介带人进小区看房！知道这是为啥吗？房产中介给了好处呗！所以----呵呵！        ,21
3月9日 21:09,快递进小区吧        ,21
3月9日 21:09,支持        ,21
3月8日 01:10,如今大家都在门口的快递堆里头翻啊翻......我已经有好久没看见过小区入口像如今那么热闹！ ,21
3月8日 01:05,回复@G91R815:理想很丰满，但实情是,21
3月5日 07:46,快落实啊        ,21
3月3日 15:19,武汉的害了整个湖北。        ,21
3月10日 21:52,丰巢在小区里 小区不让快递公司进 问门卫需要什么手续 一问三不知 非常蛮横 就是不让进 哈尔滨市松北区南京路大众国际小区新辰物业        ,22
3月10日 18:12,为啥国家邮政总局的呼吁被当做放屁没人愿意执行！        ,22
3月10日 18:10,我们小区不让快递员进小区！物品都堆放在门口被偷后居委说这个不负责任的！还有快递员不能进小区却让房产中介带人进小区看房！知道这是为啥吗？房产中介给了好处呗！所以----呵呵！        ,22
3月9日 21:09,快递进小区吧        ,22
3月9日 21:09,支持        ,22
3月8日 01:10,如今大家都在门口的快递堆里头翻啊翻......我已经有好久没看见过小区入口像如今那么热闹！ ,22
3月8日 01:05,回复@G91R815:理想很丰满，但实情是,22
3月5日 07:46,快落实啊        ,22
3月3日 15:19,武汉的害了整个湖北。        ,22
2月26日 11:59,拿着快递的工作证也不让进，哈尔滨市香坊区安埠小区        ,22
