2月26日 23:24,#白岩松谈武汉来京女子确诊新冠肺炎#尽快公布，信息透明才能让大家安心🙏🙏这么多人牺牲很多把自己关在家里，却有人可以封城了还跨省，这让大家会有不安心的！        ,15
2月26日 23:24,岩松老师说的都是重点        ,15
2月26日 23:03,那个，这个病毒是不是已经发生变异了啊，总感觉国外的死亡率比较高啊        ,15
2月26日 22:48,哦        ,15
2月26日 22:46,好奇怪啊…        ,15
2月29日 16:01,同问，到底是哪里出现漏洞，把确诊病人放出来。希望武汉政府给公众一个详细的解答，止息漏洞的恐慌。        ,15
2月27日 18:59,武汉确诊患者竟然一路绿灯回到北京社区，令人震惊！必须尽快查清事实，依纪依法从严处理，及时回应社会关切。        ,15
2月27日 17:18,确诊居然还能过层层关卡，此人背景6阿！帮他的官员胆子可以 ,15
2月27日 16:57,羡慕京城百姓，有声响必有回应。浙江省乐清市民强制扣押骨灰，禁令逝者入土安葬。全省市景区商城开放，婚姻登记都开门了，乐清市政府一刀切政策，逝者不能安息生者不能重新开始生活。活在新闻里安居乐业的人们挣扎在生存线，现实中的特权阶层畅行无阻。        ,15
2月27日 14:30,此案发生后，____ 高度重视，立即连夜召开____会议。____立即作出____，要求组织____，妥善处理___，迅速查清____，严肃追究____；立即组织开展_____，进一步做好____，防止_____。目前，____情绪稳定。____深感内疚，自责，痛心。        ,15
2月27日 13:40,有人有权就是不一样🙈        ,16
2月27日 12:19,奋斗在一线的医护人员vs破底线的刑释确诊“特权”        ,16
2月27日 12:06,我在家闷了这么多天不打紧，就问问你这样的事对得起那些死去的医生吗？？？        ,16
2月27日 10:55,这从热搜第一降到最后了，效率可硬呀！！！我这一个消息发出去之后，估计热搜就看不到这个消息了。        ,16
2月27日 10:08,权利是他们的直升飞机 ,16
2月27日 09:54,更加心疼那些在高速上不能下来的人了……        ,16
2月27日 09:47,大奔怎么进故宫的，她就怎么回北京的 ,16
2月27日 09:32,这么一查  关系牵连户少不了。希望尽快给人民一个负责任的答复！        ,16
2月27日 09:20,查!!!        ,16
2月27日 09:04,我还疑惑的是微博你为什么要降这个热搜呢！爆个真实就这这这么难吗！有什么隐情吗？@微博管理员 ,16
2月27日 08:59,谜一样的武汉啊 ,16
2月27日 08:58,不知道是哪家的，这么厉害！        ,16
2月27日 08:54,细思极恐        ,16
2月27日 08:54, ,16
2月27日 08:54,1出狱后一路顺畅，与被困高速26天农民工形成鲜明对比，武汉要查，北京也要查。2武汉该监狱是否已大范围感染。3需要新闻1+1这样的节目，需要白岩松这样的人 ,16
2月27日 08:39,看看青岛好吗？韩国航班有人接就不需要专车点对点送回住处，大部分全是自觉回家隔离。请问除了事情怎么办啊！看看青岛好吗 能不能强制隔离 检测核算啊？能不能抄烟台威海作业啊？？看看青岛吧        ,17
2月27日 08:29,天亮了，不谈世间那些不公了，中央监察委关于李文亮医生的调查进展可以公布一下了吧？        ,17
2月27日 08:25,无论涉及谁 应一查到底！ ,17
2月27日 08:25,必须追究随意放走女子离汉的相关责任人，给社会公众一个明确的交代！！        ,17
2月27日 08:24,18号已经有发热症状，22号由家人开车从武汉接回北京。就想知道，这一家是怎么冲破这戒备森严的封锁线的呢？就爱白岩松，说的直击要点，问的又特别关键！ ,17
2月27日 07:59,济宁任城狱警的儿子为什么回来，怎么回来的，现在他们全家插管了吗？能去采访一下吗？        ,17
2月27日 07:56,山东济宁任城那个狱警儿子是怎么从武汉回家的？        ,17
2月27日 07:48,希望每天发布的确诊数字是准确、真实的！不要为了配合全国形势而瞒报数据。        ,17
2月27日 07:48,新闻一加一、白岩松牛🍺        ,17
2月27日 07:42,漏网之鱼        ,17
2月27日 07:40,顶顶 ,17
2月27日 07:35,刚刚刑满释放，可能又要进去了。        ,17
2月27日 07:30,服满刑 就能离汉抵京？ 在武汉全城封闭的情况下，这是什么操作？        ,17
2月27日 07:16,我们这里就有一对夫妻充武汉回来的，也不知道怎么回来的        ,17
2月27日 06:32,真是害人害己，有了症状还往外跑，怎么可以这样？自己不想活也拉上别人吗？自己的家人也不管不顾了吗？        ,17
2月27日 06:29,家里人难道不怕？？？        ,18
2月27日 06:14,新冠肺炎，就是聚光灯+放大镜，以前的漏洞纷纷曝光。        ,18
2月27日 05:26,因为这件事，很多地方又是一刀切，越来越严厉了 ,18
2月27日 05:21,好不容易其他地方防控的没有新增，却真的都陆续出院，这么整啥时能到头        ,18
2月27日 04:39,严惩片区负责人！        ,18
2月27日 03:26,早就想说了，全国都在封村封路封城，就看到最严重的湖北省人员出行无阻，真是讽刺。        ,18
2月27日 02:22,哎呀我去，堵住权利的漏洞！        ,18
2月27日 02:00,#白岩松谈武汉来京女子确诊新冠肺炎# 还是那句话，信息公开是最好的“疫苗”，也是最好的释疑。否则，只会给造谣者空间今天白天，或许就有调查结果了        ,18
2月27日 01:49,高德地图搜新怡家园......        ,18
2月27日 01:36,支持疫情信息公开透明化，让民众安心        ,18
2月27日 01:27,关注！        ,18
2月27日 01:23,我也想问，最近是怎么会有湖北的跑来长沙的？？？？不是封城了吗？        ,18
2月27日 01:17,彻查！！！        ,18
2月27日 01:07,希望大家安心 ,18
2月27日 00:58,请严查！！！        ,18
2月27日 00:40,查完了最起码给个像样的交代 先前的🚗事件不了了之 不是明着让民众失望吗？        ,19
2月27日 00:24,有权有势有钱的人        ,19
2月27日 00:16,蜀道难难于上青天，难不过一犯罪分子黄女士。然而一个犯罪分子能在确诊，封城的前提下出武汉出湖北一路北上挺进京城进小区，简直厉害过修仙打怪的小说主角[哇]湖北魔幻现实主义持续上演 ,19
2月26日 23:29,武汉不是封城吗？什么尚方宝剑呢！！？？        ,19
2月26日 23:05,对啊，她是怎么从武汉到北京的？        ,19
2月26日 23:01,一定要严防死守呀！        ,19
2月26日 22:51,快点查明，堵住漏洞        ,19
2月26日 22:51,卧槽！我们小区也有一个从武汉回来的 ,19
2月26日 22:51,传送阵 ,19
2月26日 22:50,黄女士  是谁 ,19
2月26日 22:49,谢谢白老师 堵住漏洞        ,19
2月26日 22:46, ,19
2月26日 22:46,emmmm…        ,19
2月26日 22:46,....警惕        ,19
2月26日 22:46,？？？？？ ,19
2月27日 06:59,中国早晚被这些蛀虫啃烂        ,20
2月27日 06:32,一个刑满释放确诊人员，被家人用自驾车从“严密防控”的武汉带回了北京…绝对是大牛！我们想知道牛的是权力？人情？利益还是手段？ ,20
2月27日 02:18,我们一群武汉市民特么连单元门都出不了，你给我说你开车回北京了 ,20
2月27日 00:48,对，顺藤摸瓜，严查根源，堵住漏洞！看是什么人什么关系可以在如此严的防控形势下，突出重围。        ,20
2月27日 00:47,我们天天去小区门口取个快递回来都要看出入证，也不知道这位咋过五关斩六将回来的 ,20
2月27日 00:38,微博热搜什么时候能少点韩国明星的，多点关心社会的啊，明星的天天挂，有用的一会就撤了        ,20
2月27日 00:34,想想在这种时候能把车开进湖北、开进武汉，再把疑似病人接到，然后原路返回，没有天大的权力能做到？        ,20
2月27日 00:29,问，也得不到结果。猜，只能越来越愤懑        ,20
2月27日 00:22,和她关在一起的狱友或狱警也危险了。        ,20
2月27日 00:20,有人在前线拼命，有人在后面挖坑，可是挖坑的人究竟是谁呢？细思极恐！又心寒        ,20
2月26日 23:50,这件事从热搜上下来了 ,20
2月26日 23:41,就想知道她是如何出的武汉，又是如何进的北京？        ,20
2月27日 12:30,白岩松和水均益总分不清        ,20
2月27日 11:29,成都从韩国来的航班80个韩国人直接量体温就放行了。而本地人回成都要隔离15天，现在疫情这么严重，能不能关注下。        ,20
3月5日 11:22,必须严谨处理，法不容情        ,20
3月1日 13:00,好几天了，怎么没有后续报道了？        ,21
7月7日 20:14,其实 有什么可查的呢 离汉抵京那么多关卡通道 肯定是收到通知才敢放走的        ,21
6月20日 19:33,这个结果是啥啊        ,21
5月30日 20:27,黄  婉        ,21
3月17日 20:46,现在调查结果出来了吗        ,21
3月15日 15:05,结果呢，出来了么？查出来了么        ,21
3月13日 06:57,后续报道呢        ,21
3月12日 09:18,吃退烧药，然后……额温枪你们知道的，就是个摆设，腋下量39度，实在通风情况下，额头你自己手摸都知道不热！        ,21
3月11日 22:46,在看他的《白说》，1分钟说一分钟的量，背景，陈述，实质问题，现况如何，一分钟...        ,21
3月11日 18:08,指挥部防控人员还是有工作扯皮，行动缓慢问题还是存在的。        ,21
3月10日 23:55,等待真相        ,21
3月10日 19:09,这家人能耐啊，应该安排他们去敌后战场当侦察兵        ,21
7月7日 20:14,其实 有什么可查的呢 离汉抵京那么多关卡通道 肯定是收到通知才敢放走的        ,22
6月20日 19:33,这个结果是啥啊        ,22
5月30日 20:27,黄  婉        ,22
3月17日 20:46,现在调查结果出来了吗        ,22
3月15日 15:05,结果呢，出来了么？查出来了么        ,22
3月13日 06:57,后续报道呢        ,22
3月12日 09:18,吃退烧药，然后……额温枪你们知道的，就是个摆设，腋下量39度，实在通风情况下，额头你自己手摸都知道不热！        ,22
3月11日 22:46,在看他的《白说》，1分钟说一分钟的量，背景，陈述，实质问题，现况如何，一分钟...        ,22
3月11日 18:08,指挥部防控人员还是有工作扯皮，行动缓慢问题还是存在的。        ,22
3月10日 23:55,等待真相        ,22
3月10日 19:09,这家人能耐啊，应该安排他们去敌后战场当侦察兵        ,22
3月10日 18:11,现实版，穿越火线 ,22
