2月26日 22:55,热搜被撤了，没想到《新闻1+1》这么给力啊 ,1
2月26日 22:46,慎思极恐，那一路接触的人该怎么办……        ,1
2月26日 22:46,武汉封城了还能出来？？        ,1
2月26日 22:47,18号已经有发热症状，22号由家人开车从武汉接回北京。就想知道，这一家是怎么冲破这戒备森严的封锁线的呢？        ,1
2月26日 23:49,没别的！我就爱白岩松，说的直击要点，问的又特别关键！        ,1
2月26日 22:46,量子转移来的，你们别问了 ,1
2月26日 22:46,一个敢放一个敢收        ,1
2月26日 22:49,有的人被迫封在武汉捡剩饭，有的人确诊了还能离汉进京        ,1
2月26日 22:53,请到宁夏抄作业,1
2月26日 22:46,白岩松就是问得都是大家关注的        ,1
2月26日 22:47,尽快公布吧，不要对不起那些辛苦的医生和护士们，人家拼了命在前线，后方天天添堵        ,1
2月27日 00:03,真的可怕😱，我们连小区都出不去，她倒是能穿过那么多的关卡，大家都看不见吗？？？        ,1
2月26日 22:48,白岩松真的敢说啊……人情，权利        ,1
2月26日 22:49,这一路北上，应该可以拍一部大片了！这都帮他取好了~封城榜        ,1
2月27日 00:10,弱弱的问下  前几天武汉突然发出的解锁交通管制跟这个有没关系 ,1
2月26日 23:41,突然想起那个流浪在高速的湖北司机了封城政策没怎么变，怎么这位就能轻松出去？不解释清楚，政府公信力何在？        ,2
2月26日 22:52,你对得起挂在树上村长的大喇叭吗？🎉 ,2
2月26日 22:50,请尽快公布结果，给为了抗疫30多天没出门的人民群众一个说法！        ,2
2月26日 23:30,住在12万每平北京二环内的小区，肯定这位皇女士背景深厚无疑了，但是那个小区和临近小区的邻居们又有哪个会是普通人？这件事直接威胁到他们的安全，肯定不会善罢甘休。        ,2
2月26日 23:33,所有的政策只针对我们这些没权没势的平民对吧 ,2
2月26日 23:04,“严控离汉通道”？“确诊应收尽收”？—-原来是说说而已！        ,2
2月26日 22:46,迷惑        ,2
2月26日 22:46,最好的白老师 ,2
2月26日 22:50,佩服白岩松，问的问题都在关键点上        ,2
2月26日 22:45,警惕外来输入...        ,2
2月27日 00:33,同问2月8号武汉出来的那个小伙，自称步行到高速搭车到了上海是怎么回事        ,2
2月26日 23:00,当武汉、湖北人都眼巴巴的关在家里等着盼着政府的解封令的时候，她们如何做到的，谁在配合？凭什么？        ,2
2月27日 01:30,这事盖不掉了，终于啊，坐等结果        ,2
2月26日 23:15,所以这位H女士是和她的家人有多大仇，确诊了从武汉到北京一路上，吃饭喝水休息，车内空间密闭，传染家人不是分分钟？而且好像开车接她的还是她的儿子？？？        ,2
2月26日 22:47,这个问题是值得深思，你们觉得呢 ,2
2月26日 23:05,可以拍电影了，名字我都想好了“突出重围” ,3
2月26日 22:48,这又是谁的闺女，谁的媳妇？        ,3
2月26日 23:29,病毒狠狠检验了打击腐败特权的成果        ,3
2月26日 23:22,看来黄女士不是一般人啊，一般都叫黄某。而且，评论个微博都得筛查后才能显示。        ,3
2月26日 23:35,不要急，理由和原因还在编，很快就出来了。已经确诊了怎么样都不可能出来的吧？不在当地治疗，还带回北京，还回小区？都确诊就算回来为什么不直接送医院？还有转院？不是有关系怎么可能？看看住的小区就知道家里不一般。        ,3
2月26日 22:46,问题是怎么来的北京？        ,3
2月26日 22:52,到底怎么杀出重围的？怕不是拔出萝卜带出泥？ ,3
2月26日 23:37,贫汉捡剩饭，权门通无阻 ,3
2月26日 23:48,恕我直言这件事将会跟之前的奔驰男或者奔驰女一样，会不了了之。大事化小，小事化了。都在说她是服刑人员，有证据吗？不管你们信不信，反正我是不信。我们大多数网友活得还不如一个服刑人员。。中国加油！        ,3
2月26日 22:50,都H女性了，还指望能查出来？呵呵        ,3
2月26日 23:40,一个月前大家讨论北京故宫，一个月后大家在讨论北京黄某 ,3
2月26日 23:58,胸口闷着一口老血都要被气的吐出来了，我们一个湖北地级市，连社区都不可能让出的，怎样的背景确诊病例居然可以在这个节骨眼上从武汉去了北京，那可是武汉和北京呀！！！！！        ,3
2月26日 23:43,你说她有手段吧她压不住消息 你说她没点手段吧她又从武汉出来了 ,3
2月26日 22:46,这事有点蹊跷，坐等官方解释。        ,3
2月26日 22:48,我连出小区小区都费劲(不是疫情重点城市)她咋跑那么远的        ,3
2月26日 22:46,还是要高度注意，这会不能大意        ,4
2月26日 22:47,希望被发现的这个是唯一的一个 ,4
2月26日 22:51,白岩松是个优秀的媒体人，问的都是老百姓内心最想得到解答的问题        ,4
2月26日 23:42,我们作为普通老百姓，我们要说法，必须给我们一个说法，这到底是怎么回事？我们遵纪守法隔离，登记，测体温，难道是给这些人让路的？难道是给他们屏蔽的？到底怎么出的武汉？又怎么进的北京？进-出两个城市防控都有很大的疏漏，必须给个说法，否则这些遵纪守法的公民是不是太憋屈了？        ,4
2月26日 22:46,这倒是稀奇事哈 ,4
2月26日 23:07,就老实待在武汉治疗呗，怎么发热了还上北京(这人刚发热时是在武汉呀)？！是怎么出武汉的(武汉一直在封城)？？怎么出湖北的(湖北各地以及各省市交界处都有排查关卡)？？又是怎么进入北京的(这层层关卡是怎么给她一路开绿灯的)？？应该好好查一下！！        ,4
2月26日 23:33,白岩松也太硬核了 ,4
2月26日 23:44,太喜欢白岩松的这段新闻了!我们武汉居民还在武汉城中苦苦挣扎，每天还有新增和死亡!这么严密的值守，竟有人可以去北京!一线医护人员冒着生死在抢救病患，这怎么可以……?        ,4
2月26日 23:20,主要是亲属这个开车的亲属咋这么腻害？        ,4
2月26日 23:10,背后一定有关系，这绝对不是第一粒，也不可能最后一粒，一定要彻查到底，揪出来        ,4
2月27日 00:06,疫情就是面镜子 照出了世间百态 也照出了人与人之间的天壤之别        ,4
2月27日 00:37,她和她的家人挑战的是全国人民的底线……        ,4
2月26日 22:58,武汉来京女子确诊新冠肺炎。在如此防控严密的情况下，她是怎么能够从武汉回到北京的？        ,4
2月27日 00:05,根据第一财经，黄女士需要①防疫工作需要才能进出武汉何况她是出狱②已经发热了疾控怎么放的人③通过了武汉到北京的所有入口可能的体温检测④发热确诊了还能从北京高速进市区⑤北京小区入口体温检测那关，这5步难于上天但她完成了✅        ,4
2月26日 22:55,没啥惊讶的，有头有脸的来路呗 ,4
2月26日 23:21,赞《新闻1+1》👍👍👍        ,5
2月26日 22:49,大奔来了。        ,5
2月27日 00:07,由此可见武汉封城，封的只是普通老百姓啊！苦的也只是普通百姓！        ,5
2月26日 23:39,联系昨天看到的在武汉务工人员 无法返乡 居无定所 流浪街头的视频         ,5
2月27日 09:42,请问她是遁地走的吗！？从湖北到北京这么多关卡，为什么都能顺利通过！水太深了！        ,5
2月26日 23:20,不要忘了还要查北京哦，都脱不了关系        ,5
2月26日 23:21,细思极恐，你仔细品，这得越过多少重关卡顺利回到北京啊        ,5
2月26日 23:24,白岩松一针见血，问题分析的很透彻，很明了，很尖锐，希望早些公布实情。        ,5
2月27日 00:50,白岩松敢说，也得有人让他播，看到的都是想让你看的        ,5
2月26日 23:46,啊呀老领导您放心，闺女能安全回家 ,5
2月26日 23:17,开奔驰车进故宫炫酷的事件已经不了了之，这件事应该不会吧?        ,5
2月27日 08:44,所以真相是啥？？        ,5
2月26日 22:51,17号令，3小时出来多少人，希望也能查清楚        ,5
2月26日 22:49,先是驾车进到武汉，再从武汉带人出来，途经武汉、湖北、河南、河北、北京~到东城，又进小区，往返近2400公里、六大关卡，真是最牛突破封锁线！ 还是说武汉封城是“筛子”、北京管控是“样子”？这啥背景啊这N13 ？！        ,5
2月26日 23:42,国务院联防联控机制,5
2月26日 22:55,这一路得接触了多少人啊？都这样不是前功尽弃了吗？ ,6
2月27日 00:29,超出了一个韭菜的思考范围        ,6
2月26日 23:39,看到的是各种堵漏的千疮百孔，湖北各个层级官僚的各种表演        ,6
2月27日 00:01,是回北京以后确诊的。但是在武汉时已经有发热症状了，好奇为什么没有作为疑似人员在武汉就被隔离起来，还突过重重关卡回到了北京 ,6
2月26日 22:51,一针见血，希望尽快有结果 ,6
2月27日 09:35,封不住权力        ,6
2月27日 01:35,李文亮医生的事 调查的怎么样了        ,6
2月26日 23:38,这事我们最后知道的肯定不会是真正的真相了。危机公关现在正在编吧。        ,6
2月26日 23:05,北京的车怎么自驾进的武汉城？随便进吗        ,6
2月26日 22:49,从武汉一路畅通无阻的进入了北京的小区 让我们每天领出入证上班的人情何以堪        ,6
2月27日 00:10,不论因为什么原因都不能在这个时候搞特殊走后门离开武汉，不然让哪些需要化疗放疗透析而不得治但坚守的武汉人怎么想，他们用生命帮抵御病毒扩散，这会让大家寒心的。不能总是欺负听话的守规矩的人！        ,6
2月27日 00:09,权利，背景！呵！后盾之大！让我们这些被封在武汉的百姓心散！有钱真的可以为所欲为事实证明！        ,6
2月26日 23:39,那么多英雄因此牺牲在第一线，而有些人却还是自私自利，欺上瞒下，肆意妄为…白岩松说的对啊，堵住漏洞，不过漏洞好不好堵，又堵的上堵不上可就难说了！        ,6
2月26日 23:26,坐标武汉，我们小区都出不去，开车出去产检的时候还有警察拦，不懂这个人怎么出去的， ,6
2月26日 23:26,来的地方不一样，靠天安门太近了，赶紧查吧，等待调查结果。        ,7
2月26日 23:26,在离汉通道关闭的情况下，这位女士是如何出的城？这个必须要查清楚，太令人不解了！如果这种形势下还可以随意出入武汉，那真就让人感到害怕了！        ,7
2月26日 23:24,黄女士，不是黄某        ,7
2月26日 23:04,信息公开透明才是最好的解决办法 不知道上过多少当 记吃不记打有些官媒的那个宣传还不如大学板报办的好 真的是服了  一个劲儿踢皮球只会越来越让真相和谣言混为一谈 到时候你想分也没人会再有精力来看你了        ,7
2月26日 22:56,传染病本来隔离就是最有效的方法，特别是对新的病毒不了解没有特效药的情况下，防止传染人数大爆发的唯一最有效的方法就是隔离        ,7
2月26日 23:29,这一路的操作都是想不通的，怎么进武汉的？在武汉发热确诊医院不留下？出院了？怎么出的武汉？怎么进的北京？又进了小区？当天晚上才拉走？        ,7
2月26日 23:24,武汉政府到底还有多少漏洞？？这种事态下依然不少顶风作案的！之前武汉发布了几个小时的通行令，是否有关系？就问她怎么出来的？？        ,7
2月26日 23:20,1，封城条件下可以自由进出武汉；2，疫情如此严控情况下，可以自由转移并从武汉带出已经确诊的新冠病人；3，反复发烧5天的病人，武汉到北京的换卡一路顺畅；4，进京，进小区，带着病人，一路畅通这样的人，湖北司法厅，真的能查出来什么吗🤔        ,7
2月26日 23:42,白岩松说的真好 已经有发热情况 怎么出来的 又怎么进京的        ,7
2月26日 22:56,前提是她知道已确诊，要是北京防控不严的话，是必会出大事。主要是她们的目的是什么？        ,7
2月26日 22:59,"任何理由都不成立！前提是""封城""全中国14亿同胞自动禁足！国家按下暂停键！        ",7
2月26日 22:55,北京那个小区房价…嗯。        ,7
2月26日 23:38,白岩松最近一直出来直播也辛苦了        ,7
2月26日 23:35,白岩松👍新闻1+1👍希望能看到真实的调查结果公布！        ,7
2月26日 23:24,好，不愧是白岩松 ,8
2月26日 22:53,   白岩松老师     这一刻我爱上了新闻1+1 ,8
2月26日 22:49,白老师真的很牛🍺 赞一个        ,8
2月26日 23:45,我觉得白哥是我最喜欢的新闻主持啦 ,8
2月26日 23:38,白岩松，业界良心，大哥，受我一拜 ,8
2月26日 23:00,今日我就开始感受到了松懈！不止北京，广州也一样        ,8
2月26日 23:01,看来网友的质疑官方还是会看的        ,8
2月26日 23:47,白岩松好样的！真的勇士！敬佩！        ,8
2月26日 23:47,这次热搜又回来了，我看看啥时候能撤        ,8
2月26日 23:41,三个健康人 千里接病毒回去传播 辛苦了 ,8
2月26日 22:50,很好，敢说！ ,8
2月26日 22:53,出现了漏洞就要问责，人民群众的眼睛是雪亮的！        ,8
2月26日 22:57,严查所有失职渎职人员！对这种如果属于故意传播病毒该判刑绝不手软！        ,8
2月27日 01:03,比起她是如何回北京的，我更想知道她是谁，因何坐牢，坐牢前工作是什么，她爸爸、公公、丈夫都是干嘛的。这些搞清楚，其他疑问多半就都清楚了。        ,8
2月26日 23:00,武汉封城了，车是怎么进去的？又是怎么出来的？我们村都把守严格着呢！怎么从监狱出来而且已经有症状，还往北京跑？对的起好几万重全国各地支援武汉的医护人员吗？添乱 ,8
2月26日 22:50,所以在武汉封城的情况下，她是怎么从武汉出来到北京的！？        ,9
2月27日 01:22,北京这次做的挺差的，这样都能放进来。我们小区里面天天已经开始有老人待着小孩楼下转悠  不戴口罩  随地吐痰了        ,9
2月26日 23:43,黄女士，不是黄某，挺不错        ,9
2月26日 23:33,对得起那些苦苦坚守的武汉人吗？        ,9
2月26日 22:48,人为，可操作，就存在很大的漏洞。 ,9
2月26日 22:47,漏洞很多……        ,9
2月26日 23:44,至少是可以故宫开奔驰的        ,9
2月26日 23:10,就想知道已经确诊的病人是怎么从已经封了城的武汉回到北京的？刑满释放就可以不隔离么？ ,9
2月27日 00:57,这些消息真是激励我好好备考公务员 ,9
2月27日 00:18,病毒是来反腐败的吧！？        ,9
2月26日 23:37,群众都瑟瑟发抖，害怕呀        ,9
2月27日 08:44,#抗击新型肺炎我们在行动# 令人纠结。        ,9
2月27日 00:43,这件事最可怕的地方在于 ,9
2月26日 23:15,早发现早隔离早治疗啊，真的不懂那些不去就诊还要跑的人，还想不想治愈了        ,9
2月27日 00:03,已经确证了还能出武汉，还能一路跨过这么多省，开车到北京 ,9
2月26日 23:38,一定要查清楚 不能因为个别人个别漏洞 毁坏全国一盘棋。        ,10
2月27日 00:10,湖北真的黑透了送病毒去北京，这是要团灭中国吗 ,10
2月26日 22:50,堵住防疫监管部门的漏洞吗？这样的事情还有多少，这个是大家知道的，还有不知道的呢？应该追查到底@人民日报 @紫光阁 @中国新闻网 不知道能否有结果 ,10
2月26日 23:39,为什么是接到北京去？不是其他地区，值得深思        ,10
2月26日 23:37,今天的两个个例，一个从武汉到北京，一个从伊朗转了好几个地方到宁夏。个例反映的是我们当前联防联控中可能存在的漏洞，同时给一线防疫人员增加了更大的工作量！ 更提醒大家疫情还未结束，不要放松警惕，做好防护少聚集！希望只是个例。🙏        ,10
2月26日 23:35,我觉得伊朗那位副部长说的很好,10
2月26日 22:48,特异功能！！        ,10
2月27日 00:34,应勇都批示了彻查，希望不要被北京压下来不了了之。        ,10
2月27日 00:22,一边前线医务在拼命，基层部门在死守，老百姓个把月不出门，这边是像隐形人一样无阻碍，一次灾难刷新我的三观        ,10
2月27日 00:57,开车入京申请入京证时不用体检吗        ,10
2月26日 23:42,作为一个武汉人看完这条新闻气的尼玛睡不着谁给的特权？武汉人都老老实实呆在家里呢，这位黄女士怎么就可以一路畅通的从武汉回到了北京呢？法律法规何在啊？        ,10
2月26日 22:48,虽然我的观点不对，但是我觉得封城主要目的是防止传染源大面积扩散。能走关系的毕竟是少数。本身无论哪个社会 那必然是金字塔上面的人特权多一些的。偶尔走了一些人，不必大惊小怪        ,10
2月27日 11:27,看看之前新闻做个对比，健康的孕妇老公赔孕妇去产检，不让出去，一户只能一个人出门一次；大车司机高速上徘徊十几天不能进服务区不能下高速，全拦着他的湖北车，他本人健康无症状，唯一要求希望能好好吃顿饭睡个觉；小伙回不了家街上睡当起了流浪汉；某武汉确诊女子从监狱冲破重重关卡顺利抵达北京        ,10
2月27日 01:53,京城能量大啊        ,10
2月27日 00:41,怎么能用她来称呼呢？要叫黄女士 ,10
2月27日 01:01,难怪我们几百万武汉人民苦苦呆在家 却每天还有确诊病人几百 ,11
2月26日 23:51,1k多公里，十几个小时。不可能不休息，不吃饭不上厕所。就是她没下车，她的家人作为密切接触者不可能不下车吧。而且一个人能开下来吗？去接她的人肯定是2个人以上。        ,11
2月26日 22:56,找个替罪羊了事        ,11
2月27日 05:33,危险就在身边但因为这件事，很多人就别想回到工作岗位了，马上一刀切懒政又来了 ,11
2月27日 03:10,刚百度地图了一下，黄女士所在的东城区新怡家园小区在二环内，距离天安门2.5公里...        ,11
2月27日 00:27,建议把病患还回武汉来，不给首都添麻烦，早日恢复正常状态        ,11
2月27日 00:19,我们这种怕病毒的小可怜，连家门都不敢出，从腊月底到今天，三十多天了老爸老妈没出过门，我每周到小区门口取一次菜，感谢盒马鲜生以及京东到家。        ,11
2月26日 22:47,没错！提高警惕，加强防范！        ,11
2月27日 09:46,2.7万热评加67.9万的点赞竟比不过浙江10万只鸭子，呵呵了个呵呵        ,11
2月26日 22:58,最重要的是堵住漏洞 ,11
2月27日 02:15,！我想问下她是因为什么坐牢？坐牢之前是普通老百姓还是政府官员？商界显贵？        ,11
2月27日 01:33,敢问李文亮医生事件查的怎么样了        ,11
2月27日 01:00,作为武汉人在家呆了一个多月，不敢出门，哪都不让去，为了这次疫情多少无辜的人付出了生命，就为了早日打赢这场仗。可这个刑满释放的人员可以一路畅通无阻，从武汉到北京，我想问严格管控的只是针对我们这些平民百姓是吗？一桩桩，一件件，都在寒我们的心。        ,11
2月26日 23:08,希望能有后续调查结果报道        ,11
2月26日 23:04,#北京东城出现武汉来京病例# 平时耀武扬威也就算了，疫情面前无特权！！！！！        ,11
2月26日 22:47,查，一查到底！        ,12
2月26日 22:46,这也可以！？        ,12
2月27日 01:04,这么牛x ？应该再看看她 刑期到底满没满吧        ,12
2月27日 00:19,两边都得查，武汉这边放，北京那边收        ,12
2月27日 01:13,因为现在国家鼓励复工，我妹夫昨天在湖北其他地级市，据说现在的政策可以到医院检查凭检查结果去开健康证明，然后只有通高速，凭健康证明开车到达目的地，然后在酒店在隔离14天，迷了，这难道不是国家规定的？与其防湖北人倒不如看看入境的韩国人吧，南京飞机上有发烧的都不用全部隔离        ,12
2月27日 01:02,我要从南走到北我还要从白走到黑 ,12
2月27日 00:29,是不是武汉女子监狱的？？？武汉女子监狱21号报道确诊230例        ,12
2月27日 00:19,渣浪这几次撤热搜真的是无语，都给他1分，让他下架得了        ,12
2月27日 03:21,为人民服务是假的？为特权官员服务才是真的？        ,12
2月27日 02:20,注意安全        ,12
2月27日 01:36,弱弱问一句，他开的是什么车 ,12
2月27日 01:34,请官方查一下她这是第几次减刑？真没想到我家的《新闻1+1》这么给力        ,12
2月27日 01:00,重点不仅仅是给老百姓调查结果，而应该是彻查让她出城的那些人！        ,12
2月27日 00:43,有些人苦苦在北京守了一个月，有些人千里送病毒所以北京人老老实实在家里待着为了什么呢？辛苦全被有些人糟蹋了。这些人带来的病毒不照样散播到北京市？她开车到京，中途没去公共场合没吃饭没休息？？？到京以后不吃饭也没去公共场合？可能吗？ ,13
2月27日 00:40,住着二环十二万一平的小区,13
2月27日 00:20,白叔叔分析的对啊，讲的就是老百姓心理话，好的官他就算不在了大家都记得他的好。像这种，能直接拉回家的，没有特权，老百姓能做的到？哪怕是富商也得听政府的。这么多关，全部绿，就不可能是一般能力的人做的了        ,13
2月26日 23:47,热搜升的真快        ,13
2月26日 23:45,势力滔天啊        ,13
2月26日 22:50,白老师来了，相信很快会水落石出了。        ,13
2月27日 05:37,武汉放出来的官再大，能有北京的官大吗？这可不是开玩笑，到北京传染开，马可不得了 ,13
2月27日 03:34,这个事可以出锅，一是正好借此打压J派，二来赚取民意 ,13
2月27日 03:26,全国人的努力，抵不过武汉这个坑 ,13
2月27日 03:10,肯定都知道个大概了，不然也不会通报消息，这都多少天了，只是在面子上给大家个交代罢了        ,13
2月27日 01:53,如果真是从里边出来的，没准是公、务车警、车什么的一路“护送”的，或者说押犯人啥的.....瞎猜，挺迷...        ,13
2月27日 00:52,封城封的都是我们这种平民百姓，只能说这个人背景不小，不仅从武汉出来了，一路上路过那么多地方，最后进了北京，武汉的买她面子不说，一路上都得买她的面子。。。这个人的背景值得深挖        ,13
2月27日 00:29,因为好多体温枪都形同虚设 ,13
2月27日 00:28,闭馆大奔停故宫，封城确诊上京城。        ,13
2月26日 23:09,牛逼的黄女士 ,14
2月27日 08:27,我们小区是旧村改造房，我们是自己买的，他们村民是分的。出现疫情后，我们自己买房的要办出入证，每天一个人只能出一次，而他们村里的不用办，可随便出入，问了工作人员，他说他们本村的人知道他们都跑不远 ,14
2月27日 00:41,18号是在狱中还是已刑满释放在外面确诊的？如果是在狱中为什么还能放出来？如果是已经释放，为什么没集中收治？又是怎么出的城？怎么进的京？        ,14
2月27日 00:23,细思极恐，武汉那么严密能出得去？！去的还是帝都北京？！这条命真就值钱呗！！！！这能严查嘛？？？        ,14
2月27日 00:16,防火防盗防不住权利        ,14
2月26日 23:43,白岩松 ,14
2月26日 23:30,最喜欢新闻1+1了        ,14
2月26日 22:46,为啥就是不听呢        ,14
2月29日 23:22,最后会不会像大g一样就不了了之，或是说出一个什么奇葩的官方回应然后……不了了之        ,14
2月26日 23:39,白岩松 ,14
2月27日 00:25,没控评就说明了问题        ,14
2月26日 23:07,白叔问了，我觉得很快会有结果了。        ,14
2月26日 22:59,武汉封城了还能出来？。厉害了啊        ,14
2月27日 11:04,听说开放了半小时，跑出来好多人！！！        ,14
2月27日 09:53,中国人一个最大的毛病，用可以破坏规则来体现自己的关系和能力，愚蠢        ,14
2月27日 00:38,为什么这么多人不看月份，她2月22日跑出来的，一堆人非得说23日封城，大哥们，是1月封城的，        ,15
2月26日 23:53, ,15
2月26日 23:26,如果不尽快补住这个漏洞  类似这种情况会越来越泛滥 危害全国各地        ,15
