2020-1-28 09:15,拜托看看广西桂林市南溪山医院医护人员戴的泳镜目前广西壮族自治区南溪山医院各种防护用品严重短缺，其中N95医用防护口罩、医用防护服、防护面屏、防护眼镜，这四个最急！社会各界如有这方面资源，伸出援助之手！[抱拳] ​​​​        ,1
2020-1-28 09:15,接触？？？        ,1
2020-1-28 09:15,中华美食是用来让大家骄傲宣传的 不是让几张B嘴用来糟蹋的 ​​​        ,1
2020-1-28 09:16,途牛1.31赴马尔代夫游，机票+酒店+保险近四万元。 受新型冠状病毒影响，国家规定旅行社1.27起暂停出境游。途牛非但迟迟不发退团通知，且认定为消费者自行要求取消出行。造成消费者巨大经济损失。 根据合同，由不可抗力（突发公共卫生事件）引发不能出行，途须退还费用，拖延、不退款，发国难财！        ,1
2020-1-28 09:16,无脑吃野味的！给国家造成多大的经济损失！给国民生活带来多严重的影响！        ,1
2020-1-28 09:16,就是碰一下就可以传播吗 ,1
2020-1-28 09:21,接触传播一般是，比如病人打喷嚏咳嗽后，手上带有病毒，然后摸了那个地方，你也恰好很快也接触了那个地方，所以勤洗手很重要        ,1
2020-1-28 09:19,应该是带有病毒的病人接触了什么物品 然后正常人触摸物品会触摸到病毒 如果没及时洗手 像揉眼睛抠鼻子什么的就有可能感染        ,1
2020-1-28 09:16,搜余甜，华南市场老板，送她出道        ,1
2020-1-28 09:26,病毒可在一般物体表面存活几分钟？衣服如何消毒？快递如何消毒？        ,1
2020-1-28 09:16,我就呆在家，不给国家添麻烦        ,1
2020-1-28 09:22,十多年sars疫情的成果、教训荡然无存，还有什么值得自信的?假、大、空、虚之盛行        ,1
2020-1-28 09:57,我是配音演员，首都国际机场机场音，别的帮不上，即日起，凡涉及新型冠状病毒防疫方面的通知、警告等录音，本人公益录制，分文不取，一律免费！希望尽自己的一份力量！今天录音了一整天，只要瘟疫不走，我就会坚持录音的！        ,1
2020-1-28 09:16,①出门最好戴口罩勤洗手 ‼️ ②咳嗽或打喷嚏时捂住口鼻避免唾液飞溅‼️ ③将肉类蛋类禽类彻底煮熟‼️ ④避免与呼吸道感染者接触 ‼️ ⑤避免近距离接触野生动物和活牲畜‼️‼️ ⑥不要随地吐痰 ‼️ ⑦尽量避免去人多的地方‼️ ⑧有发热咳嗽现象一定要及时就医不要拖‼️ ⑨不要食用野味‼️🙏        ,1
2020-1-28 09:15,接触传播 ,2
2020-1-28 09:53,与SARS同源性达85%？意思元月1日那8个人没没有造谣？        ,2
2020-1-28 09:16,武汉人别乱跑了 拜托了        ,2
2020-1-28 09:17,啥叫接触传播？求科普！        ,2
2020-1-28 09:17,・_・?，接触传播？？？ ,2
2020-1-28 09:16,婴儿老人，重点关注对象！！！        ,2
2020-1-28 10:25,重点传达的是中西医结合治疗！！！ ,2
2020-1-28 09:49,唉，我觉得不仅仅是野味的问题，野味肯定占绝大多数原因，但野味存在也不是一两年了，现在能爆发出来，我觉得和环境变暖也有关系，我是内蒙的，明显感觉今年冬天一点都不冷，一年四季都是适合病毒细菌生活的温度，能不爆发么，整治野味的同时，还是要把环境善待起来。 ,2
2020-1-28 14:49,重点看第7，8页。        ,2
2020-1-28 09:16,希望全国个省市都加油！！！大家挺住长沙具体指定酒店，在我最新微博评论在长沙的湖北人民👀过来，麻烦大家帮我顶一下，谢谢 ,2
2020-1-28 09:46,请问图2中所说的，部分患者仅表现为发热、无力，无肺炎症状，一周内恢复。这个恢复是自愈，还是医院治疗后恢复？        ,2
2020-1-28 09:37,莫挨老子 ,2
2020-1-28 11:01,中药是伟大的宝库，但是中药是根据每个人的身体不同来开的！药方可能是一样的，但用药的量应该是要医生来把握的，如果公布了，大家千万不要自己随意用，请先问过医生再用        ,2
2020-1-28 10:38,1665 年，英国伦敦大瘟疫，当时牛顿正在剑桥就读，买不到口罩的他，被迫回家进行自我隔离，他亲戚不走，聚会也不参加。这两年是他创造发明的高峰期。他先后创立了二项式定理、光的分解、流数法，还确立了第一、第二定律和引力定律的基本思想。当今理论物理已经近百年毫无进展，在家隔离的你该出现了        ,2
2020-1-28 09:19,接触是个啥样的接触昂，有具体点的传播途径么        ,3
2020-1-28 09:20,说了疏风解毒，不盲目使用抗菌药物        ,3
2020-1-28 09:16,接触传播？？？？手套🧤可以戴起来了        ,3
2020-1-28 09:27,图八？？？？@丁香医生 ,3
2020-1-28 09:42,#新疆统一隔离无症状人群# 求求大家关注一下这个话题我们不是不愿意隔离，这种集中隔离不就是大型交叉感染现场吗？        ,3
2020-1-28 09:18,现在小孩子也有被传染的了，家长们一定要看好的孩子啊        ,3
2020-1-28 09:15,首先不要怪政府，我们应该提前切断并完全清除这个病毒，而后再追究他们的责任！        ,3
2020-1-28 09:15,大家都保重！！！        ,3
2020-1-28 09:16,接触传播，靠，这个病毒还真是厉害。        ,3
2020-1-28 10:31,所以 别说中医不管用 好吗？这回是国家卫健委和国家中医药管理局公布的诊疗方案。        ,3
2020-1-28 09:24,转发微博🙏病毒快快离开中国        ,3
2020-1-28 09:20,如果您来自疫区，您曾到过武汉，或接触过从武汉回来者，请不要去接触别人，请自觉居家观察14天！ 请家人不参与社会活动，不待客！这是觉悟也是责任，关乎您和您家人及全社会的健康❗        ,3
2020-1-28 11:15,我从湖北回来都二十五天了，潜伏期都过了，所有人都不相信我没事，村里大妈说潜伏期三个月，成了过街老鼠 ,3
2020-1-28 09:17,卧槽卧槽乱套了好慌        ,3
2020-1-28 09:17,确诊4300了，一下子多了一千五。。。。        ,3
2020-1-28 09:20,中药上基本去湿气为主  湿气真可怕！        ,4
2020-1-28 10:03,这个肺炎前期症状非常轻，那么后期会越来越严重吗？？多久会十分严重呢？出现什么症状        ,4
2020-1-28 09:46,挺我大中医！！        ,4
2020-1-28 11:00,人民日报真的是……浙江第一个一级响应的新闻不放，好多地方的热搜不放，但是央视新闻都放了！现在么标题党，请问接触传播是怎么个传播法 ,4
2020-1-28 10:18,我家里人有人突然咳嗽，咳了好几天了，会不会有事啊。。。。我害怕        ,4
2020-1-28 10:08,推荐中成药预防，针对不同证型的中医药方案。        ,4
2020-1-28 09:19,🙏🙏🙏  注意了 ，别出去乱跑。        ,4
2020-1-28 09:16,这个年过得真是揪心        ,4
2020-1-28 10:02,什么叫接触传播！握手这种没有飞沫的也会传播嘛？间接接触怎么判定？病毒在空气中能存活多久？什么物质最容易成为载体？接触到了污染源不洗手就会一直在吗？        ,4
2020-1-28 09:18,不串门，不聚会，不扎堆，选择更安全的娱乐方式既是保护自己，也是尽公民责任。 ​​        ,4
2020-1-28 09:46,河南信阳现在医院物资很缺乏，大量人口从鄂返信阳，，救救孩子！@在信阳 这个人微博置顶有捐赠联系方式和地址！！求大家看看！        ,4
2020-1-28 09:39,咳嗽3天多的我慌的一批        ,4
2020-1-28 09:16,如果接触也可以传播的话，那速度会更快了，戴口罩也不管用了……        ,4
2020-1-28 11:44,简单解释,4
2020-1-28 11:05,祸从口出，病从口入！老祖宗的智慧现代人就是不知道！以前是怕饿死，现在好了都是吃死的！        ,5
2020-1-28 10:45,农村为什么还是没人宣传，农村人没防范意识啊！这些健康知识他们根本不会看不知道        ,5
2020-1-28 09:57,就是都不要出门啥事都不会有        ,5
2020-1-28 09:20,只想问问这个时期丧事能办不，村里有人办丧事，好多人聚在一起，劝不了，死者为大，不办不孝 ,5
2020-1-28 09:17,儿童和老人，真的要好好保护        ,5
2020-1-28 11:53,我家门把手消毒的，进屋吸收、衣物悬挂消毒通风、门把手消毒、能想到的地方消毒，消毒用75度医用酒精，外出我和老公一人一个小喷壶，见人喷酒精，哈哈哈哈哈😂早上刚喷了我领导        ,5
2020-1-28 10:30,太恐怖了！！！！！！！！！！！！！！！！！！！！！！！！！！！！！！！！！！！！！！！！！！！！！        ,5
2020-1-28 09:39,那出门是连手套也要带了吗………        ,5
2020-1-28 09:25,【第四版诊疗方案公布,5
2020-1-28 13:00,接触传播？意思是除了口罩还得戴手套？？？        ,5
2020-1-28 12:59,最长不超过十四天？安阳一女孩传染了五个人至今无症状怎么说？？        ,5
2020-1-28 10:08,治疗药都是中药，中医加油        ,5
2020-1-28 13:46,拜托看看广西桂林市南溪山医院医护人员戴的泳镜目前广西壮族自治区南溪山医院各种防护用品严重短缺，其中N95医用防护口罩、医用防护服、防护面屏、防护眼镜，这四个最急！社会各界如有这方面资源，伸出援助之手！[抱拳] ​​​​        ,5
2020-1-28 11:25,大家一定要去搜余甜  热搜一直被恶意压下去 余甜华南集团法人 旗下华南海鲜市场非法交易野生动物继而引发新型病毒 官商勾结 官官相护造成今日局面给武汉给人民给社会给国家造成多大的影响政治经济受到多大冲击 世界卫生组织总干事来中国视察 若把中国定为疫情国 请你出来谢罪！#余甜# ,5
2020-1-28 11:16,大家去微博看一下余甜。渣浪一直撤热搜。        ,5
2020-1-28 10:47,我看上面临床表现有部分患者低热，轻微乏力，无肺炎表现，感觉这个症状好轻啊，可能大家都不会注意，所以有没有懂的小伙伴解释一下，一周内恢复是自行恢复了还是去医院接受治疗恢复的？        ,6
2020-1-28 10:34,有没有从武汉来的本人没有症状，而接触他的人却确诊患病？@人民日报 ,6
2020-1-28 10:31,#诊疗方案# 几个字没看见吗？凭啥骂官方？自己百度，接触传播。这种很明显就以后可能会出现在医学教科书上，若无再改版的情况下什么诊断原则、转运、RR，明显阅读受众是各地医务人员。你明知道自己是大众，就好好看官方带画带解释的那种宣传，不要看到“诊疗方案”有你看不懂的就炸。        ,6
2020-1-28 10:06,最后用药还是中医处方缓解症状 ,6
2020-1-28 09:36,江西医院缺医疗物资 ,6
2020-1-28 09:21,能不能再让超市缩短一下上班时间，我们超市早上八点开门，晚上八点关门，这还是缩短了之后的时间，每天上班都人心惶惶的，每天要接触好多的未知病人！口罩也难买到，好多顾客也没带口罩，毕竟是人群密集的场所，真的很怕，怕自己把病毒带回去传染给家人。        ,6
2020-1-28 09:17,啥？        ,6
2020-1-28 09:16,潜伏期明确的话，让人欣慰        ,6
2020-1-28 09:16,向奋战在一线的所有人致敬！        ,6
2020-1-28 16:10,一看到“中药治疗”就感觉顿时文邹邹起来        ,6
2020-1-28 15:24,今天知道有的地方让基层工作人员挨家挨户开门排查统计测体温！那不是潜在的移动感染源吗？！人家都没出过门，也没接触过武汉回来的人，如果被政府上门测体温弄得交叉感染了怎么办？做这些决策的领导有没有医学常识啊！！        ,6
2020-1-28 13:49,顶我上去！病毒必须要有宿主才能存活，宿主就是人的体液，比如唾沫、眼泪、鼻涕等。不会生活在空气中，只有细菌才是无处不在。平时触摸栏杆，都不会传染病毒，除非上几秒有病毒携带者手上带了体液摸了栏杆，你又去摸了才会。所以要预防！隔离传染源，勤洗手，多消毒。        ,6
2020-1-28 13:41,莫挨老子 ,6
2020-1-28 13:30,也可通过接触传播？什么样的接触呢？要是去超市摸过同一件商品呢？那么出去之后不要摸自己的口鼻，洗手后才行，手机在外面使用过回来了也要消毒，买的东西也要用酒精擦拭，然而我买不到酒精惹。        ,6
2020-1-28 13:25,就是说哪个病人摸摸我 我也就感染了？        ,6
2020-1-28 11:57,接触？患者接触了超市里菜，你再接触也有可能传播。        ,7
2020-1-28 11:53,多数患者预后良好？？不是愈后？？？？？？        ,7
2020-1-28 11:28,真的很难过，我们是做外贸的，明显最近生意变差了，而且老外取消订单都说怕有武汉病毒。给国民经济带来了重大损失 ,7
2020-1-28 11:24,之前是哪个领导说的有限人传人的！！！妈蛋都人传人了还有限！！！怎么有限了倒是说啊！！！这给气的！！！！！！！        ,7
2020-1-28 11:04,大家都去看第29条热搜！余甜！华南海鲜市场老板，父亲为湖北hei社会老大，丈夫据传为官员之子隐藏极深。而且武汉森林公安和华南海鲜市场距离不到7百米所以这场病毒背后到底是什么人出卖人民的利益，给全中国人的生命健康带来巨大损害！！  热搜必须！大家一起顶上去 ​        ,7
2020-1-28 10:41,有一个很重要的问题，治愈了之后会产生病毒抗体吗？那这样的话会不会治愈者不会感染但身上带有病毒的话仍是传染源呢？拜托顶我上去        ,7
2020-1-28 10:41,电子支付可太重要了！！！        ,7
2020-1-28 10:23,传染病学书原话,7
2020-1-28 10:19,@圈圈sos ,7
2020-1-28 10:16,这个病有什么后遗症吗？        ,7
2020-1-28 10:14,那我从外面买回来的散称瓜子还能吃吗..好多人挑过啊        ,7
2020-1-28 10:00,🙏        ,7
2020-1-28 09:42,有没有专家可以告诉我！那超市买回来的东西，怎么办？还有就是病毒体离开寄主人身体上在其他物品上存活率是多久和多长时间！        ,7
2020-1-28 09:38,好好待在家里吧！！！逆行的英雄一定可以战胜病毒的！！！！中国加油🇨🇳！！        ,7
2020-1-28 09:38,快点打赢这场无销烟的仗，快点控制，不要再有听到每天数字不同，加油💪        ,8
2020-1-28 09:38,空气传播会不会？？        ,8
2020-1-28 09:37,中医治疗有没有治愈率？        ,8
2020-1-28 09:31,🙏        ,8
2020-1-28 09:18,啊？？？？？我现在好慌        ,8
2020-1-28 09:16,加油中国人        ,8
2020-1-28 09:16,啥玩意儿？？？？        ,8
2020-1-28 09:16,大家都做好防护        ,8
2020-1-28 09:16,请大家仔细看看  ,8
2020-1-28 10:22,错别字，不是愈后吗 ,8
2020-1-28 09:52,這個語文水平真是醉了，接觸傳播归根到底也是分泌物传播的一个途径而已啊！单拎出来说也太容易被曲解了！        ,8
2020-1-28 09:45,和SARS 85%相似？12月抓的8个说传谣是SARS的，什么时候平反？ ¡评论配图 ,8
2020-1-28 09:40,幸亏我们国家的社交礼仪不是贴脸 ,8
2020-1-28 09:16,向医护工作者致敬！        ,8
2020-1-28 13:08,能不能看看云南，25号直接空投119个武汉人，据说还有发烧的，结果27号我们才知道，热搜还一直被撤，云南人做错了什么        ,8
