2020-1-31 08:57,很多官员一查一个准，只是不查罢了        ,18
2020-1-31 08:56,回复@微榑普通用户 的表态:吊牌价7886，品牌:乔万尼        ,18
2020-1-31 08:43,好多政府工作人员，不都是如此嘛        ,18
2020-1-31 08:43,社会可不就这样子，继续吃瓜        ,18
2020-1-31 08:37,明显的什么都不管的主任        ,18
2020-1-31 08:33,她只是倒霉，撞枪口了，可多主任都不知道吧        ,19
2020-1-31 08:32,要开除！        ,19
2020-1-31 08:31,像极了上学时被提问结果没背过，在那找理由和老师解释呢        ,19
2020-1-31 08:28,免职是不是保护她啊，叫他回家休息么        ,19
2020-1-31 08:27,@真想取一个好名字 ,19
2020-1-31 08:15,下面的很多官都这种语气        ,19
2020-1-31 08:13,这么重要的位置，应该每天早晨，中午，晚上都会掌握实时动态吧        ,19
2020-1-31 08:13,她是努力认真的唐主任啊 O网页链接 ,19
2020-1-31 08:12,笑死我了 ,19
2020-1-31 08:10,都这么大岁数了为啥还不退休，建议中国官员领导年轻化        ,19
2020-1-31 08:08,西南政法。不可能有这样的饭桶。她是不是有啥难言之隐        ,19
2020-1-31 08:08,这种人在中国多的是        ,19
2020-1-31 08:07,为啥不调整湖北的领导班子，这样下午疫情扩散会永远结束不了        ,19
2020-1-31 08:07,态度就不端正        ,19
2020-1-31 07:57,都不装了，怕不是就故意把她弄出来挡个箭，控制一下舆论？湖北红十字会呢        ,19
2020-1-31 07:55,倒查这个唐主任是谁亲戚？还是买上去的？        ,20
2020-1-31 07:54,狗官，免职都便宜他了，应该严查，查出她不法行为，秋后处决        ,20
2020-1-31 07:52,中国领导们靠关系和后台任职的大有人在，只有老板姓才心知肚明        ,20
2020-1-31 07:42,唐主任衣服不便宜啊 ,20
2020-1-31 07:26,仿佛看到了我身边的同事，口音都一样。        ,20
2020-1-31 07:21,说话的都前后矛盾，你们就别再为她洗地了        ,20
2020-1-31 07:20,中国这样不作为的官职太多了，摆出一副臭德行，不知道怎么选拔上去的        ,20
2020-1-31 07:19,这次肺炎告诉我们一个非常深刻的道理，以后干部的选拔一定要专业人员管理专业的领域。如果再拿一群职业官僚来跨行业管理医疗、卫生或者是教育，简直就是为日后发生大灾难时瞎指挥埋下伏笔！ ,20
2020-1-31 07:15,“这次肺炎以及黄冈卫健委主任唐志红被免职”告诉我们一个非常深刻的道理，以后干部的选拔一定要专业人员管理专业的领域。如果再拿一群职业官僚来跨行业管理医疗卫生、证监会或者是教育，简直就是为日后发生大灾难时瞎指挥埋下伏笔！ ,20
2020-1-31 07:11,我们单位有个主任就是这样的        ,20
2020-1-31 06:53,现在卫生局有多少不是医学专业管医学专业的领导啊呵～ ,20
2020-1-31 06:52,原来这就是一问三不知就知道瞎🐔吧指挥的领导啊？怎么坐上这个位置的？回扣一定没少吃吧，纪委查不查呀？ ,20
2020-1-31 06:51,呵呵这些领导 ,20
2020-1-31 06:51,中国啊        ,20
2020-1-31 06:48,好想当这种公职人员啊，挣钱多，还啥事不管，跟吃人血馒头没两样        ,21
2020-3-30 17:20,无能力，就别端人民给的饭碗！#黄冈卫健委主任唐志红被免职# ,21
2020-3-11 16:40,活该！！！！！！        ,21
2020-2-27 09:12,有点纯真  不知道 就是不知道，可能在人格上 会显得 很不耐烦 ， 声音有点快 急躁了。 ☺️ ☺️ ☺️        ,21
2020-2-27 09:08,感觉到老师 提问题  ，我被支配的恐惧😨 。 想到 景继胜      王淼玉 ,21
2020-2-21 07:11,还免职 你想让她去别的岗位祸害人？！        ,21
2020-2-20 22:49,挖坟 ¡评论配图 ,21
2020-2-17 20:12,@小雨下晒太阳: @小雨下晒太阳: 这是多么正常的事啊，这还是一个市级别官，你知晓县级别的是什么样的吗？你知道其他单位机关平时的工作情况吗？真是没见过黄冈的世面。        ,21
2020-2-17 14:00,建议来一次官员专业大考核，不及格者继续进修，补考        ,21
2020-2-16 13:37,为啥不撤职，不开除？只是免职？不知道还那么理直气壮 ,21
2020-2-14 12:22,【武汉以外疫情防控奇葩事】截至2月12日，广西河池市都安县累计报告确诊新冠肺炎病例14例。因疫情防控不力，河池市副市长、都安县委书记陈继勇在开疫情防控会上决定对都安县人民医院院长罗立冬进行免职处理，由黄志先同志担任人民医院院长。大家如何看？ ¡评论配图 ,21
2020-2-14 10:15,这只是，全国的一个缩影，她只是运气不好碰上了！        ,21
2020-3-30 17:20,无能力，就别端人民给的饭碗！#黄冈卫健委主任唐志红被免职# ,22
2020-3-11 16:40,活该！！！！！！        ,22
2020-2-27 09:12,有点纯真  不知道 就是不知道，可能在人格上 会显得 很不耐烦 ， 声音有点快 急躁了。 ☺️ ☺️ ☺️        ,22
2020-2-27 09:08,感觉到老师 提问题  ，我被支配的恐惧😨 。 想到 景继胜      王淼玉 ,22
2020-2-21 07:11,还免职 你想让她去别的岗位祸害人？！        ,22
2020-2-20 22:49,挖坟 ¡评论配图 ,22
2020-2-17 20:12,@小雨下晒太阳: @小雨下晒太阳: 这是多么正常的事啊，这还是一个市级别官，你知晓县级别的是什么样的吗？你知道其他单位机关平时的工作情况吗？真是没见过黄冈的世面。        ,22
2020-2-17 14:00,建议来一次官员专业大考核，不及格者继续进修，补考        ,22
2020-2-16 13:37,为啥不撤职，不开除？只是免职？不知道还那么理直气壮 ,22
2020-2-14 12:22,【武汉以外疫情防控奇葩事】截至2月12日，广西河池市都安县累计报告确诊新冠肺炎病例14例。因疫情防控不力，河池市副市长、都安县委书记陈继勇在开疫情防控会上决定对都安县人民医院院长罗立冬进行免职处理，由黄志先同志担任人民医院院长。大家如何看？ ¡评论配图 ,22
2020-2-14 10:15,这只是，全国的一个缩影，她只是运气不好碰上了！        ,22
2020-2-13 23:53,@吃饭100次 ,22
