2020-1-31 23:48,对于红十字基金会我只能说“呵呵”了        ,18
2020-1-31 23:47,太乱套了，都啥时候了，想啥呢，知道没有以后了这是往死里作呀        ,18
2020-1-31 23:47,湖北红十字会还要脸不？！        ,18
2020-1-31 23:46,红十字可以不存在        ,18
2020-1-31 23:45,难怪当年郭美美那么有钱，估计十字会里好多郭美美        ,18
2020-1-31 23:45,吃瓜中，别让人民群众的爱心寒了心，希望反转吧亡羊补牢，为时不晚        ,18
2020-1-31 23:44,你的良心大大的坏        ,18
2020-1-31 23:43,钦差大人在哪里        ,18
2020-1-31 23:42,“中转不快，调拨不及时”这个问题少在中间过滤就解决了。天天刷新闻都看不见红十字会的作为，架不住百姓发问就拿这个说法来搪塞        ,19
2020-1-31 23:41,@人民日报 人民的报纸为人民，请彻查红十字会，不要让中国人寒心！我们不仅提出问题更要解决问题。不想听中国政府腐之类的话，但是假如政府不作为不就是把这句话定死了吗？我爱我的国，请把蛀虫赶出去        ,19
2020-1-31 23:40,都是些垃圾，郭美美事件到现在这么多年了，还是那个吊样，枪毙十次都不泄愤。//@没-人-理:红十字会这个名字已经从上烂到下，烂遍了全国，别说我以偏概全，全国各省的红十字会没一个没问题的，从郭美美到现在的武汉，这是管窥见豹。这种单位早应该摘牌了，根本没存在的必要。        ,19
2020-1-31 23:38, ,19
2020-1-31 23:38,某些人真是不要个波一脸        ,19
2020-1-31 23:37,人手缺，调配不及时，那你收这些物资做什么，一而再再而三的耽搁前线的用度，居心何在？？？        ,19
2020-1-31 23:37,红会,19
2020-1-31 23:32,一线的医生护士根本没收到，捐哪里了，自己卖了吧！太坑了，全国人民为湖北捐钱捐物，结果凭空消失了，简直笑话，请中央介入好好调查，该撤撤        ,19
2020-1-31 23:32,狗屎        ,19
2020-1-31 23:32,人命关天，请再仔细一点，踏实一点。国难当头，不可再鱼肉百姓，欺上瞒下啊。        ,19
2020-1-31 23:31,去他mabi的红十字会        ,19
2020-2-8 15:56,湖北省红十字会会长赵海山—湖北省副省长,19
2020-2-2 21:01,避重求轻。主战场的弹药你们卡住不给，逼着人们用直升机突破你们的防线！这是战场！是要杀头的！        ,19
2020-2-8 15:56,湖北省红十字会会长赵海山—湖北省副省长,20
2020-2-5 16:31,一次疫情就把红会的信用值降为0        ,20
2020-2-2 21:01,避重求轻。主战场的弹药你们卡住不给，逼着人们用直升机突破你们的防线！这是战场！是要杀头的！        ,20
2020-2-2 16:13,寒心        ,20
2020-2-2 13:32,这些鬼日的官办协会们没一个是好货，个个吃拿卡要 ,20
2020-2-2 10:31,希望你们这些人就地感染，然后向乞讨一样去求武汉协和医院的一线医生救你们的命。        ,20
