2020-1-30 22:52,她是装样子都懒得装啊        ,1
2020-1-30 22:51,只是免职？为什么不开除公职？现在免了，过段时间调别的地方去继续一问三不知？        ,1
2020-1-30 22:51,一问三不知，语气还挺横，真不知道怎么混上主任的 ,1
2020-1-30 22:58,别以为我不懂，免职、撤职、开除——其中免职最轻，连处分都算不上，有种直接开除！忽悠谁啊，当我没文化啊。        ,1
2020-1-30 22:53,一问三不知，三问一摇头 唐主任 ,1
2020-1-30 23:02,上联 : 想当初，黄冈密卷押题精准闻名华夏  下联 : 看今朝，卫健唐处应对无章惊呆全国。 横批 : 外套六千        ,1
2020-1-30 22:51,这个老大姐，混吃混喝混体制，没想到有今天。        ,1
2020-1-30 22:56,你很诚实，也很倔强，不知道就是不知道！ ,1
2020-1-30 22:51,嘴巴牢。混日子混的爽。        ,1
2020-1-30 23:09,武汉还有多少唐主任，全国还有多少唐主任呢？        ,1
2020-1-30 22:52,看看他们的F4吧，这个地方的都烂了一批官，现在免职快，升职又是怎么来的？害了湖北人害了全国人        ,1
2020-1-30 23:00,现在不是打仗？已经是在打仗了。上面派人下来督军。这位连长，你有几个排啊？不知道。每个排多少人啊？不知道。弹药还有多少啊？不知道。战场什么情况啊？老在变化，不知道，我打电话问问啊… ,2
2020-1-30 22:51,希望是开除        ,2
2020-1-30 22:56,身为抗击疫情最重要的部门，一问三不知，那么理直气壮，谁给你的勇气？光免职还不够，必须纪委监察部门严厉彻查，是如何坐上这个位置的！        ,2
2020-1-30 23:02,说句实在的，这样的主任全国各地多了去了，督导组有时候也会被糊弄，明察秋毫，难！        ,2
2020-1-30 23:07,一开口就超级没文化的感觉…        ,2
2020-1-30 22:58,不是专业医疗的人管理卫健委，真的醉了，有很多专业领悟的领导都是非专业出生，关键时刻掉链子了。        ,2
2020-1-30 22:55,外行人领导内行人，还是这种专业性很强的部门，不过全国好像都这样。        ,2
2020-1-30 22:55,啥都不知道 他的上级是怎么监管的  啥都不做  他是怎么做到这个职位的  我觉得有必要继续查查 深挖背后原因  而不是简单处理        ,2
2020-1-30 23:09,免职就是换个地方继续混日子        ,2
2020-1-30 23:09,她打电话说的黄冈话我听懂了，她极不耐烦的口气问“到底收了多少人？！”，她怎么当官的要查查！！        ,2
2020-1-30 22:51,这种不作为的人应该下岗了。        ,2
2020-1-30 22:51,单纯得让人心疼        ,2
2020-1-30 23:04,介是炮灰！挡枪的，拉仇恨的，我以前就当过，好像有什么了不起似的 ,3
2020-1-30 23:02,这种事儿，如果发生在公司，那么，自己的专业一问三不知，还是部门负责人，那老板顾你是来干嘛的呢？吃白饭的吗？老板可以直接开除，让她打铺盖卷走人了吧。        ,3
2020-1-30 22:50,可以下岗了        ,3
2020-1-30 22:57,很多机关工作人员都差不多，只不过她撞枪口了        ,3
2020-1-30 23:14,哎呀妈呀，她要是能当主任，那我和能上        ,3
2020-1-30 23:14,这领导是个老实人，不能灵活应对提问。        ,3
2020-1-30 22:59,一本正经理直气壮，看着就来气，一问三不知!        ,3
2020-1-30 23:00,可恨！这些唐志红们真是尸位素餐。现在先免职，未来还要追责。作为领导如果没有那个能力和担当，就下台让给有能力有责任心的人。这时候你耽误的不止是时间，还有百姓的生命。        ,3
2020-1-31 00:05,有个网友发现了这个问题～我觉得我有必要帮他扩散～大家也有必要知情～ O网页链接 ,3
2020-1-30 22:55,不应该撤职吗？        ,3
2020-1-30 23:09,平时上班净聊天磕瓜子了吧        ,3
2020-1-30 23:13,为毛我觉得她比那些满嘴官话的领导还好些。        ,3
2020-1-30 23:07,谁的老婆啊，查查就知道        ,3
2020-1-30 23:08,还有一个疾控中心主任啊，如何处理 ,3
2020-1-30 23:12,建议采访红花会，对不起，红十字会        ,3
2020-1-30 23:29,希望热度一直不减作为黄冈底下的麻城人 只能信中央靠中央了，感谢中央        ,4
2020-1-30 22:58,好笑，这种人怎么爬到这个位置的        ,4
2020-1-30 23:39,她还可以继续留在党员队伍里吗？？？        ,4
2020-1-30 23:18,我觉得这种老实人总比隐瞒实情的好        ,4
2020-1-30 23:40,我能说这是她上级领导推出来的背锅侠吗！黄冈多严重知道吗！我能说她提前得到通知不回答吗……        ,4
2020-1-31 00:33,来看看写给唐主任彻夜部署疾控问题的通讯稿你都能吐出来 O网页链接 ,4
2020-1-30 23:45,吓死我一跳，唐主任一件外套5000多 O网页链接 ,4
2020-1-30 23:12,疫情猛如虎，各地都在紧锣密鼓般开展防治工作，而黄冈卫健委唐主任，不管是面对督察组询问时的“一问三不知”，还是面对媒体记者镜头的一种“理直气壮”，都完全看不到她的重视与紧迫。疫情，也真的是一个“照妖镜”，照出了多少尸位素餐之人。        ,4
2020-1-30 23:17,这次事件真的是刷新了我对于湖北“父母官”的认知        ,4
2020-1-30 23:06,牛得很 啥时候了 还真有这种人        ,4
2020-1-30 23:16,养了一群猪？        ,4
2020-1-30 23:56,只是免职吗，连处分都还没算上，过段时间风声过了再给调回来一问三不知吗？！        ,4
2020-1-30 23:36, O网页链接 ,4
2020-1-30 23:51,羽绒服 O网页链接 ,4
2020-1-30 23:43,她都不如网友操心的多        ,5
2020-1-30 23:16,真的一场大病能塞选出多少不作为的 ,5
2020-1-31 05:00,这些个问题，还挺难回答的！！！！！说多了都是泪，说少了还是泪！！！！！        ,5
2020-1-30 22:51,谁提拔上去的？        ,5
2020-1-30 23:29,这是人民公仆？怕是花钱请的大爷哦        ,5
2020-1-30 23:01,机关单位这样的多的是，这还算是好的        ,5
2020-1-31 00:16,"估计回家休息几个月，换个单位。。。免职，属于干部任用的一种组织措施，不是纪律处分。免职和撤职都是必须离开现在的职位,但免职可以被调做其它同一级别的职务,而撤职往往降级使用或者不用。免了一个法律背景的，新上任的又是政法系统的，说明他们都是老熟人了，自己已经沟通好了。 ",5
2020-1-31 00:12,仅仅是免去?过两天风声过了再出来继续混是吗？        ,5
2020-1-30 23:30,她居然还底气十足，由此可见后台老板很重啊        ,5
2020-1-31 10:09,她现在是不是希望被免职，派她去医院～        ,5
2020-1-31 00:10,答:三不知 不知天上宫阙，不知江月待何人，不知细叶谁裁出。 问:知不知 问尔黄花知不知，入骨相思知不知，所生父母知不知，墓中老妪知不知。 结语:知之为知之，不知为不知。        ,5
2020-1-30 23:39,这种口气是很典型的代表人物了。        ,5
2020-1-30 23:32,图片评论 ¡评论配图 ,5
2020-1-30 23:30,听说是知道真实数字，但是不敢说，领导打了招呼不让告诉实情，真实数字太严重了…        ,6
2020-1-30 23:17,唐主任的衣服不错！        ,6
2020-1-30 23:14,为什么不是撤职        ,6
2020-1-30 23:47,这次肺炎告诉我们一个非常深刻的道理，以后干部的选拔一定要专业人员管理专业的领域。如果再拿一群职业官僚来跨行业管理医疗、卫生或者是教育，简直就是为日后发生大灾难时瞎指挥埋下伏笔！ ,6
2020-1-30 23:31,一帮混吃等死的败家玩意儿，祸国殃民，耽误了多少人，罪魁祸首        ,6
2020-1-30 23:12,好像说是有领导打过招呼了，不能说出具体数字，可想而知黄冈那边是有多严重了！！        ,6
2020-1-31 06:07,“非要问我”？那不是你该知道的吗？黄冈疫情都这么严重了你连个数据都还搞不清楚 ,6
2020-1-31 05:07,提示一下，督察组问唐志红是不是主任一把手，唐说“是”。唐的确是主任，但是不是一把手就请各位看官自行判断了。 ¡评论配图 ,6
2020-1-30 23:49,光是免职怎么对得起死去的患者和全国各地的被感染者？        ,6
2020-1-30 23:32,真想不到这些国家机关的人会是这样        ,6
2020-1-30 23:31,一个缩影而已，类唐姐庸官不在少数，非常时期，可检验我们的官员了        ,6
2020-1-30 23:28,还有一个疾控中心主任啊，如何处理 ,6
2020-1-30 23:17,还有一个疾控中心主任啊，如何处理 ,6
2020-1-30 23:15,免职而已，风头过后肥水依旧长流        ,6
2020-1-31 05:39,注意,6
2020-1-31 02:02,不解释 ¡评论配图 ,7
2020-1-31 00:08,说她羽绒服5k不贵的姐妹，群号给我，有钱大家一起赚，我复制粘贴贼快 ¡评论配图 ,7
2020-1-30 23:42,人家衣服5000+        ,7
2020-1-30 23:18,其它不说，好像态度也不怎么好！        ,7
2020-1-30 23:17,谁提拔的干部，谁任命的领导？        ,7
2020-1-30 23:10,直接双开吧        ,7
2020-1-31 22:01,因过错被免职。因其暂时不适于继续担任本职而先行免职，接受调查或审查，严格讲不属处分形式之一。免职只是意味被免职人不再担任原职务，一般不具有惩罚性。 撤职，与免职不同，被行政撤职处分者要降低级别，且工资待遇也要受到影响； 　　开除　最严厉的行政处分形式。不再享有公职人员任何身份待遇        ,7
2020-1-31 09:25,网友们呀，这就是个替罪羊！她是真不知道嘛？知道了敢说么？都知道这些检察的不就得往上查了么？最好的方法就是唐同志这个不大不小的官，一个人承担所有问题，你看看结果也不就是一个免职嘛？但是她帮了领导，以后换个名字仕途可就顺利了。仔细想想是不是啥大问题都有一个一问三不知的小官员？        ,7
2020-1-31 08:39,有点水准，故弄玄虚，装傻卖疯，吸引火力，以后仕途不说一帆风顺，至少不会太起伏不定        ,7
2020-1-31 00:50,盯着人家衣服干嘛 商场羽绒服不都2000+吗…那个年纪穿件好的羽绒服没什么吧        ,7
2020-1-30 23:50,图片评论 ¡评论配图 ,7
2020-1-30 23:39,低效的政府 无能的官员 提拔公示都是偷偷摸摸的  现在是任人唯亲哟        ,7
2020-1-30 23:19,一问三不知，还挺理直气壮        ,7
2020-1-30 23:15,难怪疫情发生这么久了，黄冈的医院还要自己求援要援助物品。酒囊饭袋的唐主任！        ,7
2020-1-30 23:13,这样的官员不在少数，看着真的没眼看        ,8
2020-1-30 23:07,死皮不要脸        ,8
2020-1-31 10:14,饭桶        ,8
2020-1-30 23:17,弃卒保车，杀鸡儆猴！转移公众对湖北省武汉市高层的不满与质疑。为啥主任态度不好那我当炮灰那能开心吗？        ,8
2020-1-30 23:15,实事求是的讲，想知道这样子是怎么坐上一个地级市的业务局的一把手的，完全是工作态度问题，浑水摸鱼之徒        ,8
2020-1-30 23:10,问责湖北省和相关市县地方疾控部门，包括相关政府负责人！全国要进行不间断的打击伪专家们的学术和实践行为，让八医生那样的真才实学站在科学的门口为后来人指路 ,8
2020-1-30 23:36,别的地方会不会也有类似的情况呀 ,8
2020-1-30 23:33,功课没做好 ,8
2020-1-30 23:18,用我们连云港方言说,8
2020-1-31 00:37,听她讲话的语气就是那种不办事的泼妇 还尼玛主任  还尼玛在这跟记者玩文字游戏 qushiba        ,8
2020-1-31 00:08,不作为先不说，就这个态度，这个语气，真不知道是怎么做到今天这个职位的！        ,8
2020-1-30 23:48,不知道怎么坐到这个位子上的，不仅没脑子还无耻，一问三不知还理所应当的蠢样 ,8
2020-1-30 23:45,素质很差……应该是走后门上去的        ,8
2020-1-30 23:43,唐主任心想，别的同学都不会，怎么偏偏问我一人        ,8
2020-1-30 23:35,我们小区门口卖红薯的大爷感觉都比她拎的清，这样算的话，大爷去当个主任还有点屈才        ,8
2020-1-30 23:35,就是像这大妈样的干部太多了，才影响了疫情        ,9
2020-1-31 15:25,细品。她怎么可能不知道真实的数据，中央直接跳过省问她，该不该说真话，说了真话省的也会怪罪，少了也不行，还不如一个人承担算了，自己把责任全部揽下来        ,9
2020-1-31 00:34,每天刷个头条都知道病人有多少例吧！ ,9
2020-2-1 04:26,这个女领导说话很犀利，作风直率，不像无能之辈啊！        ,9
2020-1-31 07:05,不是裙带就是后门 ,9
2020-1-31 03:47,可以再查查她有没有贪污 ,9
2020-1-31 01:52,这女的背后有人呀！        ,9
2020-1-31 00:11,什么都不知道还理直气壮的，真是见了鬼了        ,9
2020-1-30 22:59,这是渎职 不只是免职！！！！        ,9
2020-1-31 12:13,能坐这个位置又不是傻子，不作为是不存在的，黄冈情况什么样她能不知道？仔细看她欲言又止的眼神。        ,9
2020-1-31 11:12,“这次肺炎以及黄冈卫健委主任唐志红被免职”告诉我们一个非常深刻的道理，以后干部的选拔一定要专业人员管理专业的领域。如果再拿一群职业官僚来跨行业管理医疗卫生、证监会或者是教育，简直就是为日后发生大灾难时瞎指挥埋下伏笔！ ,9
2020-1-31 07:25,上头有人罩着 ,9
2020-1-30 23:45,追究黄冈市委的领导责任！        ,9
2020-1-30 23:34,这次速度跟着真紧        ,9
2020-1-30 23:16,大部分的省市都差不多哦        ,10
2020-3-30 17:20,无能力，就别端人民给的饭碗！#黄冈卫健委主任唐志红被免职# ,10
2020-2-1 12:19,@汪阿阿 ,10
2020-1-31 13:22,一问三不知，国家要你做什么        ,10
2020-1-31 12:08,……        ,10
2020-1-31 10:58,一想到唐主任这样的，可能只是诸多这类地方官员中被凑巧抽查出来的一个，我就心塞！ ,10
2020-1-31 10:43,中学生被提问不知道答案也不会这样低头不语，假装打电话吧。        ,10
2020-1-31 10:09,应该查一下红十字会的资金使用        ,10
2020-1-31 01:30,卫健委主任还是没有省委书记厉害        ,10
2020-1-31 00:56,看到最近某些领导令人瞠目结舌的表现，感慨。太平盛世时做个领导四处讲话，看上去差别不大。危机来了才知道谁是英雄，谁是狗熊。 想想做事做人不都如此？退潮方知谁在裸泳，风过才知谁是掉下来的猪。出来混，才和德不配位，迟早要还啊。        ,10
2020-1-31 00:44,卧槽    我以为她衣服是二百多块钱的        看楼上说五六千     我。。。。。。。   不过为她下岗👏        ,10
2020-1-31 00:43,湖北是疫情重灾区，不知道像这样的领导还有多少个？！也不知道被耽误的生命何其多？！ ,10
2020-1-31 00:40,才免职啊，那么大的事情，就这样一问三不知吗？        ,10
2020-1-31 00:37,牛批        ,10
2020-1-31 00:27,免职就完事了？！这大姐对着镜头、对着中央督查组也是一副理直气壮的样子，看来是老吃老做了 ,11
2020-1-31 00:24,缺乏官场经验啊        ,11
2020-1-30 23:13,该 ,11
2020-1-30 22:56,应该要开除公职        ,11
2020-1-30 22:50,太负责了        ,11
2020-1-31 15:07,黄冈卫健委唐志红主任劳苦功高，可歌可泣，感人肺腑，辛苦了。 ​​​ ¡评论配图 ,11
2020-1-31 14:33,聂怀桑本桑        ,11
2020-1-30 23:27,为什么关闭与湖北省长道歉相关微博的评论？        ,11
2020-1-30 23:23,可见医院有多少有能力的医生被她压着，渎职        ,11
2020-1-30 23:19,诚实是好事，真的        ,11
2020-1-30 23:03,有靠山吧？有路子        ,11
2020-1-30 22:51,只是运气不好吧 ,11
2020-2-12 01:51,今天公布黄岗发烧13000人。才明白她当时肯定知道却不敢说。中国不敢说真话 不能说真话 真的是害死人啊。        ,11
2020-1-31 20:26,我怎么感觉她好像在替上边的人顶包？        ,12
2020-1-31 08:47,这女人…一言难尽，后🚪来的吧        ,12
2020-1-31 08:10,都这种情况了，说话还这种横，牛B        ,12
2020-1-31 05:22,国家什么时候来个狠人来次政治大改革        ,12
2020-1-31 03:12,最可怕的不是不知道，而是知道不敢说        ,12
2020-1-31 01:16,她可能就是不想干了！看衣服，不差钱，保命重要，何必在危险面前暴露自己！        ,12
2020-1-31 00:55,建议以后选干部考核的时候专门做一个突发初期解决方案的考核，如果有隐瞒倾向或者是试图压下去的倾向直接让他滚蛋！！！        ,12
2020-1-31 00:45,这件棉袄 淘宝上好像是5000多        ,12
2020-1-31 00:39,因为当初让她来当这个主任的时候，他也不知道这个位置是来干嘛的这样的在体质中还不少 ,12
2020-1-31 00:21,真不知道是干啥吃的        ,12
2020-1-31 00:09,图片评论 ¡评论配图 ,12
2020-1-30 23:49,她的大衣挺貴的        ,12
2020-1-30 23:33,还振振有词？！基本工作都不做，你能做什么        ,12
2020-1-30 23:16,我想问她怎么坐上这个位置的？罢免都不足以平民愤，吃人民的，穿人民的，生死关头一问三不知。只把工作当铁饭碗了        ,12
2020-2-27 09:12,有点纯真  不知道 就是不知道，可能在人格上 会显得 很不耐烦 ， 声音有点快 急躁了。 ☺️ ☺️ ☺️        ,13
2020-2-27 09:08,感觉到老师 提问题  ，我被支配的恐惧😨 。 想到 景继胜      王淼玉 ,13
2020-2-16 13:37,为啥不撤职，不开除？只是免职？不知道还那么理直气壮 ,13
2020-2-12 13:24,//@余戈-滇西抗战三部曲: 回头再品唐志红的发言,13
2020-2-11 09:13,又去别的地方霍霍别人了        ,13
2020-2-9 12:12,她就是背锅的，他不是不知道，是不敢说啊        ,13
2020-2-5 01:14,//@杰克船长正:一问三不知，语气还挺横，真不知道怎么混上主任的 ,13
2020-2-5 01:14,//@絕望的海綿:唐主任衣服很贵啊        ,13
2020-2-5 01:14,//@怪物在这里:只是免职？为什么不开除公职？现在免了，过段时间调别的地方去继续一问三不知？        ,13
2020-2-3 17:24,一问三不知的人太多！既查出，就追根，谁提拔的！        ,13
2020-2-2 09:26,中国几千年的文明大国，孕育出这种垃圾，关键还能委以重任，由此可见根基已经烂了。想想管理这个国家的政府是这样的，真人绝望，不寒而栗。        ,13
2020-2-1 23:36,@不留不念z ,13
2020-2-1 23:07,有一个问题，唐主任一问三不知，那他是怎么跟市委官员汇报的？卫计委主任不知道。。。那你市委领导们知道吗？        ,13
2020-2-1 17:11,麻城真是个好地方，接触过一些这地方的人，都很喜欢用关系来压人啊，嘴上说着配合配合，行动上我行我素。        ,14
2020-2-1 16:59,黄冈这回又出名了        ,14
2020-2-1 13:46,免职不是公务员的处罚形式警告，记过，记大过，撤职，降级，开除，这些才是！！        ,14
2020-2-1 13:39,心冷，真是烂到根子里了(ﾉ_ _)ﾉ        ,14
2020-2-1 09:39,转发微博        ,14
2020-2-1 00:12,应该追责，平时不干事就算了现在还在混        ,14
2020-1-31 23:38,为什么不判刑  她的失职关系多少人命  间接谋杀        ,14
2020-1-31 23:00,是不敢说吧        ,14
2020-1-31 22:25,请彻查湖北红十字会        ,14
2020-1-31 22:14,她是根本没把督查组放在眼里，这人又傻又缺点儿心眼。        ,14
2020-1-31 22:13,一点工作的态度都没有        ,14
2020-1-31 21:42,这也都次要了，追踪一下武汉红十字会在干啥，全球的口罩都发过去了，医生就是收不到        ,14
2020-1-31 21:32,官场混的说话真拽        ,14
2020-1-31 19:16,免职。跟当年三鹿事件一个套路，过段时间再复出。撤职开除公职党籍才是一撸到底        ,14
2020-1-31 15:48,免职只是意味被免职人不再担任原职务，一般不具有惩罚性，所以公职人员正常的职务调动会用到此词 ,14
2020-1-31 15:44,不知道还这么理直气壮，绝了        ,15
2020-1-31 15:24,没准后台硬，过几天就去当局长了        ,15
2020-1-31 15:01,说真话会怎样你们考虑过吗？        ,15
2020-1-31 14:58,湖北能不陷落吗，有这么好的一线指挥官，全靠大家自由发挥。        ,15
2020-1-31 14:57,遗臭万年！！！！        ,15
2020-1-31 14:53,全国一样，唐主任太多        ,15
2020-1-31 14:52,就好比一家公司的老板，您能不清楚每天业务往来金额、不知道有多少客户，能行吗？！        ,15
2020-1-31 14:27,@就是年轻吧 ,15
2020-1-31 14:22,在干什么到底？？？？！        ,15
2020-1-31 13:29,这种基本的，又不用多费脑子的工作都做不好，确实是该撤        ,15
2020-1-31 13:07,对严重失职渎职的干部同事问责组织部考察人员        ,15
2020-1-31 12:57,莆田市荔城区也是这样，请严查！        ,15
2020-1-31 12:56,莆田市荔城区也这样，请严查！        ,15
2020-1-31 12:45,看见她就来气，丝毫没有一个人民公仆的精气神，反倒像是一个蛮不讲理以无知自豪的老妪这样的官应该立马下台，也绝不是就这一个！        ,15
2020-1-31 12:42,爆出来的只有她，相关包庇人员，贪腐人员多着呢        ,15
2020-1-31 12:24,她是真的不知道 还是不敢说。。。        ,16
2020-1-31 12:23,由点及面，可想而知，各级官员拿着纳税人的钱，毫无做为，视老百姓的命如草菅，这种人要在古代是要移九族的，为中国而悲哀        ,16
2020-1-31 12:16,你们为什么问我收治的病人人数，你们应该问我病床数，我答不上来怪我吗？        ,16
2020-1-31 12:06,你还知道啥？        ,16
2020-1-31 12:03,这大毛领，忽闪忽闪地        ,16
2020-1-31 11:57,这种官僚多的是，我们这里花个十几万还能买官呢，分分钟体制内。        ,16
2020-1-31 11:20,这就是当官的？        ,16
2020-1-31 11:20,她说了真实数字你们敢报吗        ,16
2020-1-31 11:10,免职是法定的人事处理种类，不具有惩戒性。我百度复制的        ,16
2020-1-31 11:08,又是一个靠色相上位的！        ,16
2020-1-31 10:53,想不知道都难吧，看看武汉上海广东啥的天天开新闻发布会，各种数据各种报啊，想不知道都难啊，难道黄冈市委市政府天天对卫健委疾控中心啥的不闻不问吗        ,16
2020-1-31 10:50,骂她都懒得骂了，天天看新闻的网友知道的都比她多        ,16
2020-1-31 10:42,为什么不开除        ,16
2020-1-31 10:38,真能装，干啥吃的你        ,16
2020-1-31 10:38,感觉是被拉出来垫背，但又不敢说实话……        ,16
2020-1-31 10:38,看他这样还挺牛？？？        ,17
2020-1-31 10:35,开除公职！不应该只是免职，继续调查有没有其他问题这类混蛋官僚！        ,17
2020-1-31 10:30,回复@钟汉良LOVE小哇 的表态:吊牌价7886，品牌:乔万尼        ,17
2020-1-31 10:29,那管理野味监督的城管领导呢？  是不是也应该被免职        ,17
2020-1-31 10:25,中国的铁饭碗可不是虚的，就算再来一个主任天天没睡醒也能干到退休，谁做事谁脑子有问题，只是她运气不好。撞枪口了        ,17
2020-1-31 10:10,把人民生命安全开玩笑吗，疫情都这样了，唐主任的一件羽绒服多少钱，估计也是一问三不知！        ,17
2020-1-31 09:57,说话语气听着就来火        ,17
2020-1-31 09:55,我上初中时我们学校发生了件非常非常恶劣的事，校长被免职了，我们还以为他被一撸到底了，得进去呢，特么的，后来发现他被调到教育局任某局长去了。也不知道这是升了还是降了，总之人家很滋润。        ,17
2020-1-31 09:52,回复@super疯子欧尼 的表态:吊牌价7886 唐主任的身份和档次怎么可能买淘宝打折促销的产品        ,17
2020-1-31 09:41,滚！做不了父母官就下台        ,17
2020-1-31 09:41,应该开除公职        ,17
2020-1-31 09:21,杀鸡儆猴        ,17
2020-1-31 09:16,不用你知道了，谢谢        ,17
2020-1-31 09:16,一把手一无所知        ,18
2020-1-31 09:08,当今很多公职人员都是这种态度 这还是收敛的 对老百姓态度就更不用说了 老百姓想办什么事难上加难还得看他们甩脸子        ,18
2020-1-31 09:08,主任衣服挺好看        ,18
2020-1-31 09:06,这种人  中国还是有很多的        ,18
2020-1-31 09:06,哈哈哈哈 像个憨憨        ,18
2020-1-31 09:04,这么理直气壮，做人都有问题啊，还当官，为百姓办事，可能么？        ,18
2020-1-31 09:03,估计不是一个人这样        ,18
2020-1-31 08:59,开除吧，        ,18
2020-1-31 08:57,明显破罐子破摔        ,18
