2020-1-31 22:38,我可去你大爷的吧，还三天，这三天足够做多少假账啊 ,19
2020-1-31 22:32,其实每天一次更好        ,19
2020-1-31 22:32,首先得给公众一个交代，才能继续后面的工作，不然谁还会相信        ,19
2020-1-31 22:31,支持支持        ,19
2020-1-31 22:31,强烈要求莆田系人流医院退还口罩！        ,19
2020-1-31 22:30,每天，这到底是怎么了？为什么一和红十字挂钩就会出错？        ,19
2020-1-31 22:33,美                    ,19
2020-1-31 22:30,美？        ,19
2020-1-31 22:30,是需要三天来编写数据么。 ,20
2020-1-31 22:29,杭州还每天呢 ,20
2020-2-1 07:04,@两江随笔,20
2020-2-1 04:10,哈哈，官场现行记        ,20
2020-2-1 04:10,这个还要说？这不是本质工作吗？你捂着干嘛？        ,20
2020-2-11 00:36,垄断吗？？？        ,21
2020-2-2 08:36,每三天发放一次接受捐赠情况？你确定不是捐赠和发出给医院的情况么？别玩什么文字游戏了好么？        ,21
2020-2-1 22:03,一将无能，毁一座城！        ,21
2020-2-1 21:40,给领导拿口罩的微博都秒删了，让我们怎么信？        ,21
2020-2-1 19:21,别丢人了好吗！qunima的红会        ,21
2020-2-1 10:48,我再相信红十字我他妈是傻子！！！        ,21
2020-2-1 10:30,兵熊熊一个，将熊熊一窝！连迅速高效都做不到，这样的红十字会还有必要存在吗？都说进入战时状态，按战时状态这些人都该枪毙！        ,21
2020-2-1 10:08,期待后续，虽然我已经不相信了        ,21
2020-2-1 09:29,国家要是在无所作为，对当下的各种乌烟瘴气处理不明白，让中国13亿人民永远处于什么都不知道，什么都不能做的地步。现在疫情一出，对于武汉红十字人民确实感到了一种无力感，只能在家干生气！那么这时候人民的愤怒也是不得了的！        ,21
2020-2-1 09:21,你每天入库 、出库都有记录 ，还要三天给你做账？凭啥三天？我要直播，当云监工        ,21
