2020-2-2 07:17,2002年广东人吃蝙蝠影起了非典，现在武汉人为什么要吃什么福寿汤，不知谁想起做这道菜的，这真是害国害民，让国家投资了多少人力物力，我也更希望我们的国家通过这两次的教训严打各个饭店，禁此一切非法野生动物上桌以绝后患…        ,17
2020-2-2 07:10,@yikhoo_r ,18
2020-2-2 07:00,@你好哇壹肆玖 ,18
2020-2-2 03:48,面对自己与他人生命不够重视，严重影响防疫工作，该拘！        ,18
2020-2-2 03:17,第一名网有建议的这俩人治愈后也要拘禁！我支持。        ,18
2020-2-2 02:56,@屈羽陈1607 ,18
2020-2-2 01:56,跑出了武汉，连累了一群人，因为至少自己能活着？        ,18
2020-2-2 09:10,她跑出武汉，在家待着也就算了，问题是她在杭州到处逛，还是人吗？人性呢？自私的东西!                    ,18
2020-2-2 00:28,红十字加油 ,19
2020-2-2 00:23,这自私得一点也不觉得良心痛！ ,19
2020-2-2 00:23,人口流动、疫情必然扩散。        ,19
2020-2-2 00:18,武汉人太坏了        ,19
2020-2-2 00:13,武汉红十字最牛逼！        ,19
2020-2-2 00:11,作死        ,19
2020-2-2 00:06,非常时期，还离开毒区拉埋自己个女落水，这个母亲真的没有责任        ,20
2020-2-1 23:04,本人胡进,20
2020-2-1 22:21,希望这对母女痊愈 痊愈后也希望可以受到相应处罚        ,20
2020-2-5 20:17,这是么时候的事哦？武汉封城都十几天了现在连只武汉苍蝇都飞不出去，更何况武汉人        ,21
2020-2-4 11:37,枪毙        ,21
2020-2-4 10:48,多少人希望得到隔离救治都没有床位，这两个人还躲着，不知道什么心态        ,21
2020-2-4 03:37,辛亏是逃出去了，留在武汉没准医院都住不进去，大家可能会反驳我，当每天刷微博看到求助的信息，那种绝望和无助，想想逃出去才有医疗资源给予帮助啊！        ,21
2020-2-3 15:17,这是准备吧最后一块净土 监狱也感染了 ,21
2020-2-3 13:00,隐瞒不报惩罚太轻了，震慑不到其他人啊，一个隐瞒可能导致多个感染，医疗物资这么紧缺，真的经不起消耗啊        ,21
2020-2-3 11:32,别来阿里祸害人，赶紧开除了        ,21
2020-2-3 10:56,武汉医院没有床位，跑出去了就多一分希望，就能入院治疗吧？！自私？确实！生死面前不自私的极少极少吧 ,21
2020-2-3 10:52,武汉没有病床，武汉没有病床，武汉没有病床，他们只是想得到治疗，只是想活着吧 ,21
2020-2-2 23:38,做老师都这么没公德心，武汉人的整体素质 哎        ,21
2020-2-2 23:19,如与她们可能同车过呢？她们做过上一趟公交，那之后再做同一辆车也会被感染吧？        ,21
