
2020-2-20 20:35,中华中医药真不是“盖的“。它的功效是治本，即扶正祛邪。 ,19
2020-2-20 20:32,为啥要用西医 就用纯中医治疗让那些中医黑看看        ,19
2020-2-20 20:31,希望医界重拾中医风采，推崇中医，兴盛中医文化，从根本改善人们的健康状况 ,19
2020-2-20 20:31,中医黑在赶来的路上 ,19
2020-2-20 20:30,中药跟西药加一块用，治好了就说明中医有效！怎么出来的结论？        ,19
2020-2-20 20:30,拒绝中医嘿        ,19
2020-2-20 20:30,@我的印象笔记 ,19
2020-2-20 20:30,摸脉诊断的时候医生没办法穿防护服吧，怎么保护医生呢？        ,19
2020-2-20 20:30,中医棒棒哒 ,19
2020-2-20 20:29,药物宣传和事迹宣传不同，需要有更多的科学论证。        ,19
2020-2-20 20:29,中药是科学！        ,19
2020-2-20 20:27,中国自己为中医正名 ,19
2020-2-20 20:26,不管黑猫白猫，能抓老鼠就是好猫        ,19
2020-2-20 20:25,就喝了中药哦        ,20
2020-2-20 20:25,中医 ,20
2020-2-20 20:25,一大波中药黑赶来……        ,20
2020-2-20 20:25,轻症        ,20
2020-2-20 20:25,加油        ,20
2020-2-20 20:24,症状轻中医应该可以吧        ,20
2020-2-20 20:24,除了医护人员的辛苦努力治疗，病人的心态也要积极健康，好的心态也能帮助对抗病魔        ,20
2020-2-20 20:24,西医多实在啊，明明通通支持治疗把病人治好了，还要说成自愈。而中医现在已经开始各种大张旗鼓的邀功请赏了。        ,20
2020-2-20 20:24,有没有不治疗好的？        ,20
2020-2-20 20:24,好的中医太难找了，希望能找回以前的中医技术        ,20
2020-2-20 20:24, ,20
2020-2-20 20:22,哇，我第二！！        ,20
2020-2-20 20:26,有个大v博主天天黑中医 真服了        ,20
2020-2-24 21:54,嘿，嘿嘿，嘿嘿嘿，嘿嘿嘿嘿。        ,20
2020-2-28 18:26,一定要尊重患者本人的意愿        ,20
2020-2-28 18:26,一定要尊重患者本人的意愿        ,21
2020-2-28 07:21,还是邓公那句话，逮着老鼠就是好猫！        ,21
2020-2-26 17:13,中医黑,21
2020-2-25 13:27,转发微博        ,21
2020-2-25 13:22,武汉市民        ,21
2020-2-25 01:43,中，西医各有千秋        ,21
2020-2-25 00:08,核算检测之后，西医给你确诊了，然后又把了个脉，嗯，那个中医也确诊了        ,21
2020-2-24 23:06,为啥要中西医结合，我觉得信中医的就直接中医，信西医的全部西医，这样也可以知道谁厉害啊。中医要有自信，不要老是拉着西医在一起，不知道的以为拉着西医是自信，知道的是你中医死不要脸        ,21
2020-2-24 21:54,听说过南郭先生么 ,21
2020-2-24 21:54,嘿，嘿嘿，嘿嘿嘿，嘿嘿嘿嘿。        ,21
2020-2-24 21:47,中医药的强大不容置疑，事实胜于雄辩，中华文化五千年的历史传承不是吹的 ,21
