2020-2-24 03:55,疫情过了以后，希望国家给年青一代树立正确人生导向，高薪留給才德兼备科研，医务人员。军事人员，控制娱乐圈所谓的“明星”动则上千万的片酬，只有少，年强则国强，为祖国未来发展培养自己的栋梁之才！我们佩服，拥护，只有靠科研技术，军事能力，国家才能强大。脱贫不是生活而是精神和心灵        ,20
2020-2-24 03:47,邪教到底是个怎样的存在？小时候听到基督教都害怕，没有说它是邪教的意思，但就是从心理上害怕        ,20
2020-2-24 03:36,对!!!今天我韩国朋友才说过这个邪教 到处传染人 故意的还是 我开始还不相信 现在就官宣了…        ,20
2020-2-24 03:29,笑死我了，哈哈哈哈哈哈哈哈哈哈哈哈，怎么那么搞笑。 ,20
2020-2-24 03:25,事情总是双方面的正好清理他。        ,20
2020-2-24 03:22,金饿狗 金智秀 难看又肥膘出        ,20
2020-2-24 03:21,红魔去 侍寝皇后 金饿狗 金智秀        ,20
2020-2-24 03:20,粉末了喔 该 红魔        ,20
2020-2-26 18:19,🙏        ,20
2020-2-26 18:19,🙏        ,21
2020-2-25 11:17,哈利路亚思密达        ,21
2020-2-25 10:24,让韩国人从哪来回哪去，中国拒收，中国有疫情，韩国都不让中国人去，凭什么收他们，滚蛋，领导们重视起来，我们东北已经0增长了，马上就胜利了，快让他们滚蛋        ,21
2020-2-25 10:24,马上呼吁禁飞所有韩国的航班，不能反向输入病例        ,21
2020-2-25 10:23,我很好奇这个邪教往哪门子邪的，是太阳，月亮还是星星，还是什么别的        ,21
2020-2-25 10:23,这种邪教组织就应该把这群邪徒赶到一个岛上，等到全部感染死亡后，用燃烧弹地毯式毁灭性消除        ,21
2020-2-25 10:23,邪教还哪国都有啊        ,21
2020-2-25 10:22,这个消息太严肃我不能笑，忍住，他妈的忍不住了。哈哈哈哈哈哈哈哈哈哈哈哈哈哈        ,21
2020-2-25 10:17,希望病毒战胜整个邪教        ,21
2020-2-25 10:15,韩国非常严重……疑似很多很多        ,21
2020-2-25 10:14,不要让韩国人来中国        ,21
