2020-2-26 09:35,把敢发表意见的人比到什么境地了？        ,17
2020-2-26 09:24,但使龙城飞将在，不教胡马渡阴山！        ,17
2020-2-26 09:22,发出来的时候我也看了那个截图，下面很多评论说质疑，有人说的很专业，觉得会不会分辨不出普通肺炎和这个新冠肺炎支持的人不多        ,18
2020-2-26 07:52,基于数据有自己独立的判断，不抱怨社会，也不迷信权威。        ,18
2020-2-26 07:06,因为坚持向病人负责的信念，所以敢讲；因为业务专业，所以敢讲。期待再多一些象钟南山这样的人民的守护者！ ,18
2020-2-26 05:03,说了真话天塌不下来。        ,18
2020-4-3 11:10,转发微博        ,18
2020-3-14 23:46,这位医生很赞        ,18
2020-3-11 17:59,他父母不患病，他应该也不会去这么努力的去呼吁，参见谢尔比纳        ,18
2020-3-6 14:43,现在没被处罚，秋天再回来看看，妈呀，我是不是知道的太多了 ,18
2020-3-5 19:35,敢于说真话！为我工作过的地方有这么勇敢的医生骄傲！        ,18
2020-3-3 11:13,唉……        ,18
2020-3-3 06:17,谢谢您，感动得我泪流满面        ,18
2020-3-1 22:09,<飘过一刻>        ,18
2020-3-1 22:00,五味杂陈……        ,18
2020-3-1 16:02,很感动        ,18
2020-3-1 13:52,这才叫新闻每一句话包括标点符号，听着都真实还不失客观！        ,19
2020-2-29 19:11,不管什么时候 人都要讲究最基本的人性本善         ,19
2020-2-29 17:18,这种专业判断的事还是需要专业的发声。有时候提意见其实是像“小马过河”那样，不像老牛说的那么深，也不像松鼠说的那么浅。        ,19
2020-2-29 16:10,大约8-9年前，接触过张教授。人很好的，很随和的一位女士。当时她还在第三军医大学西南医院        ,19
2020-2-29 15:44,医者仁心🙏        ,19
2020-2-29 14:03,这个视频看下来，感觉就是决策者没有跟一线医生沟通好，提个意见要这样害怕吗？不应该有系统内的通报渠道么        ,19
2020-2-29 13:51,技术观点，业务讨论都这么难，这叫什么事儿        ,19
2020-2-29 13:44,平凡又伟大        ,19
2020-2-29 13:34,组织内的精英做了精英该做的的事，“你是我的医生，我相信你的判断，你说了该说的话不用担心，有问题我会负责”领导做了领导该有的担当！中南医院不愧是武汉三强之首。我们都知道事情的发展线，可看到每一个真实的一线案例还是让人唏嘘不已！        ,19
2020-2-29 12:48,勇敢的张笑春大夫，挽救了多少人的生命！英雄！        ,19
2020-2-29 12:35,普通人发表正确的意见有多不易。        ,19
2020-2-29 12:35,知识分子，说的很委婉，很克制，还把想说的内容表达到位，并且效果也达到了。        ,19
2020-2-29 12:31,面对困难保持冷静的思考 ,19
2020-2-29 12:20,条条框框限制了作为。        ,19
2020-2-29 12:17,平凡的我们，指不定哪天就成了英雄        ,19
2020-2-29 12:14,一线医生和高层间有沟通障碍。专业的建议和政府的大局部署有鸿沟。医生不敢言，高层欠聆听甚至调查。此种情况，我国历史中反复出现，谁能解决这种情况，谁就能在战事中取得决胜。        ,20
2020-2-29 12:04, ,20
2020-2-29 12:00,有位好领导就像是有位好家长一样        ,20
2020-2-29 11:56,独立思考        ,20
2020-2-29 11:54,多听一线医生的声音！！！        ,20
2020-2-29 11:49,自己的父母都保护不了，得多无助//@老简宁: //@余戈-滇西抗战三部曲:了不起的医生！ ,20
2020-2-29 11:43,医者父母心感恩 ,20
2020-2-29 11:42,医者父母心感恩        ,20
2020-2-29 11:35,//@陽光下的小狐狸Naomi:感謝張醫生敢於說出來……她是很偉大的        ,20
2020-2-29 11:35,专业人士想发表个人的观点都得瞻前顾后，言路艰难呀！勇敢的张教授 ,20
2020-2-29 11:34,没有矛盾、纠结——斗争、统一——运动、变化，这个世界、这个世间、这个时空，也就没有了现前的必要、必然咯。        ,20
2020-2-29 11:27,无意冒犯，但二十天前卫健委发布的诊疗方案第五版不就CT检查纳入诊断标准了吗？为什么现在医生还会这样建议？        ,20
2020-2-29 11:26,什么时候能让老百姓说真话不这么难呢，为什么说真话会有罪呢        ,20
2020-2-29 11:24,疫情终究会过去 也许今后我们会以亲历者的身份在某个春节年夜饭桌上提到2020不平凡的开端 无论当下是何种情绪 但希望回头翻看这段历史 都能回忆起当时转发评论时的感同身受 为这些伟大的平凡人致敬 怀着感恩继续前行 ,20
2020-4-3 12:13,都在武汉 这位专业的医生理性 诚恳        ,21
2020-4-3 11:10,转发微博        ,21
2020-3-14 23:46,这位医生很赞        ,21
2020-3-11 17:59,他父母不患病，他应该也不会去这么努力的去呼吁，参见谢尔比纳        ,21
2020-3-7 14:04,在日益变化的世界里，要保持自己的专业思考        ,21
2020-3-6 14:43,现在没被处罚，秋天再回来看看，妈呀，我是不是知道的太多了 ,21
2020-3-5 19:35,敢于说真话！为我工作过的地方有这么勇敢的医生骄傲！        ,21
2020-3-4 10:24,给张教授点赞！        ,21
2020-3-3 11:13,唉……        ,21
2020-3-3 06:17,谢谢您，感动得我泪流满面        ,21
2020-3-2 14:52,第六版治疗方案取消了CT，想不通为什么        ,21
2020-3-2 14:04,不该封医疗系统的口，从李文亮医生到张笑春医生，人民生命安全才是立国之本！        ,21
2020-3-1 22:09,<飘过一刻>        ,21
2020-3-1 22:00,五味杂陈……        ,21
