2020-2-27 19:40,整个湖北健康人都在被歧视，说什么治愈者。        ,1
2020-2-27 19:40,无论科技如何发达 ，愚昧无知都不会消声匿迹。        ,1
2020-2-27 19:45,前段时间国内互联网歧视湖北人的时候不发声，现在发声啦？ ,1
2020-2-27 19:45,何止歧视治愈者，歧视湖北籍，歧视湖北接触史，歧视医学隔离观察的人这在现实生活中太多了。        ,1
2020-2-27 19:50,保护好这些患者的个人隐私，重中之重        ,1
2020-2-27 23:19,你从不认为你的自私有什么问题，直到你成为被歧视者。        ,1
2020-2-27 19:48,这是不可避免的，呼吁也没用，那些带着偏见的人不会看不会信 ,1
2020-2-27 19:41,可怕的无知，可怕的盲从。        ,1
2020-2-27 20:21,这篇我一定要转。心理上的害怕很容易理解，但是真希望大家能把握恐惧与歧视的边界。若不是身处其中，很难体会到被歧视的孤立感。一起做更温暖理智的人吧 ,1
2020-2-27 20:04,乙肝病毒携带者都搞不定，还想扫除非典歧视?        ,1
2020-2-27 20:28,歧视？这都是抗体携带者啊！哪怕纯功利地说，认识一个愿意为你捐血清的康复者朋友，就是生命的保障啊...        ,1
2020-2-27 20:08,第一段没地点没人物 时间上也就很笼统地说是非典时期 故事来源丝毫没有表明 我吐了 能不能编的真一点 偏偏这种东西没脑子的人还看得最起劲        ,1
2020-2-27 19:49,那您说我们应该怎么做？冒着被传染的风险向病患展示爱心么？为了证明人性的光明拿自己和家人的安全赌一把？        ,1
2020-2-27 23:48,有时候，歧视对某个人的伤害，甚至高过疾病！        ,1
2020-2-27 23:58,有多少人嘴上说 中国加油武汉不哭，私底下看到武汉人鄂A退避三舍甚至举报？        ,1
2020-2-27 20:10,歧视和保护自己是两个概念呀！避免接触很正常啊，治愈不一定不带病毒，并不是歧视他们啊。        ,2
2020-2-27 21:50,人类的愚蠢思想和愚蠢行为多如牛毛。 好在那些人性的闪光点，总能在黑暗中熠熠生辉，穿越厚重的历史，穿越封闭的国界，带领这个奇怪的物种，缓缓走向未知的未来。        ,2
2020-2-27 19:40,禁止上学？发生在中国？        ,2
2020-2-27 19:43,在中国，最大的敌人莫过于我们自己        ,2
2020-2-27 20:58,源自求生本能的恐惧，无法消除，不要把时间浪费在这方面了        ,2
2020-2-27 19:59,每个人都会有天生的不安全感和自我保护意识 但是在此之后还应该有生而为人的恻隐心同情心和同理心  面对有传染病史的人 如果做不到接受和亲近 那么在做好自我防护的同时 至少可以保持彼此尊重的距离 而不是肆意侮辱和表达歧视        ,2
2020-2-27 23:28,这种狗屁文章，通篇都在编故事        ,2
2020-2-27 21:24,治愈之后不应该加倍受欢迎么，人形抗体        ,2
2020-2-27 19:49,#在湖北没有返京的人员一律不得返京# 放弃湖北，保护？        ,2
2020-2-28 07:30,那些歧视者，口口声声是为了大家的安全，无耻。        ,2
2020-2-28 06:54,作为健康的武汉人以后出去玩都不敢说自己武汉的了。。。。。。        ,2
2020-2-27 19:56,歧视本来就有，就算不是疾病，也会有肤色、国籍、性别、身份、财富、甚至地域的歧视，没什么大惊小怪的，根本改变不了        ,2
2020-2-28 05:28,社会要做好接纳的准备了        ,2
2020-2-28 00:23,非典10年忌也有说这个，这周把观后感写出来吧        ,2
2020-2-28 01:30,这就是很多人为什么明明都症状这么重了却还是不肯去医院的原因之一。所以我也说这个是所有人的战争。        ,3
2020-2-27 23:52,是的，不仅是歧视，有些地方对患者（哦不，有时只是发热患者）的措施过于严苛了，跑偏了的感觉        ,3
2020-2-27 22:29,人类总是在内部消耗        ,3
2020-2-28 08:17,要分清防疫和歧视的意思        ,3
2020-2-27 22:37,对于健康的人，更多的可能是害怕。        ,3
2020-3-5 23:07,//@姬十三: 转发微博        ,3
2020-2-29 15:13,@琴其拉浮 ,3
2020-2-28 17:37,不过歧视zz有助于人类存活 ,3
2020-2-28 14:02,他们是病毒的受害者        ,3
2020-2-28 12:19,这几天也有想过这个问题，越想越无力。这次疫情，不知道让多少家庭家不成家。。。人，也不像人。。        ,3
2020-2-28 11:01,甚至还有医护工作者的孩子在学校被孤立呢，因为同学们的家长会告诉自己的孩子“她妈妈在医院上班，家里不干净”        ,3
2020-2-28 10:18,为自己和家人的健康负责什么时候也该被谴责了？        ,3
2020-2-28 06:12,拒绝歧视！        ,3
2020-2-28 01:29,患者得不到尊重是一方面，某些人不要脸不自觉也是一方面        ,3
2020-2-28 00:13,"我们须用宽容的态度来对待人们的愚蠢缺点和恶劣的行径,因为我们眼前所见不过是我们所属人类的共同缺陷.而我们之所以对此愤怒,只是因为我们自身还未显现这些而已.换言之,它们并没有现于表面而是潜伏于我们深处.        ",3
2020-2-27 23:28,看完有点沉重啊        ,4
2020-2-27 23:22,当年非典家里亲人被定为疑似，深刻体会到了被当做瘟神一样的感觉，唯恐避之不及，身边也有个别人造谣传谣，在我们都没有得到医院的消息时就造谣人已经不行了之类的，所以当时也很受伤。其实后来想想也理解，毕竟每个人都希望身体健康，注意防护是对的，但应该给予病人尊重和关心，歧视和造谣就不对了。        ,4
2020-2-27 23:08,我吐了        ,4
2020-2-27 22:56,怕是今年疫情结束后我们湖北人去别的省玩都会被歧视        ,4
2020-2-27 22:07,人类的自私本性        ,4
2020-2-27 22:00,等到半年后，这个事情平息了，再听到别人说曾经是患者，我一定会同情ta，而不是害怕...现在还早点...害怕算不算歧视？ ,4
2020-2-27 21:44,相信科学！        ,4
2020-2-27 21:32,外星人赶紧的，把地球毁灭了吧，没救了        ,4
2020-2-27 21:31,人性。。。真的很难。。。        ,4
2020-2-27 21:19,这或许是一部分隐瞒自己患病的原因吧，公司从来不管你为什么隐瞒，只管恐吓你，不报就辞退你。        ,4
2020-2-27 21:10,太多的隐瞒怕的就是这样的歧视，所以一直重复着同样的错误        ,4
2020-2-27 20:51,不要歧视治愈者，也不是谁想得病的…一旦歧视蔓延，也许有一日丧钟就为你而鸣        ,4
2020-2-27 20:35,转发微博        ,4
2020-2-27 20:23,任何的歧视都不应该存在        ,4
2020-2-27 20:19,谈何容易        ,5
2020-2-27 20:17,人类的本性。。。        ,5
2020-2-27 20:09,所以人性是自私的。很多时候等你真的在这个处境时才知道自己会做什么选择。        ,5
2020-2-27 20:06,转发微博        ,5
2020-2-27 20:00,这是生存的本能！所有繁衍都不能有侥幸心理。文明就是对这部分本能的挑战，想获胜很艰难！        ,5
2020-2-27 19:59,@我的印象笔记 ,5
2020-2-27 19:58,这个白围裙，小图看着像个奇怪的动物抱枕。【背带是耳朵，扣子是眼镜，褶皱是鼻子        ,5
2020-2-27 19:54,所以我们要鄙视那些歧视别人的人 ,5
2020-2-27 19:53,治好了不是就好了么，为什么要有歧视        ,5
2020-2-27 19:50,歧途不返 世路断之        ,5
2020-2-27 19:43,转发微博        ,5
2020-2-27 19:43,伤害加深        ,5
2020-2-27 19:40,病毒的幸存者却死于冷漠的歧视        ,5
2020-3-1 04:25,疾病嘛，好了就好了，都觉得自己会被感染，那感染科的医护还干不干，防护做好了，大家不也都好好的，得病已经很苦了，但谁又不会得病呢？别互相为难了        ,6
2020-3-1 03:50,当他们歧视A的时候，你觉得和你无关；当他们歧视B 的时候，你仍然无动于衷，因为你是2B…… //@和家猫一起宅:你从不认为你的自私有什么问题，直到你成为被歧视者。        ,6
2020-2-29 23:20,消除歧视，一方面需要教育引导，另一方面需要法律的帮助。HIV和乙肝病毒携带者就是很典型的例子，拒诊、就业歧视，无处不在。        ,6
2020-2-28 18:12,病毒传染的是人，但是却给人的社会活动带来影响！这是另外一个层面的东西，只能靠大家不要歧视，客观对待了！        ,6
2020-2-28 10:28,可能一开始大家并没有歧视湖北人，后来湖北政府班底的作为让人对湖北产生了厌烦与歧视吧，相信善良的劳动人民还是值得尊敬的        ,6
2020-2-28 10:06,键盘侠们都说自己不会歧视...然而.        ,6
2020-2-28 00:47,当年非典不一样有很多外省人说要杀光我们广东人，我们广东人就不用活了吗？这世上有数不尽的恶意，但请不要将这些恶意套在所有人的身上，不要被部分人歧视就觉得全世界的人都是坏人，这次疫情全中国全世界多少人为湖北捐款捐物资，你们这些带节奏的TMD就装看不见是吧？        ,6
2020-2-27 20:12,有些评论的网友都不看文章内容的吗？说患者治愈以后被孤立被歧视。这是个很现实的问题啊，都没看就反驳。不管怎么说，这个问题一定会出现，当然，没人会在意，唉        ,6
2020-2-27 19:59,这就是人性嘛，人的本质如此，不存在对与错        ,6
2020-2-27 19:58,真的。看到这些就跟心痛        ,6
2020-2-27 19:53,这次的病更像是孤独病。意思为“谁得此病意味着被别人关门分手和没朋友。”孤独的生病，隔离和被排挤。 这是自然征服人类的方式。因为人类爱聚集。        ,6
2020-2-28 09:49,在国内，更多的应该是，疫情结束前必要的隔离吧。        ,6
2020-2-27 20:08,看到问题就是要说出来，一次没有改变，就要力争下一次的改变，但不能放任这种不合理。所以，看到问题，说出问题，宣传它，指正它，改变它。唯一不能放任它。        ,6
2020-3-1 05:35,有时候发现深度好文都是夜间发现的        ,6
2020-3-1 04:41, ,7
2020-3-1 03:12,又的sars又的新冠，这也太惨了吧，追杀阿        ,7
2020-2-28 13:07,这和歧视hiv携带者如出一辙。世界是平的，歧视也并无区别。总有一天你会突然变成那个少数群体被人歧视。所以人类自我不团结，不相互关爱。歧视就永远不会消失        ,7
2020-2-28 11:29,转发微博        ,7
2020-2-28 11:23,自己都歧视，还让别人不歧视？双标        ,7
2020-2-28 11:05,//@米老板孩: 被歧视者给歧视者洗地，大概是最魔幻的事情了吧。//@阿黎_少打游戏://@蟹与自然://@織式_://@常夜_4号机://@油井_乌戈国国主兀突骨: //@sakurayuko: //@Uki是乖孩子: //@六弦一品:歧视，真是很没有道理的事情。        ,7
2020-2-28 08:21,这怎么是歧视呢？严格预防不好么？我也不是针对你这个人，我怕死不行？        ,7
2020-2-28 07:37,评论里圣母真多，一帮口惠而实不至的键盘爱心者！        ,7
2020-2-28 05:04,@栴小栴 ,7
2020-2-28 01:49,湖北籍，春节期间在广州，封区后社区表示湖北籍一律不给办通行证。之后按流程申报到电子通行证，可是出去办事回来依然不被准入，无奈只能借别人的证混入，再也不敢出去了。这是防病毒还是防湖北人呢？从2.9到最近，终于可以跟其他人一样凭证出入，却不是因为歧视已消除，而是防控放松了。        ,7
2020-2-28 01:24,@我的印象笔记 ,7
2020-2-28 01:04,烈性传染病给人群带来后遗症肯定造成人群的疏离感 不是说治愈完了就好了的 为什么要把道德凌驾于人类的本性之上呢？        ,7
2020-2-28 00:42,怎么感觉这是RNA病毒的共通特点？ 都普遍具有传染性和导致歧视的人性弱点？ 艾滋病因为加入了性的元素，这么多年了依然没有明显好转……        ,7
2020-2-27 23:39,实名羡慕治愈者，因为有抗体了。        ,8
2020-2-27 22:57,人类就是这个狗屁德行，先是恐惧鄂A车牌，见湖北沾边的避之不及，随后国外歧视中国人，现在又绕回来国人歧视日韩民众，所谓文明在传染病面前脆弱的不堪一击。        ,8
2020-2-27 22:42,歧视是人们的二次伤害        ,8
2020-2-27 22:10,整个社会都教育我们做个好人，但实际上可以做到这些基本的同理心同情别人的人又有多少？        ,8
2020-2-27 22:02,断章取义        ,8
2020-2-27 21:59,这个护士好可怜，医生也要歧视她不给她治疗我不理解，都是医务工作者应该理解才对啊？        ,8
2020-2-27 20:35,哪是什么歧视，不就是不想惹火上身的掩饰。无利可图和对自己有风险时躲之不及，有利可图时就趋之若鹜，就是人性的问题        ,8
2020-2-27 20:22,转发微博        ,8
2020-2-27 20:17,坚信、战胜，武汉加油！中国加油！ 坚信、战胜，武汉加油！中国加油！ 坚信、战胜，武汉加油！中国加油！ ,8
2020-2-27 20:16,歧视和保护自我是不一样的，你现在说你是湖北的，我们肯定会问一问你有没有发烧什么。不和你接触也是对家人负责，这是自我保护。你要是觉得这是歧视那就是吧，反正自己和家人最重要。        ,8
2020-2-27 20:13,呼吁啥都治不了脑残，又不是有疫情之后才残的        ,8
2020-2-27 20:07,潜江政府给我们市民发了一封告市民书，说潜江正在发展，也需要人才，希望我们留在潜江发展，不要外出务工。我现在理解了，原来政府是担心我们到外省被歧视 ,8
2020-2-27 20:05,疫情结束，就能正常了，现在只是减少病原接触而已        ,8
2020-2-27 20:01,真的不是歧视就希望大家安安静静乖乖的待在家里，生病了治疗就行了，别乱跑了        ,8
2020-2-27 19:55,确定传染性消失后，治愈者本身短时间内一般不会再感染，也不会威胁他人，当他们回归社区和工作后，最需要的，就是来自你我的理解和公平对待。         ,8
2020-2-27 19:52,嗯嗯！到现在包括美国在内对华裔或者说亚洲人的歧视又算什么呢？！我们国内也没有大量的歧视啊？！也有大量的正面例子，为啥要这样比较呢？！ ,9
2020-2-27 19:52,可能这就是人性吧！        ,9
2020-2-27 19:52,连过去那些非典的治愈者这么多年后都收到歧视，而且有的还是自己家人，人性很可怕。        ,9
2020-2-27 20:09,中国人对中国人最狠        ,9
2020-2-28 17:57,重点——如果确诊患者普遍遭受歧视，那么为了避免被歧视，其他人可能会逃避追踪、检测和隔离。这将导致部分患者得不到隔离和诊断，继续在外活动，传染更多人 。        ,9
2020-2-28 11:26,你到底懂不懂什么叫歧视 ,9
2020-3-21 03:12,病害是人类不断共同面临的挑战，进而不断共同发展繁衍。病害会一直在不同时期，不是以这种方式出现，就是以那种方式出现；它们不是出现在这里，就是出现在那里  歧视，源自于他们自己内心的软弱无助和恐惧，与他人它物没有必然联系，他人它物只是他们发泄的借口        ,9
2020-3-1 13:46,这反应必然的啊，跑不过熊，就想着跑过同伴啊        ,9
2020-2-29 04:38,不明白歧视什么，流感腮腺炎水痘等等要一并计入吗？亲友和自己难道还能没有一个得过传染性疾病？莫名其妙 ,9
2020-2-28 15:58,人生处处皆剧本。        ,9
2020-2-27 20:09,以前是因为条件的有限而对未知的恐慌，时至现今，不会了。        ,9
2020-2-27 19:57,永远不会，无论多么努力的科普，讲解，愚昧的人仍然是愚昧的，人的想法一旦固化，就不可救药了//@哎呀呀前进三:无论科技如何发达 ，愚昧无知都不会消声匿迹。        ,9
2020-2-27 19:55,歧视的界限谁来定义？        ,9
2020-2-27 19:55,看了你的文章感觉病患更怕曝光了        ,10
2020-2-27 19:54,🙏🙏🙏        ,10
2020-2-27 19:51,这种歧视太可怕        ,10
2020-2-27 19:42,。        ,10
2020-2-28 17:39,病人只是得病了，需要的是治疗，而不是歧视//@科学松鼠会: 有时候，歧视对某个人的伤害，甚至高过疾病！        ,10
2020-2-28 11:43,HIV也是~        ,10
2020-2-28 11:33,本人的真实感受，我在上海上班，春节回到湖北家乡过年，爆发疫情，一直在家里，然后在公司的微信群里，上海本地同事言辞激烈，在查看关于“湖北人都逃到上海”“滚出上海”“上海高速全是湖北车”之类的也不知道真实新闻后，对群里的湖北同事态度极其不好，不止一次公开骂“湖北佬”“九头鸟”“滚”…        ,10
2020-2-28 08:59,@____一_一 ,10
2020-2-28 08:46,//@和家猫一起宅: 你从不认为你的自私有什么问题，直到你成为被歧视者。        ,10
2020-2-27 22:57,有人会歧视感冒治愈者么？没有的话为什么要歧视其他病的治愈者……特别是这次的病……还有无症状或者轻症自愈的呢……        ,11
2020-2-27 21:44,我们小区连外地回来隔离的人都歧视，人性是恶的        ,11
2020-2-27 20:41,转发        ,11
2020-2-27 20:30,歧视传染病的感染者及被治愈者，最终只会害了所有人。当感染者发现自己被歧视到走投无路时，隐瞒身份报复他人就成了他的“最佳”选择。 ,11
2020-2-27 20:28,现在不都歧视武汉人么        ,11
2020-2-27 20:20,这又是瞎编的故事！        ,11
2020-2-27 20:03,@不想长大的饭团子 ,11
2020-2-27 19:40,看亮点 ¡评论配图 ,12
2020-3-21 03:12,病害是人类不断共同面临的挑战，进而不断共同发展繁衍。病害会一直在不同时期，不是以这种方式出现，就是以那种方式出现；它们不是出现在这里，就是出现在那里  歧视，源自于他们自己内心的软弱无助和恐惧，与他人它物没有必然联系，他人它物只是他们发泄的借口        ,12
2020-3-5 23:07,//@姬十三: 转发微博        ,12
2020-3-1 13:46,这反应必然的啊，跑不过熊，就想着跑过同伴啊        ,12
2020-3-1 05:35,有时候发现深度好文都是夜间发现的        ,12
2020-3-1 04:41, ,12
2020-3-1 04:25,疾病嘛，好了就好了，都觉得自己会被感染，那感染科的医护还干不干，防护做好了，大家不也都好好的，得病已经很苦了，但谁又不会得病呢？别互相为难了        ,12
2020-3-1 03:50,当他们歧视A的时候，你觉得和你无关；当他们歧视B 的时候，你仍然无动于衷，因为你是2B…… //@和家猫一起宅:你从不认为你的自私有什么问题，直到你成为被歧视者。        ,12
2020-3-1 03:12,又的sars又的新冠，这也太惨了吧，追杀阿        ,12
2020-3-21 03:12,病害是人类不断共同面临的挑战，进而不断共同发展繁衍。病害会一直在不同时期，不是以这种方式出现，就是以那种方式出现；它们不是出现在这里，就是出现在那里  歧视，源自于他们自己内心的软弱无助和恐惧，与他人它物没有必然联系，他人它物只是他们发泄的借口        ,13
2020-3-5 23:07,//@姬十三: 转发微博        ,13
2020-3-1 13:46,这反应必然的啊，跑不过熊，就想着跑过同伴啊        ,13
2020-3-1 05:35,有时候发现深度好文都是夜间发现的        ,13
2020-3-1 04:41, ,13
2020-3-1 04:25,疾病嘛，好了就好了，都觉得自己会被感染，那感染科的医护还干不干，防护做好了，大家不也都好好的，得病已经很苦了，但谁又不会得病呢？别互相为难了        ,13
2020-3-1 03:50,当他们歧视A的时候，你觉得和你无关；当他们歧视B 的时候，你仍然无动于衷，因为你是2B…… //@和家猫一起宅:你从不认为你的自私有什么问题，直到你成为被歧视者。        ,13
2020-3-1 03:12,又的sars又的新冠，这也太惨了吧，追杀阿        ,13
2020-2-29 23:20,消除歧视，一方面需要教育引导，另一方面需要法律的帮助。HIV和乙肝病毒携带者就是很典型的例子，拒诊、就业歧视，无处不在。        ,13
2020-2-29 15:13,@琴其拉浮 ,13
2020-2-29 04:38,不明白歧视什么，流感腮腺炎水痘等等要一并计入吗？亲友和自己难道还能没有一个得过传染性疾病？莫名其妙 ,13
2020-2-28 18:12,病毒传染的是人，但是却给人的社会活动带来影响！这是另外一个层面的东西，只能靠大家不要歧视，客观对待了！        ,13
