2020-3-4 10:25,西皮了！        ,20
2020-3-4 10:07,开学遥遥无期...        ,20
2020-3-4 10:07,还想着等疫情结束出国玩  现在也不用去玩了 ,20
2020-3-4 09:57,好可怕，像电视剧里面的情节 ,20
2020-3-4 09:57,就他们那样的防范意识过万都正常        ,20
2020-3-4 09:56,韩国那么大点地方既然超过五千        ,20
2020-3-4 09:49,越来越像瘟疫公司了，希望早日被消灭！        ,20
2020-3-4 09:44,中国可以一声令下，全国各地宅家不动，阻断传播。可是，若想让全世界人类同时宅家一个月……………………我们可以，但他们未必做得到啊…………        ,20
2020-3-4 09:40,我们国家还8万呢，咱是见过世面的        ,20
2020-3-4 09:40,韩国这是坐了火箭        ,20
2020-3-4 09:39,吃蝙蝠的你给我出来！        ,20
2020-3-4 09:25,伊朗为什么那么多了，美国那么少了，我有点怀疑美国了        ,20
2020-3-4 09:23,各国都要重视啊d(ŐдŐ๑)！ ,20
2020-3-29 17:08,能不能暂时关闭国门？明明境外输入都那么多了？难道非要到不可收拾的地步才肯下令吗        ,20
2020-3-29 17:08,能不能暂时关闭国门？明明境外输入都那么多了？难道非要到不可收拾的地步才肯下令吗        ,21
2020-3-6 12:19,转发微博        ,21
2020-3-5 23:34,@琼华1126 ,21
2020-3-5 22:34,。        ,21
2020-3-5 22:31,今天还听一位朋友说他有个朋友在美国定居，他朋友说这个病毒在美国根本没事，也就中国人囤口罩、戴口罩，老美都不戴，而且之前3M口罩号称美国断货是因为药店只有今年1月份之前生产的，之后生产的都国家管控了。整个话里话外都透露着在美国的优越性，我就呵呵了！        ,21
2020-3-5 20:04,外国就不能长点心吗？为啥偏是不听啊        ,21
2020-3-5 19:24,@MOON大帅子 ,21
2020-3-5 17:02,拜托拜托，病毒你要把没骨气的半殖民地清理干净，让国际友人来这里做自由人        ,21
2020-3-5 16:54,这次为何意大利那么严重啊？        ,21
2020-3-5 13:30,乌兰巴托141万人口//@明天有雨61427:神奇的蒙古和中亚五国 ,21
2020-3-5 11:24,太可怕了，请大家一定要重视啊，一起抗过这次危机！        ,21
2020-3-5 11:17,各国都在摆烂，难道为了明年状元签？        ,21
