2020-3-14 18:15,那还不如说要营养均衡，大骗子        ,1
2020-3-14 18:18,相信中医，就看中医，只信西医，那就别看中医。干嘛一定要去黑呢        ,1
2020-3-14 18:16,怎么调整呢？什么原理呢？怎么测试的呢？什么副作用呢？        ,1
2020-3-14 18:16,这他妈什么逻辑，你自己信吗？？？        ,1
2020-3-14 18:20,把人体调到干燥的环境，笑死我啦 ,1
2020-3-14 18:15,nb就够了        ,1
2020-3-14 18:15,人是水做的 怎么才能干燥 ,1
2020-3-14 18:21,每条中医药新闻下，都有固定文案的中医黑 ,1
2020-3-14 18:16,人体干燥？干尸吗？        ,1
2020-3-14 18:16,中医药要永远发展下去，还是需要利用现代科学技术，把药物原理展现出来，并返璞到中医理论上，同时提高提炼技术，这样普通人都能明白，才能更好发展。        ,1
2020-3-14 18:18,不要瞎吹，到时又给别人笑话        ,1
2020-3-14 18:15,呕        ,1
2020-3-14 18:17,如果病毒在可乐里不能生存，是不是也能证明可乐也能治疗？        ,1
2020-3-14 18:19,病毒畏惧高温，，所以我们只需要把人体加温到90度就能杀死它们了 ,2
2020-3-14 18:17,临床对照实验一下呗，别说测不了哦        ,2
2020-3-14 18:19,人体怎么可能干燥 ,2
2020-3-14 18:17,黑中医的会说是自愈，西医才治病。这回到要看看群体免疫自愈的死亡率。西医神药的治愈率 ,2
2020-3-14 18:16,不要脸极了        ,2
2020-3-14 18:16,不懂就问中药这么厉害。为啥当初没让李咏回来试试中医？还去什么美国呀？        ,2
2020-3-14 18:16,扶正祛邪        ,2
2020-3-14 18:29,中药控制是真的有效，中医黑背后都是西药利益集团在推动        ,2
2020-3-14 18:15,中医文化博大精深        ,2
2020-3-14 18:19,反正我吃中药七八年花了也有十几万了屁用没有        ,2
2020-3-14 18:42,是的，调节身体去对抗疾病一直是中医的主要方向        ,2
2020-3-14 18:20,岛叔，说句公道话，你信吗？        ,2
2020-3-14 18:16,几千年来的哲学。你不喜欢可以，但容不得你侮辱、践踏！        ,2
2020-3-14 18:38,病毒就在眼前，还打什么比方？你直接说中医对付冠状病毒是用了什么原理，不就完了吗？        ,3
2020-3-14 18:30,为什么那么多人黑中药？        ,3
2020-3-14 19:46,相信中医的就信，不信的就不信。没必要解释，解释多了反而被认为是伪科学。这种事情只能够用事实去证明。不过中医疗程比较长，这个应该是弱点。        ,3
2020-3-14 18:25,很好，为中医点赞.养生补气，以现代发展观发展千年药理 ,3
2020-3-14 18:18,  我打个比方， 吃了中药的。浑身穿上铠甲，上阵杀病毒。不吃中药的，光着膀子上阵杀病毒。那个赢的概率大。肯定是吃了中药的。 ,3
2020-3-14 18:18,专业的事交给专业的人做，不懂的人就别露怯了        ,3
2020-3-14 18:23,不是否定中医中药，就像我们也不迷信科学，而是说，我们的理由至少要足够严肃严谨并且诚实，医学不是文学，方法论不能是阴谋论。        ,3
2020-3-14 18:28,用草根树叶调整吗，真是张口就来，什么都敢吹，脸都不要了，都不如老军医看性病靠谱。        ,3
2020-3-14 18:16,加油！中医加油！        ,3
2020-3-14 21:05,怎么这么多中医黑？不信中医能治病的别用中医啊，别喝我们中国捐赠出去的汤药啊，牛什么呢都。        ,3
2020-3-14 20:08,没想到关于中医，评论区的喷子还不少，你不懂的，并不代表不是真的        ,3
2020-3-14 18:25,砖家说是靠中药来调整身体为干燥温暖的环境？怎么我觉得是砖家在挑战人类的智商呢？        ,4
2020-3-14 18:47,还TM调整人体状态，就问你中医用什么方法区分天花病毒、HⅣ病毒、SARS病毒、冠状病毒、埃博拉病毒的？说不出来方法您看的是哪门子病？别闹了好吗。。。 ,4
2020-3-14 20:16,中医其实一直都是这种思路，就像要消灭蚊虫，你可以直接用杀虫剂杀死蚊虫，你也可以改善生活环境让蚊虫没有寄生的环境，从而消灭蚊虫，最终的效果都可以达到。这次新冠也好，上次非典也好，中医中药都发挥了很好的效果。现在中医最大的问题是无法用现代的理论体系来科学的解释中医，这才是问题的关键！        ,4
2020-3-14 20:11,中医能存在这么久，其合理性肯定是有的，而且它把人体当成一个整体思考，通过调动全身去治疗局部病症，也有其合理性。只是因为证伪困难，而且中医与巫术同出一源，又有许多江湖骗子（官方的非官方的），再加上中医药领域鱼龙混杂，导致中医现在很尴尬。        ,4
2020-3-14 19:40,这些人应该能代表目前中医专家的最高水准了，说个问题一点科学素养都没有，还打比方，干燥？温暖？张口就是槽点，我们几千年的中医怎么办哦！钟南山的科学严谨，张文宏的降维解释，那才是专家，那才是科学的态度！        ,4
2020-3-14 18:25,又跟这讲玄学        ,4
2020-3-14 18:16,岛叔，这样真的好么        ,4
2020-3-14 20:01,调整的没生存环境了还戴口罩干嘛啊？都没生存环境了就是不会被感染啊，建议派去一线！这省了多少防护装备的钱啊        ,4
2020-3-14 18:22,中医要是真这么牛逼，那古代人的平均寿命应该不是那个水平        ,4
2020-3-14 18:16,牛逼牛逼        ,4
2020-3-14 18:28,中医就是用药增强人的自身免疫力和抵抗力，西医就是用药直接杀灭病毒，中西结合就是一边增兵一边杀毒。曾经看一个专家说的。        ,4
2020-3-14 18:16, ,4
2020-3-14 18:16,呵呵哒        ,4
2020-3-14 18:47,我一直都相信中医        ,5
2020-3-14 18:26,我还以为中药是打通经脉，引入天地灵气治好的呢        ,5
2020-3-14 20:04,这是个信仰问题，没有对错。这绝对不是个科学问题，因为有人并不承认科学的方法。用两种不同的语言辩论，怎么可能有输赢呢？        ,5
2020-3-14 20:04,想象一下没有中医的五千年文明史会是怎么样的？        ,5
2020-3-14 19:11,毁了中医的是打着中医的名号招摇撞骗的人。        ,5
2020-3-14 18:21,我的天 大家不要对中医药看法太偏了...中西医确实不同各有各的利弊，中医药是经过几千年来发展的，不能极度吹捧也不能一棒子打死啊        ,5
2020-3-14 18:20,从评论里可以看出，骂人的很多呀，无知者无畏，任重道远啊，        ,5
2020-3-14 18:40,岛叔我觉得真心没必要发这种东西        ,5
2020-3-14 18:17,中医一直不是杀死病毒，西药才是杀死病毒，但是也会引起病毒的抗药性，会越来越强大。        ,5
2020-3-14 19:05,问,5
2020-3-14 22:18,我的天，一提中医，中药，就像刨了他们家祖坟似的。 ,5
2020-3-14 21:09,爱信不信吧，中医有中医的优点        ,5
2020-3-14 19:04,中医就是个哲学问题，你们爱怎么说都行，反正我是相信科学，相信实验和应用的结果。        ,5
2020-3-14 18:20,不是我不愿意相信中医，你凭什么让我信，给点确凿的证据行不？        ,5
2020-3-14 18:18,主动选择中医药，受益匪浅。吃老祖宗的饭，比如服用清朝的药方。李时珍用陨石治病，我也用陨石治病，这些年都没有去医院——哈尔滨的陨石雨。        ,5
2020-3-15 03:00,中医有病毒这一说么？中医不都说什么病邪入侵么！对，是邪，蛮玄幻的！        ,6
2020-3-14 22:20,别说我国有中医 日本韩国都有 bb个啥？部分国人堪忧呀？那有人这么黑自己几千年传承?西医中医都有不足?        ,6
2020-3-14 20:52,老祖宗的中药是好东西，只是这这些年，被养生，玄学，八卦给毁了！        ,6
2020-3-14 19:03,愚昧无知，又蠢又坏。骗子的最高境界就是把自己给骗了        ,6
2020-3-14 18:40,多一种选择不是坏事，只不过现在中医水平参差不齐，好医生太少了。你让民众怎么办。        ,6
2020-3-14 18:26,不是双黄连吗？还是连花清瘟？        ,6
2020-3-14 19:26,把湿润温暖的环境通过中药调理变成温暖干燥的环境？真的不可思议的奇迹！中药竞可以能够使身体变得干燥起来？太玄了！我真的没办法理解。        ,6
2020-3-14 18:18,那么 问题来了 病毒喜欢什么环境 研究出来了吗 100%对么  我不是中医黑 我一直认为中西医结合才是正道 我见过太多的正规老中医 都是要求我去西医确诊 然后再来看 我只是觉得很多中医蹭热度……        ,6
2020-3-14 21:28,我听说，人体湿气只有在火化的那天才能被彻底除去。怎么去反驳别人 ,6
2020-3-14 18:26,民族瑰宝        ,6
2020-3-14 21:33,中医真的是一个宝藏，国家应该努力培养中医人才。长时间的忽视，和很多大拿都是从国外回来，经费都重点发展西医了。临床上中医很有效。现在中医的实验机理研究也很多，只是没有宣传很多人不知道而已。我是西医        ,6
2020-3-14 23:53,中医可以调理身体我信，但至于治病毒这一个部分，我还是听不懂，打的这个比方我也不懂。        ,6
2020-3-14 22:12,黑中医 就问你家蚊香有没有效果?脑袋真的是好东西?西医你过来解释一下?        ,6
2020-3-14 21:35,我就是信中医、用中医的那一类人 ,6
2020-3-14 21:33,支持中医，只不过一些水平不够的中医把招牌砸了，但是整个中医还是很有道理的        ,7
2020-3-14 21:17,你要想杀死，也得有那本事啊        ,7
2020-3-14 19:20,中医是宗教，或者是迷信，谁说得清呢？        ,7
2020-3-14 19:18,人体内部是稳态，又是潮湿温暖，真是有才，        ,7
2020-3-14 18:21,感觉看到中医就反的人挺无聊的。        ,7
2020-3-22 18:14,带来混乱的不是知识，是无知。中医黑分两种，一种是无知，一种是坏。        ,7
2020-3-20 15:19,一本正经的……！久咳不出，润疾，疏。而已，没那么复杂…… ,7
2020-3-15 09:16,笑死我了 ,7
2020-3-15 06:49,牛粪并不是要把病毒杀死，而是调整人体状态，让病毒在人体上没有生存环境。 ,7
2020-3-15 02:45,凡是说中医不好的！请听好！请以后感冒不要喝999感冒灵。肚子疼不要喝腹疼水！请直接去医院说打抗生素。西方标准。        ,7
2020-3-15 01:22,没文化&无脑黑真多 现代科学真牛逼啊 牛逼到这个病毒爆发了到现在都没特效药        ,7
2020-3-15 01:13,我不要打比方，直接说，越专业越严谨好。        ,7
2020-3-14 21:35,好好发展中医，打烂中医黑的脸。        ,7
2020-3-14 19:35,中药中的哪种成份作用于人体的哪些器官，什么原理，如何代谢，有无副作用等，这些能讲清楚吗？不要总是用阴阳五行之类带着神秘色彩又无法自圆其说的理论来显得中医厉害！        ,8
2020-3-14 19:19,要他说为什么就是打个比方，请你别打比方了，直接说理论吧。甚至你可以连理论都不用说，设计严谨的实验证明自己有效就行，别来啥上下五千年所以一定有效那一套。        ,8
2020-3-14 18:59,有用就好，实践是检验真理的唯一标准        ,8
2020-3-14 18:43,大骗子，你除了能举例子，你能真正的说明什么环境病毒不能生存而不影响其他人体机能，如何做到？你连病毒是什么都搞不清楚，靠人体试验测试吗？        ,8
2020-3-14 18:26,还能人体变干燥？是做木乃伊吗？死骗子。        ,8
2020-3-14 18:18,中国人喜欢打比方，好像外国人不喜欢        ,8
2020-3-14 18:17,我是不是要批准进口一些中医了        ,8
2020-3-14 18:17,所以李跃华是西医对吧 ,8
2020-3-14 18:15,明白        ,8
2020-3-15 09:47,人体干燥环境？木乃伊？宁知道人体80%是水？        ,8
2020-3-15 03:33,人体，干燥？？？？？哈哈哈哈哈哈哈        ,8
2020-3-15 02:09,什么人败坏中药的名声， 就是你们这些中医啊！！        ,8
2020-3-15 01:36,你快乐就好吧        ,9
2020-3-14 22:26,西医厉害是在定点治病上，中医优势是在调理治人。别他妈评论里瞎带节奏了        ,9
2020-3-14 22:16,干燥人体环境？？        ,9
2020-3-14 21:53,中医，你觉得有用你就去看，你不愿意相信就去选西医，再不行就中西医结合。中医这玩意就不像西医一样完全可以按公式套，还有中医其实更多的是治慢性病，现代人耗不起这个时间，只有去看西医速战速决。如果中医没用这次肺炎，国家也不会派中医专家团队去一线，每个省市县也就不会推出自己的中医治疗方案        ,9
2020-3-14 20:50,那现在能治疗好的就是中药最好的证明啊。        ,9
2020-3-14 20:44,白猫黑猫 能抓耗子就是好猫        ,9
2020-3-14 20:20,我不是学医的，不知道你们中西医是怎样的一种仇恨，一谈到中医，总是看到一群人在骂，作为中立者感觉中西医结合都少不了，这次新冠病毒的防疫就是例子。但我更希望中医能好好的发展和传承下去！        ,9
2020-3-14 19:30,一个疑问,9
2020-3-14 18:34,别问，问就是中华文化五千年传承，名族瑰宝        ,9
2020-3-14 18:25,应该要经过一个新冠病人只服用中药，看是否转阴。假如用其它抗病毒药后转阴那就说不清白的        ,9
2020-3-17 08:49,用核酸检测是否被传染上了新冠肺炎，用CT检查肺部感染情况，都与号脉等中医诊断方法不沾边，双黄莲、抗病毒口服液、板蓝根冲剂闹剧还是少演为好，别最后把遮羞布也被现实个撤掉了。        ,9
2020-3-17 08:42,用实验数据分析判断并说明中药制剂最终合成物是什么，是否对病毒有治疗或抑制作用，给小白鼠做测试，结果一目了然。依据测试和实验数据，用事实证明，又何苦空洞的强调中药的疗效？        ,9
2020-3-17 08:40,中医是遮着面纱的童话，给患者以无限的期待，就如同秦始皇寻长生不老药一样，中医就没有不能治疗不了的病。西医告诉患者现实，能治还是不能治，能治疗到什么程度或者还能活多久。在科技发展的当下，在实验室很容易就检测出来任何一种中药制剂的成分。        ,9
2020-3-15 11:31,哦。        ,9
2020-3-15 10:48,请领导先喝。        ,9
2020-3-15 09:57,牛逼。        ,10
2020-3-15 08:15,对不懂的 心生敬畏。每次很多中医黑 特别是挺多西医大V也这样 让我觉得很困惑。        ,10
2020-3-15 08:09,中医 和西医，是两套思维体系。        ,10
2020-3-15 08:07,除了可能就是不一定，自己都不信自己说的那套🙃        ,10
2020-3-15 01:18,都加油 ¡评论配图 ,10
2020-3-15 00:57,转发微博        ,10
2020-3-14 23:57,调理调理身体，增加抵抗力还是可以的        ,10
2020-3-14 23:39,具体是不是，全靠一张嘴        ,10
2020-3-14 23:38,外国人少的原因知道了，他们没有中药        ,10
2020-3-14 22:21,难怪一把脉全部都是湿寒体质 ,10
2020-3-14 21:27,别的不说，心理作用倒是蛮强大的，不接受反驳谢谢 ,10
2020-3-14 21:26,。。。        ,10
2020-3-14 20:55,哈哈哈哈        ,10
2020-3-14 20:29,哎        ,10
2020-3-14 20:26,希望中医能出一套完整而又有根据的理论，传了千年的中医，肯定蕴藏着力量。要有根据，比如老说人湿寒，但是人家如果不发烧，人体是恒温的，怎么解释寒呢？水多了就能排出去，怎么可能湿呢？        ,11
2020-3-14 20:10,真是扯淡         ,11
2020-3-14 20:02,作为一个医生或者科研人员，一直用“可能”这个词发表观点是不是不太严谨 ,11
2020-3-14 19:57,为啥会有中医黑？不理解        ,11
2020-3-14 19:36,某些医生的实验证明了rnai的确能在生物体液中稳定生存，某些医生只会当神棍，中医原理都不懂我也不知道是怎么考到中医执照的        ,11
2020-3-14 19:33,相信什么用什么，中医西医都各有持色！印度还相信恒河水能治病有什么不对？！        ,11
2020-3-14 18:57, ,11
2020-3-14 18:56,转发微博        ,11
2020-3-14 18:50,你信吗？中医黑，我是不信的。        ,11
2020-3-14 18:49,为什么一提到中医，有人智商就变50以下，一说西医这个人的智商就250了？？        ,11
2020-3-14 18:36,啥叫可能！？        ,11
2020-3-14 18:33,评论一群睿智怪        ,11
2020-3-14 18:27,中药。。这是另辟蹊径啊！ ,11
2020-3-14 18:20, ,11
2020-3-14 18:15,…        ,12
2020-3-15 07:36,中医理论内的干燥，直接理解为去掉水分的干尸。也真是无语了。那父母骂你猪脑子，你还真把自己当八戒理解了？不是自己知识架构内的就是伪科学？中学课本都学过吧，地心说到日心说的发展忘记了？一群认为地球是平的在嘲笑认为地球是圆的？很多东西只是现有技术手段无法解释而已。        ,12
2020-3-15 02:41,没有西医之前中国的先辈都是靠自愈活下来的？人体病理学就是一门靠观察和试验总结的实验性学科，从近代医学开始的研究也仅仅达到细胞、分子和器官层面，后面的系统和整体西医都不敢说研究透彻了，你们倒是很清楚，说无知都抬举你们，多读点书        ,12
2020-3-15 14:55,这TM说出来你自己信不信？        ,12
2020-3-15 09:45,西医是国际通行的标准，大药企把持着。各国民族医药没有被纳入这个体系，所以不被承认。中医如果真不行，如何支撑一个民族挺过漫长的岁月？中医主要是靠经验积累，熬不过当下论文定等级的职称评价系统，收入和身份无法保证，也入不了权力层，失去了话语权，人才难免出现断层，而假大师和假药就钻空子了        ,12
2020-3-15 09:19,张伯礼还特么胆囊摘除手术呢…调理吧，做啥手术，还打抗生素干啥 ,12
2020-3-15 08:19,改造成‘干燥温暖’的环境......这不是三体人的操作么        ,12
2020-3-15 01:13,方肘子反对的我就支持，这条狗现在已经完全疯了        ,12
2020-3-15 00:46,@我就是乐多多 这才是一本正经胡说八道        ,12
2020-3-14 22:56,中医的重点不应该在医吗，为什么一定要往中上扯，一定要扯文化自信?到底是谁不自信，质疑就是黑?那现代医学成天自黑        ,12
2020-3-14 22:53,希望信中医的人能做到永远不要吃西药，不要用现代医疗器械，信的纯粹，信的心服口服，好不好？        ,12
2020-3-14 22:47,瞎几把扯淡，堂而皇之        ,12
2020-3-14 22:44,怎么知道这个病毒喜欢潮湿环境呢？调成干燥温暖的环境？要变干尸吗？如果这也行，难怪艾滋病、乙肝等都有老中医跳出来说能治好，调成干燥环境就行了，就像开空调这么简单，还浪费时间和金钱研究疫苗和特效药干嘛？        ,12
2020-3-14 22:28,你可拉倒吧！你以为是垃圾分类啊干的湿的！首先你怎么定义干燥和湿润的环境？中药有效成分也是化学物质，它们进入人体之后怎么调节干湿？加个羟基？身体环境改变之后别的物质代谢怎么办？你是不是还想说“微调”？是不是还想说不影响其他身体机能？刘大侠你这话理性支持中医的看了都要沉默，怕是高级黑        ,12
2020-3-14 22:09,我听不出这位砖家说的话里的逻辑，毫无逻辑可言。        ,13
2020-3-14 21:53,醒醒吧，中医就是传销。你花在中医上的每一分钱都成了利益相关者包二奶的资本。        ,13
2020-3-14 21:50,每天挂阳台晒着就完事了        ,13
2020-3-14 21:47,没有实质证据的话还是要少说，这并不利于中医发展！要真正去思考，发展理论，并且寻找证据。        ,13
2020-3-14 21:33,这么厉害，还戴啥口罩呢，留给ICU的西医用呗。 ,13
2020-3-14 21:27,把人体调整到干燥温暖的环境？调整成这样人还能存活吗？        ,13
2020-3-14 21:21,“可能”，把治病原理建立在可能的基础上，这就是中医得特点，不确定，测不准！        ,13
2020-3-14 21:20,得多没脑子才会信这个。        ,13
2020-3-14 21:13,“但是，在没有特效药的情况下......”看来刘 “专家” 也承认选择中医药只是没有办法的办法了！刘清泉是抹黑中医的高手！！        ,13
2020-3-14 21:09,中医的信口开河，有点怀疑精神的人都不会相信。现代医学讲究的是证据，没有证据就说改变身体环境，这样胡说八道的话都有人相信？！若你是接受过高中理化生教育，尤其是接受过自然科学高等教育的，还相信这套鬼话，我觉得你真是侮辱了你接受的科学教育。        ,13
2020-3-14 21:09,制成木乃尹 ,13
2020-3-14 21:08,免疫力是现代医学的说法，那么就请你用现代医学理论详细解释下是怎么提高免疫力的！        ,13
2020-3-14 21:02,调整到60度杀毒？ ,13
2020-3-14 21:02,请问刘专家,13
2020-4-20 23:49,难道不是抽烟，改变人体均衡？        ,13
2020-4-16 10:46,回复 @大蹦蹦蹦鸡 的赞: 握手 ,14
2020-3-31 20:48,管用你就开学呀，我等着开学呢，        ,14
2020-3-31 13:38,中药根本没用，你个骗子        ,14
2020-3-22 13:28,中医黑，估计又说你没根据不科学        ,14
2020-3-22 13:22,我相信是调节免疫力，而不是干燥        ,14
2020-3-22 12:41,曲线救国，能让人痊愈就行，爱用不用，一个个黑什么黑？        ,14
2020-3-22 10:40,可别瞎扯了        ,14
2020-3-19 09:49,时间呢？调整的速度比病毒发展快吗？        ,14
2020-3-16 18:41,别问，问就是玄学。病人病好了，中医牛逼；病人病没好，这届病人不行        ,14
2020-3-16 15:47,相信中医        ,14
2020-3-16 01:43,不要打比方，请说明具体科学原理。        ,14
2020-3-15 22:09,医学由不得如此自圆其说。 ,14
2020-3-15 20:06,- 这是不让着床吧？ 吃避孕药？ ,14
2020-3-15 18:22,讲科学，中药是如何让一个rna病毒进入细胞之后停止复制呢？有这本事为啥证明不了自己，老让全世界质疑？现在想收割钟南山张文宏们的成果？？        ,14
2020-3-15 16:58,调成干尸状态        ,14
2020-3-15 16:39,中医有中医擅长得领域 这个时候就别出来刷存在感了        ,15
2020-3-15 13:58,转发微博        ,15
2020-3-15 13:18,牛逼奥，把身体调整到RNA无法生存的环境，然后人没了，病毒确实无法生存 ,15
2020-3-15 12:47,中医无所不能！        ,15
2020-3-15 11:56,怎样调，多少度为干燥？        ,15
2020-3-15 11:55,很多人只相信眼见为实，眼不见的，你给他说了，他就要嗤之以鼻贬低你黑你！高人一般不说，偶尔仁慈说一下。西医是真的科学，但不一定是真理！中医是伪科学，但是是真真理！        ,15
2020-3-15 11:54,又来胡说八道了        ,15
2020-3-15 11:19,安慰剂效应 ,15
2020-3-15 11:00,妖魔鬼怪魑魅魍魉        ,15
2020-3-15 10:05,“病毒在人体身上没有生存环境”，他坚称......        ,15
2020-3-15 09:55,没有数据对比 不能判断。        ,15
2020-3-15 09:46,中西医各有优点，相辅相成，为什么非要黑呢，你不喜欢中医就别看啊        ,15
2020-3-15 09:43,这才是中医的精髓，是对人的辩证医治，这也是中医的难点，现代科学并不能深入了解人体自身的免疫系统的产生运行机理，所以现代科学对中医的科学性很难说的透，这也是那些迷信西学的人黑中医药的证据，其实不是中医药不科学而是现代科学还没达到那个境界，        ,15
2020-3-15 09:36,虾撤蛋        ,15
2020-3-15 09:24,卧槽，如果中医这么管用的话，请让中医医院的医生上好吧？！！疫情快结束了就出来乱吹，怎么滴，打算发展中药产业了？！！看着我妈这一辈人对这种专家这种媒体发的文深信不疑，真是生气！        ,15
2020-3-15 09:14,现代社会，要用现代社会的逻辑，方法论，实验验证标准，一切都在进步，你还在2000年前，怎么服众？        ,16
2020-3-15 09:04,中医的强大之处，就是善用比喻，大爷大妈一听就懂，就能马上转发。        ,16
2020-3-15 09:00,哈哈哈哈哈😂        ,16
2020-3-15 08:38,正气内存，邪不可干。        ,16
2020-3-15 08:32,中医博大精深，为什么不信？        ,16
2020-3-15 08:30,有必要这么多中医黑么        ,16
2020-3-15 08:26,这话说的好像这次疫情西药就能杀死病毒一样。        ,16
2020-3-15 08:19,身为中国人为什么那么多人黑中医，以前没有西医不都是中医看好的吗？        ,16
2020-3-15 08:16,潮湿的人体环境 ,16
2020-3-15 08:13,我想知道人体什么样的环境会让新冠肺炎病毒难生存？如何吃何种中药达到这个人体环境？        ,16
