2020-3-15 07:43,拿西医理论评价中医，就是个谎言。两者都不是同一体系的。就像英语质疑中文，为何一个发音可以对应多个字，一个字都多重含义一样。为何不是一个发音只对应一个单词，对应一个含义一样。这种对比本身就不科学。        ,16
2020-3-15 07:36,嘴上起个泡咋都说是上火了呢？这上火西医怎么治，西医先叫你验个血看看血常规，一通检查啥都没问题然后叫你吃的清淡点，检查费几百，中医把个脉开几副清火的方子解决问题。        ,16
2020-3-15 07:29,"本来就是,我比喻的老鼠理论。处界老鼠在变你烦不了、关键要防的是不让老鼠进门,进门后不让下仔，是关键。        ",16
2020-3-15 07:28,哪些问原理的中医黑，同样是娘胎里出来的，吃米吃肉喝水长大的，为啥每个人的基因都不一样呢？为啥班上一个老师教的，有人90分有人60分呢？这不科学啊。别和我说道理，用科学手段分析下。        ,16
2020-3-15 07:24,中医有按摩推拿拔罐能去疼痛你能说没效果？西医就开一只扶他林回去自己涂，或者开点散利痛。        ,17
2020-3-15 07:20,中药:我一个辅助又不能单挑大龙，顶多给你套一百个buff，去除所有的debuff，至于输出，全靠你了adc ,17
2020-3-15 07:03,能不能找个真正懂得中医、能说明白的中医大家出来说话，别让这样的“江湖术士”出来多嘴了！这种人一张嘴说话，就是对祖国瑰宝的中医多一份质疑！增加公众的不信任感！只有这种人不说话，中医才能发扬光大！        ,17
2020-3-15 06:04,中医学博大精深，现代文明西医一直把中医都给压迫了；如中医世家，祖孙三代都行医，现代因为没有行医资格证，被迫转成“地下党”何等的悲怆！遇到好几处这样的情况！最后老中医都解甲归田了！后继无人了！空悲切，能算吗？        ,17
2020-3-15 05:38,我就喜欢看你们无脑黑中医，老祖宗几百上千年下来可没死绝        ,17
2020-3-15 05:15,我觉得不要搞中西医结合，为什么总让西医占我们便宜！只用中医治，让世界好好看看我们中医的博大精深！        ,17
2020-3-15 05:00,中草药也是由元素组成，西医用药也是人工合成化学元素，中药慢因为草药中治疗元素含量低，但是天然的，西药快因为是人工合成化学元素这都是浓度高，毒品也分植物提取可卡因和化学合成冰毒。中医根据经验积累，动植物对病症有治疗效，西医根据仪器化学检验，使用化学合成药剂对点作用，中医对面作用。        ,17
2020-3-15 04:20,人体内环境很复杂的，傻子们        ,17
2020-3-15 04:13,当你学了西医就不会觉得中医有道理了        ,17
2020-3-15 04:02,不会不要紧，虚心的去学。不了解不要紧，可以去调查        ,17
2020-3-15 03:45,好神奇啊，我有点听不懂！        ,17
2020-3-15 03:24,唔，关于中医黑的事情,17
2020-3-15 03:13,真的是服了这家伙了        ,17
2020-3-15 02:31,量子药学 在得与不得平衡 在湿与不湿排毒        ,17
2020-3-15 02:30,西医用科学的方法治病，中医用哲学的的方法治病，中医与西医的区别在于哲学与科学        ,17
2020-3-15 02:29,九年义务就教出这种没逻辑的东西        ,18
2020-3-15 01:21,嗯 懂了 参与治愈率🐶        ,18
2020-3-15 01:07,其实真正杀死病毒的是饭，所有痊愈者都是吃饭吃好的，从新冠病毒爆发以来，我还没有见过有一例感染患者不吃饭就痊愈的 ,18
2020-3-15 00:56,大媒体真的不要再给中医背书了，让它自生自灭吧！        ,18
2020-3-15 00:55,要点脸吧        ,18
2020-3-15 00:53,前一阵看到有篇论文是中国中医研究院发的，说是扎针可以治疗近亲属，也就是说给父母扎针可以治疗小孩的病，还说以后给地球上的亲人扎针可以治疗宇航员的病，不知道是不是真的        ,18
2020-3-15 00:48,这种中医骗子怎么那么多呢，人体还能随便调整干湿状态        ,18
2020-3-15 00:44,我们无法改变世界，只能改变自己去适应这个世界。——是要基因突变吗？        ,18
2020-3-15 00:43,是时候为中医药正名了，中医从未赢过一场网络争辩，却从未缺席任何一个民族大义！        ,18
2020-3-15 00:18,这个解释恰到好处 ,18
2020-3-15 00:09,能治好病的都是好药        ,18
2020-3-15 00:06,这人是怎么忍住没笑出声的？        ,18
2020-3-15 00:03,这下面都是些什么人在留言啊        ,18
2020-3-14 23:55,不信中医中药的别吃不就行了        ,18
2020-3-14 23:49,中医中药自强，也是文化自信的一部分！        ,19
2020-3-14 23:37,一种是蠢，一种是恰饭        ,19
2020-3-14 23:34,就药材而论现在都大规模现代化人工种植，跟以前天然的空气水肥生长的成分未必都一样了        ,19
2020-3-14 23:33,中西结合        ,19
2020-3-14 23:23,这个有什么可以争论的 既然是调理 能改善人体状态 这个逻辑下最适合治疗高血压 糖尿病了 但是你问问涨这些基础病的有敢不吃西药只吃中药的吗？        ,19
2020-3-14 23:20,哦，懂了，所以说中医治好新冠肺炎不是因为药效，而是用了战术，围魏救赵、围点打援什么的        ,19
2020-3-14 23:18,木乃伊？        ,19
2020-3-14 23:17,刘专家说的有道理，把人体调节成木乃伊那样的“干燥”估计冠状病毒生存不了。 ,19
2020-3-14 23:16,中医专家别看西医，就成了。没什么好争论的。        ,19
2020-3-14 23:13,转发微博        ,19
2020-3-14 23:06,为什么这么多人黑中药，什么仇什么怨        ,19
2020-3-14 23:05,呵呵        ,19
2020-3-14 23:00,邪乎        ,19
2020-3-14 22:56,说什么干燥的环境，他只是举例子说明。不要乱黑，请仔细看他的说的话。        ,19
2020-3-14 22:49,屁股决定脑袋        ,20
2020-3-14 22:49,这评论里的键盘侠到底有几个是学医的 这疫情 有教人看病的 有教人治国的 有教人经济的 说真的键盘侠们人均博士 他们才是我们国家的希望啊        ,20
2020-3-14 22:43,如果中医彻底退出中国，那这次新冠肺炎会是什么样呢？黑中医的说说，会不会像西方国家那样？像西方那样，你们就高兴了？        ,20
2020-3-14 22:28,每个人都可以在不感染别人的前提下决定自己怎么治疗，命是自己的。但是人又天生喜欢说服别人，所以才产生了各种黑。        ,20
2020-3-14 22:25,病毒没死也无法生存 ,20
2020-3-14 22:22,说白了，就是调理增强免疫力…        ,20
2020-3-14 22:17,这脸呢        ,20
2020-3-14 22:16,邹缨齐紫        ,20
2020-3-14 22:08,我的天呐，还有这等本领，那到底病毒是喜欢湿呢？还是喜欢干？看来得长期服药，决不能回到适合病毒的环境。顺便说一下，百度百科没查到其学历，有一堆荣誉，知道的给补充一下吧。        ,20
2020-3-14 22:08,说的很对        ,20
2020-3-14 22:07,评论太多人到底了解中医吗？还是张嘴就开黑        ,20
2020-3-14 22:03,只许中医点赞，不许西医治病！        ,20
2020-3-14 21:59,我觉得，诸葛亮一定是懂中医的，他那么聪明，能够体察世间万物。        ,20
2020-3-14 21:59,相信中医！支持中医！        ,20
2020-3-14 21:58,嗯，潮了放太阳底下晒晒也中 ,20
2020-4-22 13:23,不错        ,21
2020-4-20 23:49,难道不是抽烟，改变人体均衡？        ,21
2020-4-16 10:46,回复 @大蹦蹦蹦鸡 的赞: 握手 ,21
2020-3-31 20:48,管用你就开学呀，我等着开学呢，        ,21
2020-3-31 13:38,中药根本没用，你个骗子        ,21
2020-3-23 17:16,人体可调节，或沙漠或沼泽 ,21
2020-3-22 18:14,带来混乱的不是知识，是无知。中医黑分两种，一种是无知，一种是坏。        ,21
2020-3-22 13:28,中医黑，估计又说你没根据不科学        ,21
2020-3-22 13:25,为什么几千年连天花都控制不住呢？        ,21
2020-3-22 13:22,我相信是调节免疫力，而不是干燥        ,21
