2020-3-23 03:29,全人类的敌人就只有一个那就是病毒 不过垃圾蓬佩奥和特朗普要是想给美国多找个敌人 我们是不在乎的 反正现在是我们好了 你们在完蛋的路上了        ,17
2020-3-23 03:18,加油连任，超美靠你了，建国 ,17
2020-3-23 03:18,总结,17
2020-3-23 03:17,美国现在已经超级不要脸了，如果每个国家都没有道德观，那我们支援那些国家，会不会出现农夫与蛇的故事，因为美国率先不要脸为榜样！        ,17
2020-3-23 02:57,从未如此讨厌美国        ,17
2020-3-23 02:52,冰汝一定要保重！        ,17
2020-3-23 02:48,有些人，对它恨之入骨，但也不敢咒它  ，怕越咒活的越久......        ,17
2020-3-23 02:25,你已经是一个成熟的新冠了，请精准打击。        ,17
2020-3-23 02:09,能不甩锅吗…唐宝宝和彭狗子要是这脏水泼不出去，自己就得跳进这泥潭子啦…大选和股市是他们最care的。其他一切都可以牺牲…        ,17
2020-3-23 01:58,如果全面检查美国人，美国流感会不攻自破，所以美国政府一直在捂着，害怕被揭开        ,17
2020-3-23 01:46,就是作的   之前除了台湾说武汉病毒  世界上主流没听说 中国病毒。。还有日本个别消息说可能美国，这不挺好的么？非得转移注意力。。非得甩锅，作吧        ,17
2020-3-23 01:26,应该全民动员起来揭露他们的甩锅阴谋！        ,17
2020-3-23 00:53,垃圾凤凰网        ,17
2020-3-23 00:42,坐等美国集体团灭        ,18
2020-3-23 00:34,垃圾王冰汝，个人倾向太重，好好跟王又又学学吧        ,18
2020-3-23 00:27,那家national vaccum好像已经撤下了        ,18
2020-3-23 00:23,米快亡国了        ,18
2020-3-23 00:22,美帝那么水深火热的不赶紧回来 ,18
2020-3-23 00:22,姐 你太美了 ,18
2020-3-23 00:22,中国完全就可以不用帮助美国        ,18
2020-3-23 00:18,狼狈为奸        ,18
2020-3-23 00:06,你啥时候和特朗普一起吃饭？        ,18
2020-3-23 00:02,吃了顿饭改口莫非是棺材铺请客？        ,18
2020-3-23 00:01,美国“流感😷”早于新冠在武汉爆发，是流感还是真实的新冠美子心知肚明，采取欺骗手法掩盖不了心虚，严格意义上讲这次新冠冠名应为“美利坚所谓流感性新型冠状病毒”才对        ,18
2020-3-23 00:00,指责赵的人应该知道台湾和美国的武汉肺炎的叫法，以及彭佩奥多次不负责言论。        ,18
2020-3-22 23:59,好        ,18
2020-3-22 23:58,特朗普的这种言行是极度不负责任的，给海外华人带来了巨大安全风险，应当严厉谴责！！ 我是论南海破局之道、为什么人民币不能国际化及其陷阱、浅谈货币与信用体系、朝核问题本质作者，本次疫情我于1月25日建议将“武汉疫情”上升为“全国疫情”。 希望有更多的人能关注我、了解我、支持我。        ,18
2020-3-22 23:58,还是要听the deep state department的.        ,18
2020-3-22 23:54,周一特朗普熔断又要开始了。        ,19
2020-3-22 23:50,美国可能随着疫情爆发和大规模发展，无法控制，最终特朗普怨妇似的，下任大选泡汤咯！        ,19
2020-3-22 23:49,川,19
2020-3-22 23:48, ,19
2020-3-22 23:46,就因为是美国制造所以我们克服了，要真是中国制造去，那美国可真就完了。        ,19
2020-3-22 23:44,俩人一起去太空吧😂😂        ,19
2020-3-22 23:44,本来就是掐架，往对方蛋上踢        ,19
2020-3-22 23:44,尘归尘，土归土，美国毒王特朗普        ,19
2020-3-22 23:44,冤有头，债有主，要找就找特朗普！        ,19
2020-3-22 23:43,作死美利坚，熔断每一天        ,19
2020-3-22 23:43,如果仅仅只是拌个嘴仗，弄个选举也就这么回事，就怕不是这样！        ,19
2020-3-22 23:41,这是哪个村        ,19
2020-3-22 23:39,特朗普还要参加选举吗？眼袋会更白吧        ,19
2020-3-22 23:39, ,19
2020-3-22 23:34,两只猪        ,20
2020-3-22 23:33,这个时候要转移矛盾，稳定内部，不然你以为诸葛亮为什么伐魏。        ,20
2020-3-22 23:33,明明就是你们传过来的，你们的电子烟，敢不敢测测他们，当时就是新冠，非说是电子烟        ,20
2020-3-22 23:32,美国病毒从9月就开始传播了，只不过当时被美国政府强行当作普通流感来治疗。最后电子烟莫名其妙背了黑锅。10月随着美军来到武汉，11月武汉就出现不明原因肺炎，这就解释了为什么是武汉爆发，而其他人口更密集的北上广却没有。        ,20
2020-3-22 23:31,嘿嘿        ,20
2020-3-22 23:29,轉發微博        ,20
2020-3-22 23:24,咱也可以发声明叫美利坚病毒啊 没毛病啊        ,20
2020-3-22 23:24,我们就不能改名叫美国病毒吗        ,20
2020-3-22 23:17,哈哈哈        ,20
2020-3-22 23:16,有些人死皮不要脸！整天胡咧咧个啥！吹牛逼自己成功人士，恁是眼瞎还是心黑？恁个犟驴！整天算盘打的响，算来算去一场空！恁是耍猴呢？天天看猴戏咧？        ,20
2020-3-22 23:16,下一步就张嘴要口罩了。还是互相伤害吧。这样口罩就不用给了        ,20
2020-3-22 23:13,新冠病毒,20
2020-3-22 23:13,不靠谱的总统        ,20
2020-3-22 23:13,不知谁请的谁？        ,20
2020-4-15 08:15,美国政客是一群无下线，无节操的东西！不要对他们抱有任何幻想！        ,20
2020-4-15 08:15,美国政客是一群无下线，无节操的东西！不要对他们抱有任何幻想！        ,21
2020-3-30 12:11,冰汝好小一只 ,21
2020-3-27 09:10,美国不要脸的政客，一定会被病毒击败        ,21
2020-3-26 18:20,嗯，第一张图收藏了 ,21
2020-3-26 13:31,驻美记者王冰汝,21
2020-3-26 12:29,越需要科学来论证的时候越信口开河的人不值得信任，美国民众要擦亮眼睛        ,21
2020-3-26 09:38,也就是美国承认，这是人造病毒！是生物武器！非动物自身带的天然病毒！ ,21
2020-3-26 08:52,美国老是指责中国没有提早告知美国，但实际情况是，就算美国在宇宙大爆炸之时就知道这个病毒的存在，只要美国国内没有火烧眉毛，他们也完全不在乎。中国用自己的巨大损失和努力给了美国三个月的准备时间，而美国无动于衷，坐岸观火，一事无为。        ,21
2020-3-26 08:25,两国相争各为其主        ,21
2020-3-26 08:23,两户人家吵架了，谁听的准说的是真的，赶快把墙拆了，我们一起帮着骂。PS腿腿还是相当漂亮的 ,21
2020-3-26 07:49,迫于疫情这样严重，在不改口的话下场你知道了。        ,21
2020-3-26 07:39,推特上大使馆还在抹黑，佩洛西蓬佩奥也一直在黑        ,21
