1月29日 22:25,我真的气死了气死了气死了气死了气死了气死了(不是说不上热搜就代表政府不作为，但是也应该让大家知道了解，以及更加重视！！我每天早上醒来第一件事就是刷微博 看湖南的疫情   学学河南吧 毕竟我们湖南的情况不容乐观)        ,13
1月29日 22:23,湖南岳阳，离湖北特别近，我们这里情况好紧急，一医院都快没物质了        ,13
1月29日 22:23,昨天晚上我妈就在路边上看到鄂A的车在行驶，麻烦湖南重视一下！        ,13
1月29日 22:22,湖南zf不作为能怎么办 ,13
1月29日 22:19,而且湖南也没出复工通知，企业还要求提前去上班        ,13
1月29日 22:17,啊啊啊啊啊啊啊湖南你给我上去        ,13
1月29日 22:14,湖南乡下聚众赌博太严重了，根本没人管        ,13
1月29日 22:07,永州能具体到县村吗? 刷了好久的新闻都刷不到 ,13
1月29日 21:26,今天长沙很多地方的公交车都停运了        ,13
1月29日 21:26,我湖南终于上热搜了，太难了 ,14
1月29日 21:20,如何分配捐赠资源是个问题//@一只兔耳朵i:湖南好多医院都缺物资啊 二十四线小县城都没口罩了 救救我们吧 村干部也不管事 宣传真的不到位 麻将馆还是满的 这两天天气好 家里人真的又跃跃欲试 （出去打麻将）真的太难了 我妈过两天去工厂上班了 还没买到口罩 看看我们吧 ,14
1月29日 21:19,湖南某乡镇只看到了县政府通知，镇政府到现在一个通知文件都没有，宣传也没有，还有一些中老年人没带口罩，这两天天气暖和了还坐在一起打牌，口罩一个都买不到 ,14
1月29日 21:17,坐标湖南省永州市新田县新隆镇，我们这边当地的村干部都不怎么管事的，打牌的照样打        ,14
1月29日 21:10,不听话咧，我要爆粗口了        ,14
1月29日 21:03,罪魁祸首是武汉政府，如果早点通报宣传就没有那么多人外出和返乡，如果说吃蝙蝠的人是罪魁祸首，那武汉政府就是帮凶        ,14
1月29日 20:52,浪不浪！?        ,14
1月29日 20:49,具体永州哪里没有说。永州市的卫健委官网也没有明写！        ,14
1月29日 20:48,！！！！！！！！！！！！！！！！！！！！！！！！！！！！！！！！！！！！！！！！！！！！！！！！！！！！！！！！！！！        ,14
1月29日 20:47,！！！！！！！！！！！！        ,14
1月29日 20:36,延迟开学和复工的文件一直不下来！！！！！！！        ,14
1月29日 20:33,湖南乡下还在串门拜年！！！政府能不能重视！！！！        ,14
1月29日 20:21,湖南没人管啊！消息得自己搜        ,14
1月29日 20:20,湖南的官员真的是不做人        ,14
1月29日 20:15,所以湖南能推迟复工吗？        ,15
1月29日 15:28,这一顿饭吃的        ,15
1月30日 17:36,湖南政府实现成为湖北武汉的接班人吗        ,15
1月30日 14:48,湖南也封了吧，不许外人进入最好了！        ,15
1月30日 14:47,湖南延迟复工吧！        ,15
1月30日 09:45,湖南在干什么jm，疫情都这么严重了，什么动静都没有，一没延迟开学开工的通知，二不公布确诊人员的具体地址和所到过地方的行踪，三蔬菜口罩价格飞涨没人管，四每天确诊这么多人，没有一例治愈出院的，五隔离那250个武汉来的法国人也消息公布了！！是想让我们比一比谁的生命力更顽强吗？        ,15
1月30日 09:33,湖南政府真的没有心，确诊病例增加这么多，普通人员今天还照样上班        ,15
1月30日 09:25,湖南永州，我婆婆天天在她姐姐家里打牌，说不听劝不动，无语死了        ,15
1月30日 09:22,我就是湖南永州的，这种情况下，我婆婆还天天出去跟别人扯胡子打牌，我真的无语了，劝不动        ,15
1月30日 09:13,而且我们今天要去上班我好怕啊卧槽        ,15
1月30日 09:12,这么看来从接触到发病只需要五天时间左右，潜伏期没那么长        ,15
1月30日 09:12,我爸爸在长沙每天都出门，也不戴口罩，还打牌，简直了，有的人压根不听，球球湖南政府强制一点，把麻将馆啥的关了吧，不要允许聚会了        ,15
1月30日 09:05,该啊，该！        ,15
1月30日 08:47,聚餐聚你妈呢        ,15
1月30日 03:33,看好多人说对湖南失望，我早几天就收到学校通知延迟了，现在被关在农村，每天傍晚戴口罩出门散步偶尔遇到的爷爷奶奶也有些带了口罩，说实话是有没带的，要真计较没戴口罩，湖北到现在也有人聚集打牌不戴口罩，大家都一样，只说湖南是不是有点不好？ ,15
1月30日 02:41,娄底市区，初八上班，买不到口罩，瑟瑟发抖        ,16
1月30日 02:07,湖南政府不作为，该管，中央该管管关注了。        ,16
1月30日 02:06,@stay_corn ,16
1月30日 01:46,我真的被湖南气死！！！真的是不作为！！！        ,16
1月30日 01:21,虽然湖南临近广东，但是没有哪一方面比得过广东        ,16
1月30日 01:07,我真的每天手动搜湖南搜湘潭 可不可以给具体数据行动轨迹 我们这还有好多人聚会啊串门啊 那么多湖北回来的人 能不能来点措施啊        ,16
1月30日 01:06,说实话，我湖南的，我们乡镇一直宣传到位，大家都没出门都没串门，广播一直喊，派出所和卫生院都做好了，主要路口有人量体温，武汉人员摸底也一直在做，在监管，口罩也有卖，我不知道别的地方怎么那样子，我们这长沙宁乡都做的很好        ,16
1月30日 00:52,看到这些热门评论，真是替那些个成天在奔走的工作人员心寒，别的地方不说，郴州哪一例都清楚通报了，我们小区门口的喇叭每天都不间断的循环播放🔁，自己不重视，我能说什么🤔        ,16
1月30日 00:46,我求求你湖南政府你急一急你急一急你急一急你急一急你急一急你急一急你急一急你急一急你急一急你急一急你急一急你急一急你急一急你急一急你急一急你急一急你急一急你赶紧给我急起来！！！        ,16
1月30日 00:37,我们湖南哪里发病，连地方都不知道        ,16
1月30日 00:10,感觉湖南政府慢半拍        ,16
1月30日 00:02,卧槽！湖南zf瞒的太过了，24号就确诊了，现在才出来 ,16
1月30日 00:01,湖南株洲妇幼保健院急缺口罩、防护服，政府管不管啊！都是孕妇、孩子去那就医，如果医疗防护措施不到位，后果很严重啊！        ,16
1月29日 23:51,湖南省27家医院缺治疗物资，救救重灾区吧这几天关于湖南的热搜啥的都没有，还在一天之内确诊翻倍了全国确诊人数第四，至今无一例治愈出院的，救救湖南吧        ,16
1月29日 23:41,长沙每天确诊的请公布一下具体情况啊！！！湖南真的没什么反应啊，增长速度这么快！！！！！        ,17
1月29日 23:41,湖南村里面一点宣传没有，大家照样走亲戚，然后聚集打麻将，求管管        ,17
1月29日 23:40,看看湖南吧 作为湖北的兄弟省份 仅次于浙江广东密集流动人口被感染的城市 湖南省许多城市的各个乡村都不足够引起重视 也没有上级领导加强宣传 一天增加78例 是多么恐怖的数字！！        ,17
1月29日 23:40,多关注关注湖南吧        ,17
1月29日 23:39,看看湖南吧，增长速度太快了，引起重视吧！！每天醒来第一件事就是看人数统计！！！        ,17
1月29日 23:34,麻烦国家管管我们湖南好嘛，湖南省永州市东安县的火车站，没有任何防范措施，所有的人员不用经过任何检查就可以坐火车，这是这个时候该有的现象吗？不止武汉有难，湖南乃至每个省都难啊        ,17
1月29日 23:24,看看湖南吧        ,17
1月29日 23:21,湖南zf不作为，让我们湖南炸成烟花吧，大家一起交叉感染，等死就好了        ,17
1月29日 23:17,救救湖南吧！真的太恐怖了d(ŐдŐ๑)，很多地方都禁止出入了        ,17
1月29日 23:17,我们大湖南，挺住！！！让我们大湖南上一次热搜吧        ,17
1月29日 23:16,两个地方就一个南一个北的区别 ,17
1月29日 23:16,十五日发病十五日聚餐！！！！！        ,17
1月29日 23:15,急啊，孕妇急的很………        ,17
1月29日 23:09,湖南湘潭，除了贴了几张告市民书和零零星星几个跑的飞快的小电驴的喇叭宣传，再也看不到任何措施了。麻将馆照开，市民照不戴口罩出门瞎蹦哒，路面随处可见丢弃的槟榔渣弃用口罩（有可能传播病毒）口罩和酒精跑了n天问了n家都买不到。这还是市区呀！就在市政府周边的居民区呀！管管孩子吧。。。        ,17
1月29日 23:09,这算超级传染者吧        ,18
1月29日 23:08,湖南给我重视        ,18
1月29日 23:00,希望湖南政府硬核执法到乡下，不仅父母听不进去很多年轻人也觉得是小题大做了，根本不重视普及不够，一样聚众赌博        ,18
1月29日 22:46,杨某好厉害啊吃一次中一个        ,18
1月29日 22:45,湖南也需要支援啊，碍着湖北那么近，还有武汉患者故意跑出来到湖南街上嚯嚯人的。        ,18
1月29日 22:23,我这边岳阳华容的，乡下牌场都没关 ,18
1月29日 22:21,家里人还想出去串门 ,18
1月29日 22:17,不去湖南        ,18
1月29日 22:14,03        ,18
1月29日 22:13,湖南哎        ,18
1月29日 22:10,这么算潜伏期不是15天        ,18
1月29日 22:00,第一个发声的医生 那群官员无辜的百姓 ,19
1月29日 21:51,永州还有好多瞒报        ,19
1月29日 21:45,造孽啊，没有授权你就不说了？你就不能向党中央直接汇报么？        ,19
1月29日 21:43,能不能重视一下湖南！！！湖南一直都是疫情严重省份前几！但是我感觉不到被重视！开学还不延迟！急哭了！一想到一个大教室一起上课，那么多人在食堂我真的怕啊！        ,19
1月29日 21:36,吓死个人        ,19
1月29日 21:35,湖南政府太腐败了！！！！！        ,19
1月29日 21:35,@rita-花语心愿  ,19
1月29日 21:30,真的怕了，开始最先拉动一级戒备我湖南还是第二，我心里还庆幸湖南比湖北的官员有作为，但是这几天湖南病例持续上升，我澧县离湖北十几分钟路程，在家瑟瑟发抖，前几天电视播放老人比较重视，待家里没出去，憋了几天觉得不会到自己身上，已经开始聚集打牌聊天了，政府压根没作为没重视        ,19
1月29日 21:28,湖南什么都不配拥有我妈妈医院在河南订的口罩等医疗器械在上海转的时候全部被截发往武汉，武汉是重要可我妈妈医院也是定点医院，最后院领导自己开车去上级市卫生局申请调配，我们湖南不配(帮转)        ,19
1月29日 21:27,聚尼玛        ,19
1月29日 21:25,1.在家全程看不到宣传 全靠子女在家里拼命吵架 宣传也只是在官方公众号发个倡议没有惩罚不落到实处全是虚的 2.被确诊人数全国第四却没有一例治愈 3.每日新增人数只有数量没有具体地点 导致人们的侥幸心理  4.上班日期和推迟开学的通知迟迟不确定         ,19
1月29日 21:21,我也是服了 就不能详细一点吗 别人省份都精确到村了 这就说个市 我也是服了        ,19
1月29日 21:17,救救浏阳！救救浏阳！！救救浏阳！！！没有口罩，只有串门打牌聚餐，呼市无人机都用上了，浏阳政府能强硬点吗        ,19
1月29日 21:14,我们县里面都快赶上江苏了 县里面没通知 各个村镇 自己颁布封闭的命令 反而县里没什么动静        ,19
1月29日 21:08,年前接触的开始暴发        ,19
1月29日 21:08,湖南稳住，衡阳稳住，自觉保护好自己身边人🙏别让病毒扩散开了，各市县镇年边医院本来就紧张。希望这次灾难快点过去吧。🙏我还得给家人找个好媳妇回家呢 ,20
1月29日 21:06,为什么没有人追溯余甜了啊？？？？源头不根治？太无力了啊！！！！！保护伞这么强吗？？？？？？？？？？？？        ,20
1月29日 21:03,我的天哪        ,20
1月29日 20:58,说不让聚餐不让聚餐，就非要吃那个饭，服了        ,20
1月29日 20:46,21号前被感染却因不明肺炎而去世的亡者，太憋屈了 ,20
1月29日 20:40,你嘘气啥了你嘘气，你可了高贵还不是，你长了可了好看，可了苗条，叫大家去瞧你诺憋样了，你嘘中啥了嘘中，有些人不是非得要广播说这不好听的话，有些人就是死皮不要脸，你真不怕死？好去聚堆儿，只怕自己死的慢，你干啥了你，你把党支部村委会的号召当耳旁风？你是个人不是，你扯淡了很你……        ,20
1月29日 20:17,热搜来了，俺们这里还没有 ,20
1月29日 20:13,大湖南加油 ,20
1月29日 15:27, ,20
1月30日 00:27,湖南那么严重各种告急都没有什么人关心，还在不断派支援，病例都那么多了🙃我们省真的不富裕🙃        ,20
1月30日 00:10,行吧，看来湖南不更严重是不会管的，湖南实惨        ,20
1月30日 00:08,我…害怕😨 （是真的😨 ）还一个个对比了一下我回永州的日期跟上面的一样不。求求湖南zf干预一下        ,20
2月5日 16:39,病例8接触的是病例2吗        ,20
2月1日 02:00,这桌聚餐的真的绝了我家附近那例说是这桌聚餐传染的第三代病例1是去武汉看读书的女儿 去了几天就回来了 回来之后跑了好几个区 自己的区上班 来我们区聚餐、开会 又去了别的区 还去了另一个区看岳父还是交警大队的 接触的人真的太多了 ,20
1月31日 19:09,湖南为什么还不延期，要在疫情爆发高峰期上班真的很慌        ,20
2月5日 16:39,病例8接触的是病例2吗        ,21
2月1日 02:00,这桌聚餐的真的绝了我家附近那例说是这桌聚餐传染的第三代病例1是去武汉看读书的女儿 去了几天就回来了 回来之后跑了好几个区 自己的区上班 来我们区聚餐、开会 又去了别的区 还去了另一个区看岳父还是交警大队的 接触的人真的太多了 ,21
1月31日 19:09,湖南为什么还不延期，要在疫情爆发高峰期上班真的很慌        ,21
1月31日 15:25,这是永州祁阳吗        ,21
1月31日 15:21,想知道怎样举报，外来人员还到处走亲戚不自觉隔离 ,21
1月31日 12:37,能不能详细点        ,21
1月31日 12:01,求求了！湖南也很需要重视        ,21
1月31日 11:50,湖南确诊人员名单到底什么时候公布，真是急死人！看看人家贵州多重视 ,21
1月31日 11:18,湖南太安静了 每天都得我自己手动搜新增例数 自己所在的十八线小县城依旧打牌的打牌 红头文件也就在各大群里转发而已 不用手机的谁知道严重性? 跟家里老人说疫情 她们一点都不知道 还说我小题大做 都是骗人的 感觉湖南宣传一点都不到位        ,21
1月31日 11:14,@W乐了个乐 ,21
1月31日 08:40,@我又双叒叕不乱来_ ,21
1月31日 08:25,湖南每天靠手动搜索，其实湖南也是重灾区了。我所在的乡下根本没有任何人来宣传，全靠自觉，另外，口罩压根就买不到，家里只有年轻的人重视戴口罩，中老年人不戴口罩照常聚会打麻将字牌，问题是完全没有人管。风平浪静的。真的焦虑啊        ,21
1月31日 01:46,球球湖南延迟复工吧！我真的只有一个妈妈。 ,21
1月30日 21:18,湖南真的垃圾，我搜不到湖南具体的情况，只有一个总数，，，，，        ,21
1月30日 20:41,湖南那么多？        ,21
