1月29日 20:13,看看湖南吧现在已经两百多例了，连个热搜都上不去，如果不是自己手动搜索根本就不知道。        ,1
1月29日 20:20,湖南明明挺严重的  竟然没人管  能把我们大湖南送上去吗  一个热搜也没有        ,1
1月29日 15:31,15号聚餐。那个时候，病毒还不被引起重视。北京地铁，火车站依然人满为患，没有人带口罩。就连武汉人民也在官渡春节。那个时候的行动，在防疫学中有没有参考意义？如果有，附带的疑似病例可就不止现在这个数字了。        ,1
1月29日 15:27,我去，1.15就开始传播了。。。1.22才通知严重。。。        ,1
1月29日 20:14,湖南你急一急急一急急一急啊 推迟也没声音！！急一急！        ,1
1月29日 15:34,那些瞒报的官员真的太可恨了        ,1
1月29日 20:37,湖南什么都不配拥有我妈妈医院在河南订的口罩等医疗器械在上海转的时候全部被截发往武汉，武汉是重要可我妈妈医院也是定点医院，最后院领导自己开车去上级市卫生局申请调配，我们湖南不配 ,1
1月29日 20:13,重视一下湖南的这种小地方吧，我们这边还有好多人不以为然的        ,1
1月29日 20:12,这下好了，都他么成生死之交了        ,1
1月29日 15:31,第8例是四代？？？        ,1
1月29日 20:05,湖南复工可以在推迟吗真的太恐怖啦        ,1
1月29日 20:21,湖南你急一急急一急急一急急一急急一急急一急急一急急一急急一急急一急急一急急一急急一急急一急急一急急一急就好好👌🏻        ,1
1月29日 20:41,湖南那么严重物资也缺，却连个热搜都上不了，行吧，我都想厌世了。无语。坐等被传染。        ,1
1月29日 20:44,湖南好多医院都缺物资啊 二十四线小县城都没口罩了 救救我们吧 村干部也不管事 宣传真的不到位 麻将馆还是满的 这两天天气好 家里人真的又跃跃欲试 （出去打麻将）真的太难了 我妈过两天去工厂上班了 还没买到口罩 看看我们吧 ,2
1月29日 20:53,湖南终于上热搜了，孤儿省份        ,2
1月29日 20:49,湖南真的确诊病例排名全国第四，都没见上过热搜，离湖北那么近，不知道有多少疑似病例，并且也没有延迟上班！！！        ,2
1月29日 15:29,大家 都关注控制城里人了！我们农村的人，你们有没有来检查病毒感染者啊！因为农村木有检测仪器啊！特别是好多孩子还在家里呆着呀？这个问题希望你们媒体报道一下，让有关部门重视一下        ,2
1月29日 20:13,湖南已经这么严重了！！！  能不能看看湖南啊啊啊啊        ,2
1月29日 20:06,#湖南新增78例累计221例#湖南很多定点医院的医疗物资都不够了，看看湖南吧        ,2
1月29日 20:43,看看湖南吧，确诊人数第三，多家医院物资紧缺我们湖南太难了 ,2
1月29日 20:40,湖南什么都不配拥有我妈妈医院在河南订的口罩等医疗器械在上海转的时候全部被截发往武汉，武汉是重要可我妈妈医院也是定点医院，最后院领导自己开车去上级市卫生局申请调配，我们湖南不配(帮转)        ,2
1月29日 20:49,湖南终于上热搜了！我是日日看着揪心！最开始一例没有，这几天几乎翻倍增长！救救湖南吧！！！！        ,2
1月29日 21:23,湖南重灾区  热搜不见上一个，各个定点医院缺物质缺缺缺，药店口罩也没有得卖，没有任何通知延长假期 ，也没有公开透明告诉我们每个病例确诊前的活动范围， 每天一觉醒来就发现湖南的数字蹭蹭蹭的往上涨 ，现在200多例了，至今起码我自己没有看到zf的任何行动🙏        ,2
1月29日 20:42,湖南的关注度能高一点嘛 ,2
1月29日 20:50,坐标湖南常德澧县！在县城口罩买不到，在乡里复兴厂双堰村村里不发口罩。靠近湖北十几分钟。我们有时候也要出门买吃的啊难道不戴口罩的大街上跑吗        ,2
1月29日 20:15,这说明,2
1月29日 21:05,身在长沙的我，真的感觉措施好慢，别的地方都在宣传我小区没啥动静，都靠自觉，是爆发了两三天之后才喇叭宣传。国务院和教育部都说了要延迟开学，也一直没一个确定时间 ,2
1月29日 20:42,求重视一下湖南，湖南很不容易了，求求各位领导该下达的文件早点下达可以吗        ,3
1月29日 15:36,传染太厉害了一顿饭功夫        ,3
1月29日 20:23,12月8号武汉就发现第一例，1月20号才开始重视，期间一个多月，你想想这中间传染了多少人        ,3
1月29日 20:52,@人民日报 @央视新闻 管管湖南吧每天湖南增添的人数还要靠自己搜，不晓得搜的人根本不知道什么情况        ,3
1月29日 20:16,湖南终于上热搜了，感觉湖南政府一点都不慌啊        ,3
1月29日 21:13,湖南现在明明很严重了，各大医院也缺防护物资了，为什么压着湖南的消息，都上不了热搜！学校也没说推迟上学 ,3
1月29日 15:38,15日聚餐就被传染了。。。        ,3
1月29日 20:41,湖南真的要受重视，虽然宣传到位，但是某些村的村干部也仅仅只是宣传，根本就没有什么实际行动，聚餐的大有人在，有的人不听旁人劝告，非要聚餐。真的太恐怖了，尤其是中老年人，非要串门聚餐！#湖南新增78例累计221例# ,3
1月29日 21:24,想让湖南变成第二个湖北是吧等武汉疫情过去才处理湖南疫情是吧到时候变成垫脚石垫脚石是吧 各种都不配是吧 ,3
1月29日 20:38,湖南求你急一急呀，你都前三了        ,3
1月29日 20:54,湖南这一次的管理太差了        ,3
1月29日 21:38,湖南是个孤儿吗？别人三例四例新增的就上热搜了，我们全国前三前四，屁都没有，大措施也看不见，延期复工复学的通知也没有，医院的求支援的图片文字也没人关注 ,3
1月29日 20:46,湖南热搜都不配拥有的，湖南200多例，啥时候上过热搜。离湖北这么近，都完全不重视。眼睁睁地看着传染患者越来越多，却毫无办法        ,3
1月29日 20:29,湖南，你急一急啊🙏        ,3
1月29日 21:04,湖南昨天新增78例，结果一看热搜p事没得，这是不配上热搜嘛，我真服辣 ,4
1月29日 21:45,严重严重怀疑湖南政府的不作为，启动一级响应根本就是走过场        ,4
1月29日 21:15,我也在湖南一个小村里 真的是又气又急 村里有武汉回来的大学生不上报 村民照旧聚众打牌打麻将 村干部排查宣传流于形式 口罩也根本买不到 感觉都没有人管 ,4
1月29日 21:19,生为湖南人真的觉得和湖北其他邻居比（比如重庆、河南）不太重视啊，从一开始的零确诊到现在确诊数反超其他省 ,4
1月29日 21:46,湖南终于上热搜了！我在湖南呆着快急死了！我女儿才一岁，我们小区除了一个大喇叭天天播一些官方宣传，什么措施都没有！小区以中老年人为主，每天到处聚集聊天，都不戴口罩....我打110希望民警能来劝诫，他们说不管，打了两遍12345，一样没人来管！        ,4
1月29日 20:12,湖南延迟开学具体时间能不能早点？一直没有湖南的热搜。但是是全国第三确诊人数啊        ,4
1月29日 20:41,湖南都已经重灾区了，还不推迟开学吗？只有大学推迟开学了，中小学的老师学生命不重要么        ,4
1月29日 15:28,15号啊，这么早        ,4
1月29日 20:59,重视湖南一下啊！我天        ,4
1月29日 21:16,我是湖南省怀化市芷江县的人，我想说的是，在我们这个小县城已经开始县内循环播放疫情消息，市里已经下发文件全部延迟开学，高速路口也禁止任意外地车辆进入，请不要再说湖南没有任何作为，只是做出来的事情可能不能给所有人知道 ,4
1月29日 21:47,十八线小县城已经封路，放广播，措施在做，但是我大湖南怎么现在这么多案例了都没看到上个几次热搜，天天都要我自己去手动搜索        ,4
1月29日 20:51,湖南重视一下拜托拜托，我爸爸整天想着往外蹿，劝不住！        ,4
1月29日 20:32,为何要瞒着，真的很崩溃        ,4
1月29日 20:13,重视湖南一下！！！增长速度太快了！！！        ,4
1月29日 21:26,真的不知道湖南政府在做什么！！直到这两天才开始有宣传有测体温有贴横幅！！！如果我不自己在微博搜都看不到湖南的消息！！其他的省天天在热搜挂着，湖南省甚至有一天都没有上报的数据发出来！！！        ,5
1月29日 21:19,重视一下湖南和湖南周边的小县区吧 坐标永州 我们这小区根本没有采取任何措施 没有社区人员来测量过体温 也没有大力宣传严重性 口罩是完全买不到了 医院也严重缺物资        ,5
1月29日 21:02,湖南根本没人管 ,5
1月29日 21:46,湖南有很多很多小乡镇，口罩是真的买不到啊！药店没有存货，农村封路，快递不发，完全断了渠道。加之医疗落后老年人多，一旦传播不堪设想        ,5
1月29日 21:33,湖南终于上热搜了，两百多例了，热搜上不去，没热度，不重视，医院物资也不够，也不延期放假，救救湖南吧，救救救湖南 ,5
1月29日 21:49,再不重视湖南，就要成为第二个湖北了，哎！！！        ,5
1月29日 20:54,湖南政府也没有公布工作开学的日期，真的好慌        ,5
1月29日 20:18,病例九??发病还来永州?        ,5
1月29日 18:49,是“永州之野产异蛇”那个永州吗？ ,5
1月29日 21:47,别人都是往乡下避难，我真的想回城市了，尼玛我们这村里干部太不作为了，村里串门，聚众打牌，而且都不带口罩，好多骑个摩托车到处跑。明明村里有广播，也没用        ,5
1月29日 20:41,湖南控制得好又低调，所以不需要热搜        ,5
1月29日 21:24,我们永州这边都买不到口罩，大家还去抢大米？！要不是我死劝，我爸还要给我大伯去过生日？？他敢去我就敢举报        ,5
1月29日 22:09,@人民日报 @央视新闻 管管湖南吧每天湖南增添的人数还要靠自己搜，不晓得搜的人根本不知道什么情况，现在好多一线的定点医院都非常紧缺医疗物资！乡下宣传和管理也根本不到位，打牌的照样打，聚会的照样聚。湖南太难了！ ,5
1月29日 21:10,湖南也是服了 确诊人数翻倍的涨 连个热搜都不配拥有 全国第三了 连一例治愈的都没有 每天都看不到相关消息 手动搜都不一定搜得到 真的能不能重视一下 重灾区了啊 口罩一个都买不到 还接到奶奶去世的电话 都不知道要怎么办了        ,5
1月29日 15:28,15号就开始了        ,5
1月29日 21:23,湖南不延迟上班就算了，学校也不延迟开学，尤其是幼儿园！！！！        ,6
1月29日 21:07,杨某一人干倒周围7人=8人确诊新冠肺炎永州热搜都来了 ,6
1月29日 21:38,湖南终于上热搜了 ,6
1月29日 21:24,湖南好多小地方医疗设备都跟不上，乡下人还不自觉，聚集打麻将，一点都不重视，没有这方面的意识，真的是气晕了😠        ,6
1月29日 21:23,终于有湖南的通报了，这个永州第一例杨华，住在我们隔壁小区，接了女儿回来之后，聚餐好几次，同桌感染几位，他女儿跟老婆好在观察 ,6
1月29日 21:21,湖南都上一个名次了，是不配拥有热搜吗？湖南挺住💪天佑我中华儿女，武汉加油💪中国加油💪        ,6
1月29日 21:13,坐标郴州，慌的一批口罩都没得卖了，天天窝在家        ,6
1月29日 21:12,湖南急一急急一急急一急急一急急一急急一急急一急急一急急一急急一急急一急急一急急一急急一急急一急急一急急一急急一急急一急急一急急一急急一急急一急急一急急一急急一急急一急急一急急一急急一急急一急   真挺严重的        ,6
1月29日 20:05,#湖南新增78例累计221例# ,6
1月29日 21:11,大湖南！！！！！！！！！！！！！！        ,6
1月29日 20:56,嗯是的说的真对，湖南都200以上了，延迟开学也不发通知，确诊案例不上热搜，没有具体信息，怎么预防也不仔细告知，是等着互相怼脸唾沫满天飞吗 ,6
1月29日 20:46,住我家楼上容易吗我，回来了也没人告诉我们，楼梯间也没人消毒，人心惶惶都        ,6
1月29日 20:17,学生不延长开学，企业不延长复工，湖南领导zf是想和湖北一样吗？        ,6
1月29日 15:28,哼！馋嘛！        ,6
1月29日 21:38,湖南政府真的不管事        ,6
1月29日 21:36,我的妈 我也发现了 湖南新增每次都是前三 现在累计200多 人家40多都热搜了 急死了急死了        ,7
1月29日 21:22,湖南急一急急一急急一急急一急急一急急一急急一急急一急急一急急一急急一急急一急急一急急一急急一急急一急急一急急一急急一急急一急急一急急一急急一急急一急急一急急一急急一急急一急急一急急一急急一急        ,7
1月29日 21:20,真的，湖南这么严重了        ,7
1月29日 21:12,湖南！！！！！！！！！        ,7
1月29日 21:04,湖南终于上热搜了，救救湖南，救救永州        ,7
1月29日 20:18,15号我们这里根本就一点动静都没有，根本不能怪人家聚餐        ,7
1月29日 23:50,每次看到肺炎，总是要手动搜索，查了什么也没有！！！！        ,7
1月29日 22:35,湖南zf请让百姓看到你们的行动！！！ ,7
1月29日 21:49,坐标湖南怀化小乡村，从年三十后每天乡卫生院医生护士和村卫生院医生上家家户户量体温消毒，家门口广播也是经常在播放疫情相关新闻，政府人员驱车宣导、各道路设关卡排查到现在已经封路，挨家挨户打电话让大家尽量少出门、讲卫生…个人认为我们当地政府真的真的很重视很重视了！！！        ,7
1月29日 21:36,哎。天天为各个省的人民操碎了心。病毒快点走吧！🙏湖南人民加油啊！        ,7
1月29日 21:36,湖南也挺严重的 有没有人管一下 武汉重要 湖南就不重要吗 其他省份也同样重要啊 希望能引起重视 ,7
1月29日 21:14,湖南的大学可以延迟开学吗…实在是太怕了 想到要去高铁站 人那么多就害怕        ,7
1月29日 21:02,郴州市桂阳县请加强管理农村。不要掉意轻心啊。        ,7
1月29日 20:17,湖南啥时候推迟复工啊啊啊啊啊啊啊 前面的都推迟了，湖南已经这么严重了！        ,7
1月29日 22:27,湖南真的也挺严重的，就是一个rs都没有很无语，感觉像是没人管的孩子，照常该上班上班，口罩啥的也没得买 ,7
1月29日 21:48,看看湖南吧        ,8
1月29日 21:46,湖南真的已经很严重了，各大医院都发出了求社会捐赠物资得通知，zf到底在做什么？感觉没任何动作，老人想打牌的打牌想打球的打球！！！！        ,8
1月29日 21:05,看看怀化吧 ,8
1月29日 21:45,能不能看看湖南，医疗物资也很缺乏。病例也那么多。我都快急死 ,8
1月29日 20:12,好早啊        ,8
1月29日 21:12,长沙人瑟瑟发抖，十几号我还在外面吃吃逛逛……………        ,8
1月29日 23:46,湖南跟个闷葫芦一样真是绝了！一点宣传力度都没有，今天还几十号人围在楼下玩游戏！小区也没有任何动作！朋友初六照常上班！我举报了才有人去核实，去管理！        ,8
1月29日 22:33,我舅舅明天要请客可以打什么电话举报        ,8
1月29日 21:31,还全是我们永州的好多农村根本就不重视该怎么样还是怎样根本没有宣传到位很多人都不当回事儿出门也不带口罩可能都觉得无所谓吧 ,8
1月29日 21:11,湖南现在太严重了，我不敢回去了。        ,8
1月29日 20:44,13号去泡温泉了，万一有一个武汉来的，也去了，是多么可怕，22前一点消息都不知道        ,8
1月30日 04:13,太过分了！今天给朋友家药房送去的口罩被查了单子没收了，原来是送去了wh？？我们大湖南百姓的生命就不重要吗？        ,8
1月29日 20:48,能不能说一下都在哪个县哪个区啊，我在永州根本就不知道是不是被包围了        ,8
1月29日 20:28,我们这农村里还是不重视啊！我们村里从来就没有村干部来管        ,8
1月29日 23:55,湖南就不管了吗！我们常德澧县靠近湖北几分钟交界！都有好多了！然而口罩都买不到.大街上到处没有戴口罩的人！难道还要传染下去吗        ,9
1月29日 21:26,湖南措施不到位，坐标娄底农村        ,9
1月29日 21:02,好像知道具体永州哪里的        ,9
1月29日 20:17,#湖南新增78例累计221例# 湖南真的需要关注啊🙏🙏🙏        ,9
1月30日 01:11,湖南是不是在中央没权利？        ,9
1月30日 00:09,湖南人买不到口罩。。。。我们家一个都没有。。。邻居都没有买到，都不知道该怎么办        ,9
1月30日 00:02,求帮我们湖南送上去，我们大湖南需要热搜        ,9
1月29日 20:42,怎么感觉进了武汉的门就会被传染似的？        ,9
1月31日 08:25,湖南每天靠手动搜索，其实湖南也是重灾区了。我所在的乡下根本没有任何人来宣传，全靠自觉，另外，口罩压根就买不到，家里只有年轻的人重视戴口罩，中老年人不戴口罩照常聚会打麻将字牌，问题是完全没有人管。风平浪静的。真的焦虑啊        ,9
1月30日 10:10,湖南湘西的确诊人员能不能像这样详细点？湘西交通本来就不方便今年好不容易有了高铁，医疗物资更紧缺，跑遍了城里药店根本买不到口罩！！重视啊！@中国新闻周刊 @红网 ,9
1月30日 08:44,和杨某聚餐是6个人，我查了几遍都是15号和杨某，小编是不识数吗        ,9
1月30日 01:54,我们湘阴这里都有几个了 都封城了 大湖南也要挺住啊！！ ,9
1月29日 23:51,湖南什么强制性让那些学校，企业延期复工啊！！！！我感觉我们老板一点都不怕，坚持让员工准时去上班        ,9
1月29日 21:02,活该   说了不要聚餐        ,9
1月29日 15:47,转发微博        ,10
1月29日 23:30,撤啥热搜。。。        ,10
1月29日 21:24,湖南能详细的公布信息吗？这样大概率的数字？能再详细点吗？重视点好吗        ,10
1月29日 20:48,湖南缺物资啊，医护人员防护服，口罩，酒精，手消……都紧缺 ,10
1月29日 20:22,不要聚集了        ,10
1月30日 08:55,坐标湖南郴州安仁县也买不到口罩        ,10
1月30日 05:47,湖南郴州市桂阳县春陵江镇古楼，农村没人管，聚集打牌，走亲戚，鞭炮声声响 ,10
1月30日 05:27,农村没人管，农村没人管 ,10
1月30日 05:26,湖南郴州桂阳县春陵江镇古楼，村里的人到处跑，走亲戚，聚集打牌。。。。根本没人管 ,10
1月30日 02:00,病例9和病例11真他妈活该！都发病了还他妈到处跑！        ,10
1月30日 00:06,宁可十防九空 也不要天天说没事没事 那是事儿没到你头上罢了        ,10
1月29日 23:52,我大湖南不配上热搜吗        ,10
1月29日 22:59,求求关注一下湖南吧！！！！好歹是疫区周边！！！        ,10
1月29日 22:54,看看湖南永州吧 ,10
1月29日 22:15,永州的，天天呆家里哪里都不敢去，还是瑟瑟发抖        ,10
1月29日 21:51,湖南越来越多了 增加了都不通报的一下的        ,11
1月29日 21:48,请问张家界是真的没有吗？🙏🙏🙏        ,11
1月29日 21:45,湖南真的挺严重呀 ,11
1月29日 16:49,这都第几代传播了？        ,11
1月29日 23:53,湖南地方卫视新闻不是还有领导班子去视察药店吗，说口罩供应充足，咋我们老百姓跑了五六家医院啥也买不到        ,11
1月29日 23:41,第一例简直就是超级传播者，2到7都是跟他有关，8也是他传染的人再度传染的，15号开始，20号还来到湖南永州市江永县，在县医院做检查，结果县城说没有，不是县城的人，就不算，真的县城百姓很担心啊        ,11
1月29日 23:15,湖南急一下好吗！！！我们这边大家都跟没事人一样啊，晚上有打麻将，白天还有聚餐！！！也没看见宣传什么！明明每天增加人数那么多！！！‼️‼️‼️        ,11
1月29日 22:58,娄底现在好几个村子都封村了，疫情这么严重，能不能公布一下确诊人员的具体情况啊！现在官方数据是娄底已确诊13例，但又不说具体在什么地方，而且估计还根本不止13例！zf能不能给点力！！！ ,11
1月29日 22:35,湖南真的太难了！病例数据前几位，但物资却少的可怜…不但没有所谓的捐赠，反而要被政府管制，我们根本买不到…  这么久了，不敢出门…        ,11
1月29日 22:05,湖南真的没有热搜啊，一点都不重视        ,11
1月29日 21:54,每天早上起来翻热搜，跟踪最新消息，结果每次报告疫病确诊人数稳稳安在第四名的湖南，没有上过两次热搜，每天都要自己手动搜索才能了解情况，能不能稍微重视一下湖南        ,11
1月29日 21:02,有个人就住我家旁边那栋 30米距离今天早上救护车把他家人接走了        ,11
1月29日 20:35,第1例杨某传染给第2-7例，第8例是被第2例传染，第8例应该是第三代        ,11
1月29日 20:26,初七就上班了！有点方        ,11
1月29日 15:35,偏偏又不听话、存在侥幸心理的人！        ,11
1月30日 09:01,球球看看湖南吧，重视一下湖南吧！！！ ,12
1月30日 08:31,湖南你急一急湖南你急一急湖南你急一急湖南你急一急湖南你急一急湖南你急一急我就没看过湖南上几次热搜，看电视我都以为湖南做的很棒呢 ,12
1月30日 04:09,原来今天送给朋友家药房的口罩就是这样送去了wh？怪不得今天发出的口罩都被查单子没收了！！wh人民需要我们大湖南百姓的命就不是命吗？        ,12
1月30日 02:59,长沙学生再过十天就要开学了，要是没有药物研发出来，到时候一个学校近一百个班，一个班上五十多个人聚在一起，那个传染速度我不敢想 ,12
1月30日 02:42,湖南真的买不到口罩了 救救湖南吧        ,12
1月30日 02:00,湖南都这么多了 为什么热搜老是上不去真的很急啊 一天天的都在增加加强重视一下我们湖南好吗        ,12
1月30日 00:53,你们湖南领导怎么这样？！！！！我们镇江一个县级市的镇上的乡下宣传的都比你们强，，你们领导我也是醉了。。而且还不通知延迟复工？？？？在等什么呢？？？        ,12
1月30日 00:32,永州本地工作做的很好的，杨某第一天确认，其他疑似病例也在医院了，接触过的人都在跟踪观察，宣传工作也很到位，目前我身边的人都做到了不聚餐不出门（过年请客的肉屯给自己吃了），事已至此，大家都做的很好了        ,12
1月30日 00:32,湖南真的很多地方都不重视 气死我了气死我了气死我了        ,12
1月30日 00:07,叫你聚堆儿！嫌自己死的慢！        ,12
1月29日 23:57,就聚个餐。。就。。        ,12
1月29日 23:51,湖南真的太难了        ,12
1月29日 23:40,明明1.24就确诊了？然后后面别的省都出来了，湖南就还是0。这想干嘛？上点心好吗？球球不要谎报了！一晚上增加七八十例采取点强制措施好吗！上热搜谢谢了 ,12
1月29日 23:30,湖南终于上热搜了！！！重视一下我们吧！！！        ,12
1月29日 23:17,两天前的案例了诶！！！现在才热搜，每天增长人数那么多没看到热搜，真不是我们计较热搜，而是看不到热搜很多人就不重视了        ,12
1月29日 23:12,湖南都前几了眼看着数字增长连个热搜都没有 zf啥都没发 之前还开玩笑湖南夹在中间瑟瑟发抖（疫情地图白的）现在全国第四确实瑟瑟发抖了 ,13
1月29日 23:10,湖南目前为止还没有发布官方的复工通知，公司只能听从中央的复工通知和安排，但是长沙的疫情现在并不比其他地方的差，内心慌的一匹，买不到一个口罩，3号要复工上班了👏👏👏不知道要咋办 ,13
1月29日 23:07,湖南感染人数已经是第三了啊！！也没怎么看到上热搜，都不能引起人们的重视！包括也总是说总的数据都不说一下每个地方的感染人数。武汉封城那天湖南长沙岳阳等地不知道涌入多少武汉人，并且湖南的定点医院也有缺物资的！请大家多看看我们吧 ,13
1月29日 23:05,湖南事事都是最差的待遇啊，高考分数线，题目难易度，物价，医疗，国家补贴        ,13
1月29日 22:39,我们村就有从武汉回来 但村里居然只是让他们自己不要出门 还瞒着不让我们知道 是谁家 说是怕得罪人 湖南衡东        ,13
