2月12日 18:55,黑龙江是东三省最严重的        ,1
2月12日 18:59,我黑龙江也很严重，虽然我们没有天团医疗队，但是我们也倾尽全部。岂曰无衣，与子同袍，我们不只是说说而已。加油武汉，我们东北军支持你，胜利属于我们！        ,1
2月12日 18:54,黑龙江的疫情都啥样了，还能腾出手来去湖北揍病毒去，真是可敬 ,1
2月12日 19:21,他们来自哈尔滨 齐齐哈尔 牡丹江 佳木斯 大庆 伊春 大兴安岭 七台河 黑河 鸡西 北安 塔河 嫩江 九三农垦 肇州 肇源 林甸 杜尔伯特 勃利 鹤岗 宝泉岭…      这些地名，省外的人可能都没听说过。可谓“倾巢出动”，黑龙江真的尽力了！ ,1
2月12日 18:53,人是借给你们的，一个不少的要归还。        ,1
2月12日 19:01,我们东北啥都能给你们，大白菜，大米啥的，你们需要我就给，唯独白衣天使，是我们借的。。得一个不少的还回来。。 ,1
2月12日 19:18,希望大家知道 黑龙江在全国各个省里医疗条件真的一般 黑龙江出了300多人真的真的真的很不容易 每个县级市都出了本地最优秀的医护人员 真心希望大家都平安归来 🙏        ,1
2月12日 18:55,我黑终于拥有姓名孝感加油！黑龙江加油！重庆加油！小黑鱼冲鸭！        ,1
2月12日 18:57,东三省简直倾囊相助啊🙏🙏🙏        ,1
2月12日 21:02,姐姐嫁到佳木斯5年了，期间去过佳木斯和哈尔滨几次，很喜欢黑龙江直爽率真的性格，也喜欢那辽阔的北大仓，作为孝感人，被黑龙江人支援，有种天塌了有家人帮我们顶着的感觉，谢谢龙江人民！等疫情结束再去龙江吃得莫利炖鱼        ,1
2月12日 19:20,东北人确实讲究，死要面子活受罪！其实家里已经揭不开锅了！ 疫情过后请中央看看大儿子吧…        ,1
2月12日 18:56,大黑龙江也挺严重的，这时候还伸出援手，不愧东北人！仗义！盼平安！盼凯旋！致敬！        ,1
2月12日 19:48,谢谢黑龙江老大哥！有你们和重庆在，我们最惨组合（最惨直辖市、最惨东三省死亡人数除湖北最高、最惨地级市）一定能打赢这场仗另外，请各界也关注一下孝感好吗？确诊人数马上要破三千了，全国所有地方的确诊人数增长量都在下降，我们依然保持每天一百多的速率增长 ,2
2月12日 19:18,东三省在大事面前从来没差过事，不仅是倾囊相助，甚至是砸锅卖铁！我们本来并不发达，但同胞有难绝对不能袖手旁观。请兄弟们以后不要地域黑我们了，我们也很难 ,2
2月13日 02:07,“我们没赢过一场网络暴力，却也没输过一次家国大义。”        ,2
2月12日 18:58,黑龙江自己也不容易，真的是尽力了。都要平平安安的回家来。加油~！        ,2
2月13日 07:44,欠东北人的热搜，这次该还了吗？雷神山火神山的主力都是东北人，据说黑龙江现在被称为“小武汉”，但是这么难的情况下啥也不说就是给武汉出人出物资，辽宁又又又派500多最好的医生，院长都上一线，还有吉林……什么都不说，东北人，憨的、直的，唉！不会说啥了 ,2
2月13日 08:01,我总觉得国家把东三省当成了奶牛，吃的是草，挤得是奶。动不动还被黑被鄙视。孤儿的待遇。        ,2
2月12日 19:17,这是黑ABCDEFGH……集结在一起的勇士，我们把他们借给你们，希望到到了春暖花开之时你们能把他们毫发无损的还给我们        ,2
2月12日 19:12,江苏人在这里谢谢黑龙大哥了，孝感疫情严重，黑龙江也够呛了，危机时刻，只能抱团取暖，勇士们必须一个个安安全全的回家！        ,2
2月13日 01:03,千万不要低估东北人的实在，这帮人虎起来自己都害怕。加油孝感，加油武汉 ,2
2月12日 18:55,加油，我们黑龙江资源有限，真是倾囊相助了。加油武汉        ,2
2月12日 19:02,因为是“共和国的长子，就算我们自己也很难，但还是会挤出资源帮助兄弟，        ,2
2月12日 19:04,黑龙江真是没啥了，倾尽所有了        ,2
2月13日 07:36,黑龙江也急缺N95 没求外援 而是咬着牙和自己省内的群众说,2
2月12日 19:17,鸡头要保护好鸡心啊 ,3
2月12日 18:53,川军和东北军会师武昌 ,3
2月13日 08:05,评论里还有在杠，这些医护人员是从市和周边县凑的。。。黑龙江是唯一一个外围省份，还被染红的，自己都顾及不暇，还要掏出家底援助别人，不求你们怎么感激，怎么吹捧，只求别黑，行吗？之前，东三省捐钱捐物，一个热搜没上，这次我们终于上热搜了，还要被各种无脑黑。。 ,3
2月13日 00:27,我要被这个地狱黑东北的狗气死了 ¡评论配图 ,3
2月13日 08:20,东三省的人口仅占全国人口的1/14，而调配的医疗人员数量却占全国调配医护人员的1/5. ¡评论配图 ,3
2月13日 07:19,终于看到东北的热搜了，辽宁人表示昨晚辽宁也抵达襄阳了。 ,3
2月12日 19:50,黑龙江重庆都不容易，都是重灾区，还要一起救孝感，我中华儿女都是好样的        ,3
2月12日 19:08,黑龙江真的全力以赴了，关注的小伙伴都能看出本来实力不太行和资源也不多的我们现在有多难，但是作为老大哥，尽管浑身是伤，也要拉一把妹妹，黑龙江，重庆，孝感，我们一起加油 ,3
2月12日 19:14,三批医疗队 都要完完整整的回来！        ,3
2月12日 22:08,东三省真的是掏空了自己往中原送，可是现在龙江已经很严重了，不宣传表扬我们都无所谓了，只希望东三省以外地区的人民不要再黑我们了，我们从没有做错什么，该奉献的也都尽最大的力了。谢谢了，愿平安🙏🙏        ,3
2月12日 21:46,孝感媳妇儿谢谢黑龙江的朋友 我超喜欢东北人儿的 ,3
2月12日 19:09,已经是第三批了，岂曰无衣，与子同袍。黑哥孝感 ,3
2月12日 18:56,这是借你们的，一定要一个不少的还给我们，加油中国！        ,3
2月13日 10:21,我妈也在这批人里，希望妈妈平安回来 ,4
2月13日 07:39,东三省作为共和国的长子 只要祖国需要 硬挺着倾尽所有也要往前冲 明明自己已经捉襟见肘 却还不停的把人才和物资输送到一线 …… 东北人 没赢过一次网络暴力 没输过一次国家大义 我们都是中国人 希望不要再有地域黑了 好人坏人都不分国籍 不分种族 不分地域 坏的人一出生就在那里了……        ,4
2月12日 19:58,东北医护去了挺受欢迎的，因为语言无障碍 ,4
2月12日 19:16,我们鸡西恒山区一个区20多个病例 结果我们出20多个人去湖北？？？？黑龙江很严重怎么没人重视？        ,4
2月13日 07:39,所以……别老黑我们东北了……我们挺好的 ,4
2月12日 18:57,黑龙江加油！都要平安回来啊        ,4
2月13日 07:42,黑龙江，太难[流泪]（九三农垦管理局）  2020伊始，最难的，就是黑龙江。 毕竟举国之力、全球华人都在援鄂  一个熟透的鸡冠子，还在默默硬扛。   作为东北疫情最严重的地区，一个仅有三千万人口的省份，目前确诊人数已有378例，治愈28例。   死亡人数达8人，全国第二，仅次于湖北。        ,4
2月12日 18:59,孝感跪谢黑龙江的各位了🙏🙏 ,4
2月12日 19:33,黑龙江的医疗值得信赖！！孝感人民感谢黑龙江亲人的援助 ,4
2月13日 07:51,东北从未缺席过任何一次民族大义  那些说东北人只会喊麦戴大金链子的睁大狗眼看清楚了        ,4
2月13日 09:00,大庆的勇士们，期待你们的凯旋归来！一个都不能少！！！！！ ¡评论配图 ,4
2月13日 09:26,东三省就像一个大家庭里最年长但是最穷的那个大哥，为这个家付出了一切，家里的弟弟妹妹出事了需要钱，这个大哥从兜子里哆哆嗦嗦拿出来一个破包裹，露出里面破破烂烂的一点钱。大哥对着小兄弟说,4
2月12日 19:29,我们全县总共就两个医院，也派过去好几个医生支援，真的是用全力在帮了，祝一切都好，英雄凯旋        ,4
2月12日 18:54,黑龙江的老乡们必须要平安回来…等你们！泪目一下午 ,4
2月13日 08:39,你捐了60吨大米，你疫情严重没有靠别人而是发动群众，而是靠自己买产线，你的明星企业不多但在危难面前各个有担当……你可能不那么富有，但却有着最仗义的心。我最爱的家乡，我们的大鸡头一定要平安！        ,5
2月12日 19:16,黑龙江人真的泪目了 ,5
2月12日 19:47,以黑龙江目前的情况也很是不容易了 希望都能平安回来        ,5
2月12日 19:19,谢谢东北老铁等疫情好了我一定补上心心念念的东北板块的旅游，平安！        ,5
2月13日 09:34,方大集团捐了2个亿 飞鹤乳业捐了1个亿 哈药集团捐了1个亿 大连大商集团捐了6000万 鞍钢集团捐了3000万 东软捐了2700万 一汽集团捐款捐了1700万 吉林巨峰生化捐400吨酒精 长春修正捐1000万药品 大连石化捐救护车 赵本山就捐1000万 黑龙江捐了60吨大米 辽宁130吨白菜 20吨茄子。  驰援湖北2340医务人员。        ,5
2月13日 08:40,火神山雷神山两座大山都在说着东北话        ,5
2月12日 18:57,希望黑龙江的白衣天使都能平安归来❤️你们都是最棒的 要知道我们东北黑龙江这里是疫情最严重的地区了 ,5
2月12日 19:14,黑龙江做的不比任何人任何地方少 加油大龙江 ,5
2月13日 08:09,黑龙江前前后后支援了好多人终于有姓名了，现在封街道，人和车都不能走进出账需要绕行和登记还有挨家挨户发酒精，喷消毒液，黑龙江企业捐了好几亿，黑龙江很努力了，希望zf救救孩子别让疫情扩大了我们不容易，还有地域黑的你们集体死🐴        ,5
2月13日 09:27,黑龙江尽力了，确诊300人以上省份，作为外围城市一片飘红，死亡率全国第二，治愈率全国倒数第一，物资紧缺到要和百姓换口罩，东北经济相对落后，医疗水平本来就有限，自己也是水深火热，却依然分三批600多医护人员支援武汉，捐款捐物从未落下。东北人，没赢过一场网络暴力，同样也没输过一场民族大义！        ,5
2月13日 07:52,我们黑龙江自己也不容易，经济这几年一直不景气，这次疫情也挺严重，但还是倾囊相助，希望以后不要有人再黑我大东北 ,5
2月12日 19:50,自己注意点吧，别人谁也帮不上你们，只有默默地为家乡加油，为国加油，960万平方公里哪里都是家，如…前院，后院之分，我的国，我无能为力，若战争，鲜血是我最好的回答        ,5
2月13日 09:40,大家可能不知道这些人都是从哪儿抽调的，这批人里面就包括我们18县小破乡镇的医护，就连我们这种边陲落没的地方都派人支援了，黑龙江是真的翻家底了。等春暖花开，欢迎你们来这里“找北”        ,5
2月13日 07:43,孝感人民表示衷心的感谢，待疫情结束，一定把你们平安送到家🙏        ,5
2月12日 19:02,同胞有难，援助应当，只希望大家以后别再黑东北了，哪个地方都会有坏人，但并不会代表我们所有的东北人。谢谢大家了 ,5
2月13日 08:02,黑龙江真的太难了，自己凭实力红的，物资也短缺，像我们这种小县城的超市连方便面都买不到。不过防控还是很给力的。还要往出捐钱捐人捐大米希望看见的网友们不要黑黑龙江了，中央看看我们吧        ,6
2月13日 08:41,好时候想不起来东北 GDP最低的黑龙江和吉林两兄弟轮班，要什么什么没有，但是我们依然热爱祖国，网络上的地域黑睁大你们的狗眼好好看看，别没屁放的时候埋汰东北，从你嘴里说出来我都觉得脏        ,6
2月13日 07:59,我们发展最落后，我们被地域黑最严重，我们外围省份感染红的最透，我们冬季旅游损失最惨，但我们人最善良最淳朴，我们依然捂着伤口奔赴湖北。麻烦，欠我们东北的热搜还我们吧！        ,6
2月12日 20:00,黑龙江是我们东北疫情最严峻的省份，之前已经派出300多人了，这次又砸锅卖铁的支援前线，真是拿出最硬的鳞了！老铁们都平平安安顺利归来啊 ,6
2月13日 08:06,我是黑龙江五常人，疫情发起是一位武汉夫妻回岳父家，将岳父家全部传染，但自己没有感染！这家人行动路线广，他们查出的第二天发现了5起以上，发病的是他们的亲戚，而且他们回来时坐出租车，将其他乘客感染，最后导致五常昨天达到16人，我们防护措施挺严，小区全部封锁，政府发放酒精，出门要有通行证        ,6
2月13日 07:46,看到别人的评论， 我们东北没赢过一场网络暴力  没输过一次民族大义东三省是一个省，留吉吉在家看家 ,6
2月13日 00:10,你们湖北人以后不能黑我小东北啊，东北人民家底全拿出来拉！ ,6
2月12日 19:11,小黑加油！你们要一个不差悉数回来！岂曰无衣 与子同袍！ ,6
2月12日 19:32,我们这县级市都出人了 真的很难啊 而且我们这里也有患者 希望快快过去吧        ,6
2月13日 08:08,坐标哈尔滨某一区，我们这其实说实话也挺难。确诊人数每天都在增加，小区也进入的管控状态。医用酒精最近才供应上，一次性口罩从年前到现在就买不到了。市里医院除急诊外已经不接普通患者了，骨干医生都抽调走了，连民营医院的医生都上阵了，真的尽力了。作为个人只能保护好自己，不给医院添麻烦。        ,6
2月13日 07:33,酸菜炖粉条来驰援热干面，愿攻克疫情，平安凯旋！老家的酸菜坛子等你们！        ,6
2月13日 09:42,真实想哭……看到这里就想到那些地域黑的人，什么地方没有地痞，为什么要没完没了的黑东北，中国人不是一家人吗，和谐一点友善一点不好吗，互帮互助都会越来越好的，说实话看多了黑东北的那些难听的话，真的有点心寒，我也相信不是所有南方人都不喜欢东北的……英雄们一定要平平安安的回来！ ,6
2月13日 07:50,孝感人谢谢黑龙江老铁        ,6
2月12日 19:37,我龙江人真的是义字当先，大局为重！倾其所有，共渡难关！加油，孝感！加油，黑龙江！加油，中国！ ,6
2月13日 09:22,我舅妈在队伍里，希望平安归来        ,6
2月12日 19:13,黑龙江老铁们，人人在家坚守阵地，让咱们出征的英雄医护再无后顾之忧！加油💪等你们凯旋！ ,7
2月13日 07:43,我倒希望黑龙江不去那么多医务人员 先把自己的病人救助好  黑龙江死亡率这么高 看的让人心疼        ,7
2月12日 19:16,黑龙江最硬的鳞片交给你们了加油！        ,7
2月13日 08:53,我们从来没有赢过一场网络暴力 我们也从没缺席过一场家国大义        ,7
2月13日 07:53,安全回来，不求别的，官媒多带东北正能量的节奏，别天天盯着不好的，政府有责任引导舆论        ,7
2月12日 22:02,第一批哈医大组成的137人的队伍已经在协和西院奋战了十几天了，谢谢我的老师们！        ,7
2月12日 19:13,黑龙江加油！武汉加油！中国加油！共渡难关！        ,7
2月13日 09:12,雷神山火神山主力军，是东北人，东北人，东北人！        ,7
2月13日 07:51, 看到黑龙江这几个字出现在热搜，我骄傲自豪，我担心，祈祷我的老乡们平安健康回来。        ,7
2月12日 19:47,这一次为我大黑龙江点赞👍        ,7
2月13日 10:52,东北真的很实在。 方大集团捐了2个亿 飞鹤乳业捐了1个亿 哈药集团捐了1个亿 大连大商集团捐了6000万 鞍钢集团捐了3000万 东软捐了2700万 一汽集团捐款捐了1700万 吉林巨峰生化捐了400吨酒精 长春修正捐了1000万药品 赵本山一人就捐了1000万 黑龙江捐了60吨大米        ,7
2月13日 08:40,我们黑龙江是东三省最严重的，都能这样援助，希望自己这边人能够用吧。本来我们这整个省份的医疗条件好的也就那么两三家医院        ,7
2月13日 08:38,欠东北人的热搜 这次该还了 黑龙江第三批支援湖北没有占领热搜 缺将地域黑占尽了热搜 国难当头还出现地域黑这种情况简直不可思议 请地域黑的人 多些人的良知 “一方有难 八方支援”我们不存在地域问题 我们同在一个国家 我们同是兄弟姐妹        ,7
2月13日 08:26,就是，就别让黑龙江的去了。。。好好管好自己        ,7
2月13日 07:28,黑龙江哈尔病在东三省最严重，死亡人数蹭蹭的全国第二名，政府朝群众换口罩，都这样了，黑龙江加油!        ,8
2月12日 22:46,能不能给自己也留点医疗资源，毕竟现在黑龙江疫情很不乐观        ,8
2月12日 19:33,平安回来        ,8
2月13日 09:41,作为一个孝感人，谢谢大黑龙江和大重庆！！！        ,8
2月13日 09:22,欠辽宁一个热搜 ,8
2月13日 08:22,东北从来没赢过一场网络暴力 也从来没输过一次民族大义        ,8
2月13日 08:06,孝感妹妹别怕，黑哥哥倾尽全部也要护你周全        ,8
2月12日 19:03,已经去了两批了，这回划拉了十三地市凑的人，三批五百多人，请一定平安回来！        ,8
2月13日 09:39,吉林人民表示十分同情黑龙江兄弟👬 ,8
2月13日 08:47,看这报道差点哭出声音，终于有一次不是地域黑了。我们黑龙江现在疫情严重，给能去支援，真是一口粥都不会自己吃。        ,8
2月13日 07:40,快回来吧，黑龙江都多少了，哈尔滨都一百多例了，东北人就是仗义，自己都啥样了，还得先帮别人        ,8
2月13日 08:02,黑龙江疫情也很严重，我们真的尽力了        ,8
2月12日 20:47,黑龙江也应该请求北京上海浙江这样的地方进行技术支持！不必避讳，共同提高，支援湖北        ,8
2月13日 09:17,以后不管其他省份如何看我们东北  希望湖北的小伙伴别黑我们   我们东北真的把家底都掏出来支援你们了 ,8
2月13日 08:18,伊春之骄傲，林都之光荣，望各位踏春而行，乘夏而归！        ,9
2月13日 08:00,也救救黑龙江吧，除湖北外死亡最多的省份，明明离湖北那么远。GHG长子太难了，熟透了的鸡冠子 ,9
2月13日 07:46,任务是国家下派的还是自愿的啊，感觉比黑龙江经济能力医疗有实力的省份有很多啊，为什么要掏空式的支援呢，东北以后还是要发展的，如果这样是不是和有钱的省份经济越来越大了        ,9
2月13日 08:11,莫名的心疼，就像哥哥看到弟弟大冬天把手套弄丢了，立马摘下自己的给了弟弟。东北人的美就像饮不尽的长江黄河水。        ,9
2月12日 20:10,本孝感人民谢谢黑龙江的援军 ,9
2月13日 07:51,真想揍死那些地域黑 ,9
2月13日 08:58,我们黑龙江真的太难了，一年四季就冬天能迎接点游客，现在游客没了，还捐出去那么多物资，借出去那么多人，我们自己都快不行了，还是有人喜欢乐此不疲地黑我们。        ,9
2月13日 07:31,我们连县级医院都出动了没得再走了再小就村了600多小龙人要平安归来 ,9
2月13日 08:34,黑龙江都难成什么样了，我这所有娱乐场所都关闭了，小区两天才让出去一个人买菜，我一直想去补牙，牙科都不开，每天确诊还在涨，真的是倾尽所有了        ,9
2月13日 08:05,虽然我大黑龙江穷  但是我大黑龙江仗义 走起！ ,9
2月13日 10:39,黑龙江哈尔滨急诊科护士报道，我在家里守着一线，等着你们回来，加油        ,9
2月13日 09:05,黑龙江算是东三省里最严重的了，地域黑的键盘侠可以休矣。为医疗队加油，等着你们的好消息。 ,9
2月13日 09:01,我们副院长是此次出行队伍的副领队，我们医院也是收治黑龙江第一例确诊患者，在外我们支援武汉孝感，在内还要分出一部分人去支援我们市传染病医院。我们医院连规培学生都顶到自己医院的一线发热门诊了，我们真的倾尽所有了，所以真的不要在黑我们东北人、牡丹江人        ,9
2月13日 08:54,一定要安全回来 安全回来！！！        ,9
2月13日 08:20,泪目了！！东北真的竭尽全力了，家乡南岔那么小的地方都出人了。哈药几日前才引进2条n95生产线，东北的实力和南方完全不能比，但是依然拼力抗”疫”！！祝愿逆行者早日平安归来。        ,10
2月12日 20:32,？？？黑龙江是除了湖北死亡人数最多的，你可以支援，但是最好能保障省内人有病有人可医 ,10
2月13日 09:58,黑龙江终于上热搜了，我以为这个事不会给我们说呢        ,10
2月13日 09:42,就那些地域黑的 喷东北的 告诉你奥 东北人全是你爹  东北不爱当键盘侠有胆子你就来东北 一拳就给你揍趴下        ,10
2月13日 09:30,黑龙江自己确认病例都要接近400了，我真是担心 ,10
2月13日 08:34,能不能支援一下黑龙江啊，死亡率都多高了，治愈率多低啊，还出去支援个什么劲儿啊，本来好大夫就不多……        ,10
2月13日 08:04,待到春暖花开时，请湖北把我们的医护人员平平安安的还回来❤️        ,10
2月13日 08:30,再地域黑东北的试试看        ,10
2月13日 09:44,黑龙江加油，祝你们平安归来，等疫情一过就去黑龙江长白山，去看狍子!加油!我四川永远挺你们，不要在乎那么键盘侠。其实大部分人是很喜欢东北的，至少我身边从来没得人说东北的不好 ,10
2月13日 08:20,东北从未缺席过任何一次民族大义   但每次地域黑都没落下我们 ,10
2月13日 08:03,黑龙江真的一直都很努力！我们虽然穷，可是只要需要我们，我们怎么都行，有啥给啥一点不留！        ,10
2月13日 07:52,自己都啥样了 ,10
2月13日 08:07,一方有难 八方支援        ,10
2月13日 12:10,你好，孝感！物资我们是捐的，但白衣天使我们是借的，请一个不少的还回来🙏🙏🙏一定要平平安安的，我们等你回家 ​​​        ,10
2月13日 11:47,鸡头加油，啄死那帮病毒 ,11
2月13日 10:21,黑龙江上热搜，四舍五入就是东三省上热搜了，黑黑，让辽辽蹭蹭行不。我们的医疗队上个热搜实在太难了。        ,11
2月13日 08:56,唉。。现在终于不地域黑了哈        ,11
2月13日 08:15,黑龙江自己多留一些吧 也挺严重        ,11
2月13日 07:48,黑龙江这么严重还在支援，地域黑的人你们是真没良心        ,11
2月13日 07:48,黑龙江没有经历过非典，也没爆发过大规模的传染病，这方面的经验相对来说要差一些，现在要对最严重的孝感，很担心他们。而且黑龙江确诊人数也增加的很快，死亡人数也多，省内生产防护物资工厂也少，真的太难了。        ,11
2月13日 10:33,请你们下次黑东北的时候 想想国家有难的时候我们做过什么 ¡评论配图 ,11
2月13日 09:35,义不容辞，上        ,11
2月13日 09:34,是真的尽力了！有些封村子的就只限一家进蔬菜🥬都已经快没吃的了 口罩也没有都是用自己买的纱布做的口罩😷……你们想过吗！就这样我们该捐的都捐了、去支援的也去了！鸡头的死亡率这么高都去了！还要我们怎么样呢…… ,11
2月13日 08:16,自己这头多严重，都不够用，还派出去这么多，逞强，艾，可怜的黑龙江，        ,11
2月12日 19:15,龙江的疫情很严重了，资源也赶不上其他省，但也是倾尽全力了，各位白衣天使们保护好自己        ,11
2月13日 09:43,我们黑龙江，全国死亡率第二，我们还是出钱出人去支援湖北，那些开地图炮的有点良心吧，别用到我们叫我们大哥，用不到我们骂我们穷蠢，希望我们的医护人员平安凯旋 ,11
2月13日 07:52,一定会凯旋归来，这场仗一定会赢 ,11
2月13日 07:46,昨天在肇东住院，出院时候听见院长和医生说，一会儿市里集合去省里，出发，我就猜到要支援武汉了，县城的大夫都去了        ,11
2月13日 09:21,物资是捐的 但人是借的 等你们好了 316个人必须一个不少的还给我们 ,11
2月13日 08:48,黑龙江真是啥也没有了 还倾尽所有  黑龙江也急缺N95 没求外援 而是咬着牙和自己省内的群众说,12
2月13日 07:38,为黑龙江人感到骄傲，大事儿面前一点不含糊！贼棒！        ,12
2月13日 07:34,什么都能给你们 人是借给你们的 一个不少的还回来        ,12
2月13日 07:24,2月1号黑龙江齐齐哈尔的300多名医护人员已经去武汉支援了  这又去了一批 请平安归来        ,12
2月12日 22:03,代表孝感感谢黑龙江的支援，东北人实在，低调 ,12
