3月27日 23:12,作业不好抄哈？        ,17
3月27日 23:11,特没谱害人不浅，哎，这场人类的灾难赶快过去吧        ,18
3月27日 23:10,美国作为第一大国，应该自己支撑。国际力量救援应该优先支援在小国，小国更好管控，根治起来更快，二次复发可能更小。最后再支援美国，以美国的医疗一定可以拖住病毒减缓伤亡，这样可以最大程度降低伤亡。        ,18
3月27日 23:09,自大 真的自大 摊上这样一个总统 也是非常不幸了  愿好人一生平安 特朗普终究会为他的行为 言论 负责        ,18
3月27日 23:09,卡车装尸体        ,18
3月27日 23:08,武汉当时也有人发这，后来就去喝茶了        ,18
3月27日 23:08,只能说当权者太傲娇        ,18
3月27日 23:06,美利坚裂众散装国 ,18
3月27日 23:05,卡车装尸体，认真的吗(⊙x⊙;)？咋这么多人死于新冠肺炎！？        ,18
3月27日 23:05,去找我你们的领导人是为神马？去问问你们国人是怎么想的，疫情期间坚持聚会        ,18
3月27日 23:05,他们的尖端科技，尖端武器，尖端医疗什么的可能世界第一，但他们的民生真的不怎么样        ,18
3月27日 23:04,freedom of speech        ,18
3月27日 23:02,现在的问题已经不能评论长短了，希望世界赶紧恢复秩序恢复健康，赶紧好起来        ,18
3月27日 23:01,你们是最发达的国家 ,18
3月27日 22:58,医生不穿防护服也可以？        ,19
3月27日 22:56,我们刚开始的时候也很可怕，哎        ,19
3月27日 22:56,"fake news,next!        ",19
3月27日 22:52,冷凍車 ,19
3月27日 22:51,当时的武汉，你们不是不以为然，现在也变成这样……怪谁？怪特朗普， ,19
3月27日 22:51,不用理他们 当个吃瓜群众就好了        ,19
3月27日 22:50,不是要自由吗 ,19
3月27日 22:50,他们这个防护服，很危险啊        ,19
3月27日 22:49,卡车旁边的黑色袋子的是尸体吗        ,19
3月27日 22:47,医护人员的塑料袋一样的飘着，比一次性雨衣都比不上，        ,19
3月27日 22:46,@再给我来一点 ,19
3月27日 22:46,圆圆，快来写日记        ,19
3月27日 22:45,马上可能不是了        ,19
3月27日 22:44,"sorry,china并没有蔓延3/4/5month,你想太多了        ",19
3月27日 22:40,只会嘴炮。赶紧下台吧！        ,19
3月27日 22:39,现在还提最发达 真是个傲慢的名族        ,20
3月27日 22:37,发达国家和世界第一不都是自封的吗？谁认可了？        ,20
3月27日 22:36,死的好呀        ,20
3月27日 22:35,还有床躺着，还行了，有的都堆到走廊了        ,20
3月27日 22:35,可怕！        ,20
3月27日 22:26,看稿呢？不戴口罩？        ,20
3月27日 22:16,摊上一个戏精总统，你们也是够倒霉的        ,20
3月27日 22:08,幸亏中国人听话        ,20
3月27日 22:03,但是你们不重视        ,20
3月27日 21:56,小美子，你要淡定，你要坚信，人本来都在走向死亡，只不过，你们世界领先嘛，走快点或者说跑快点也是正常的，正如你们所愿        ,20
3月27日 08:34,有没有圆圆，扁扁，球球，出来写日记的？        ,20
3月27日 08:30,方方怎么还不来写日记 ,20
3月27日 08:28,不仅是最发达的国家还有个脑回路最发达的总统        ,20
3月27日 08:17,虽然这是悲伤的故事，可我还是想到了皇后区，，，蜘蛛侠 ,20
3月27日 07:56,还测，越策越多咋么了 你们总统说了只要不测就没有        ,20
6月20日 15:43,无辜了百姓和孩子，美国政权付出应有的代价！        ,21
4月12日 09:45,美国加油💪        ,21
4月7日 19:22,此处应该有掌声  👏👏👏        ,21
3月31日 07:00,每个国家都有逆行者，给全世界的疫情逆行者加油 ,21
3月30日 09:54,建议没有中国国籍的华裔滚回你的美利坚 最好死在那里        ,21
3月30日 08:58,医护人员永远是最辛苦的        ,21
3月29日 11:30,傲慢终将受到惩罚        ,21
3月29日 08:28,@恶龙骑士_ ,21
3月29日 00:07,穿着这种垃圾隔离服，早晚感染啊        ,21
3月28日 19:44,疫情过去，该移民美国的还是大把大把人，就补充死亡人口了～        ,21
3月28日 19:13,【#纽约医生曝光医院真实现状#,21
3月28日 15:16,特朗普,21
3月28日 13:15,这就是人生        ,21
