6月6日 01:40,这个时候别给祖国添乱啊，我之前每俩月就跑出去浪一次的人，今年老老实实呆着了，自己死还没啥，给祖国添乱就不好了        ,20
6月6日 01:37,真的还有去澳大利亚的吗 ,20
6月6日 01:21,余额不允许        ,20
6月6日 01:18,澳大利亚是哪儿 ,20
6月6日 01:15,我们没歧视他们就不错了，不过放心，我们干不出那种愚蠢的事儿，我们呢，没事儿不找事儿，但遇事儿绝对不怕事儿，别试探没好果。        ,20
6月6日 01:14,额，我中国人，我爱中国……我之前住澳洲两三年了，身边邻朋友都特别友善啊！又送自己家做的食物又叫着一起聚餐的～从来没遇到过歧视事件啊～～～怎么了这是～        ,20
6月6日 12:43,我不信，政府层面谈不拢，就不让老百姓出行交流，有意思么？麻烦换个手段行不行？        ,21
10月4日 09:02,俊        ,21
7月18日 10:06,恨国蛆怎么这么多，都给爷爬开        ,21
6月27日 23:40,注意安全呀        ,21
6月25日 07:55,全世界都在反华        ,21
6月24日 18:16,现在呆在祖国最安全！何况现在是疫情期间，哪也别去！ ​        ,21
6月16日 12:45,安全第一        ,21
6月10日 18:59,种族歧视言行和暴暴力行为现象上升? 最严重的在一到三月份不是现在不是吗？ 现在悉尼市中心不都是在游行美国黑人事件嘛？ 没发现现象上升 ,21
6月10日 05:04,没事看看新闻吧！说什么的都有，是TM毒鸡汤喝多了还是出门没带脑子        ,21
6月9日 22:31,澳大利亚一直不是啥好东西崇洋媚外的够赶快去吧别留在中国少你不少        ,21
6月9日 20:45,没钱旅游，请放心 ,21
6月9日 12:53,放心，大中国我都还没游完，不会出去的        ,21
6月9日 11:04,//@黄岩发布: #文旅部提醒切勿前往澳大利亚旅游# ,21
6月9日 10:18,想问一下，留学生还能去吗，毕竟读了一半了，家里穷，也没有钱再换地方了        ,21
10月4日 09:02,俊        ,22
7月18日 10:06,恨国蛆怎么这么多，都给爷爬开        ,22
6月27日 23:40,注意安全呀        ,22
6月25日 07:55,全世界都在反华        ,22
6月24日 18:16,现在呆在祖国最安全！何况现在是疫情期间，哪也别去！ ​        ,22
6月16日 12:45,安全第一        ,22
6月10日 18:59,种族歧视言行和暴暴力行为现象上升? 最严重的在一到三月份不是现在不是吗？ 现在悉尼市中心不都是在游行美国黑人事件嘛？ 没发现现象上升 ,22
6月10日 05:04,没事看看新闻吧！说什么的都有，是TM毒鸡汤喝多了还是出门没带脑子        ,22
6月9日 22:31,澳大利亚一直不是啥好东西崇洋媚外的够赶快去吧别留在中国少你不少        ,22
6月9日 20:45,没钱旅游，请放心 ,22
6月9日 12:53,放心，大中国我都还没游完，不会出去的        ,22
6月9日 11:04,//@黄岩发布: #文旅部提醒切勿前往澳大利亚旅游# ,22
6月9日 10:18,想问一下，留学生还能去吗，毕竟读了一半了，家里穷，也没有钱再换地方了        ,22
6月9日 10:06,象征意义的警告  质疑的那些人  就你懂？gj不比你知道的多  不是那根葱 别过来立  听懂了吗？你过来啊 ,22
