8月12日 17:19,牛x，自己国家的人都不要了，不能理解 ,19
8月12日 17:19,@Yig歌 ,19
8月12日 17:18,你应该不让你的人民出来啊 ,19
8月12日 17:11,孤儿国        ,19
8月12日 17:08,哈哈哈哈哈哈哈哈哈哈哈哈哈哈哈哈哈哈哈哈哈哈哈哈哈哈哈哈 孝子们快出来夸你爹啊        ,19
8月12日 17:07,不回可以那也千万别让出来啊！！        ,19
8月12日 17:05,//@最爱成宝拉:自由与民主.不抛弃不放弃 ,20
8月12日 17:00,美国人权真棒 ,20
8月12日 17:00,号称自由与民主的国家        ,20
8月12日 16:59, ,20
8月12日 16:56,抛弃公民 ,20
8月12日 16:55,美国才是最危险的吧。。        ,20
8月12日 16:55,安        ,20
8月12日 16:53,公知说的所有预言都在美国一一应验了        ,20
8月12日 16:53,本国人都不要了，这很美国        ,20
8月12日 16:53,人生最精彩的不是实现梦想的瞬间，而是坚持梦想的过程。        ,20
8月12日 16:53,还有人想回去吗 ,20
8月12日 16:52,美帝这是准备全球生化战？        ,20
8月12日 16:52,可能人家还不想回来        ,20
8月12日 16:52,啊这，不是吧这是人想的？        ,20
10月12日 00:12,这是不是真的有家不能回 ,20
10月12日 00:12,这是不是真的有家不能回 ,21
9月28日 20:29,）        ,21
8月19日 10:24,楼里有些人的观念真的是，国家欠你们的吗？把你供起来当菩萨才对吗？        ,21
8月16日 17:57,美国都这样了，还怕这。        ,21
8月16日 03:30,评论里说真话的人早都被骂死了        ,21
8月15日 19:12,自由🆓        ,21
8月15日 13:30,哈哈，美国就是不行，还考虑。。。        ,21
8月15日 04:17,禁止挺好呀 现在美国才是全球最危险的国家呀 谁乐意进啊        ,21
8月15日 01:29,转发微博        ,21
8月15日 01:26,有什么杠的你又不在国外，当初谁把口岸国门一关禁止回国的？？嗯？？//@SeniorWesley:中国难道不是这样吗？        ,21
