8月12日 16:45,哈哈哈哈 国民都不要，不愧是没有人权的美国        ,1
8月12日 16:46,被美国抛弃的孩子 ,1
8月12日 16:44,如果川普同志感染了，我们还是欢迎他回中国的👏        ,1
8月12日 16:46,中国难道不是这样吗？        ,1
8月12日 18:18,评论里围中救美的美🐶真多 ,1
8月12日 16:45,逃出美国的估计都治愈了，谁特么想回去        ,1
8月12日 16:44,中国不是早就禁了？        ,1
8月12日 17:44,我就纳闷了楼中楼有些人成天拿小粉红讽刺人的人，你是二乙子吗？不赞同观点你说就是了，认为国家哪里不好，去努力改变就是了，改变不了国家，你还改变不了自己国籍么？这都改变不了难道不是你自己的能力有问题？        ,1
8月12日 16:44,自由与民主.不抛弃不放弃 ,1
8月12日 16:49,要是别的国家，比如…这么做啊，美🐶不得说点啥呢        ,1
8月12日 23:26,中国禁是真的禁了的，也没人说不该禁只是说中国也是这么做的。楼上说错什么了？进去楼里骂声一片，让人啼笑皆非 ,1
8月12日 19:09,告评论区慕洋犬,1
8月12日 17:58,公知这会怎么说？？@方方 ,1
8月13日 01:15,评论都是老双标了，嘲笑别人连自己的国民都不要了的时候，忘了自己国家是怎么对在在海外的国民的        ,1
8月12日 18:51,评论里，围中就美玩的好啊，要么香港🐶要么海外🐶。从小自己长大可够可怜的        ,2
8月12日 16:44,你都这样了，说的好像有人愿意回来一样，过来送人头啊，不怕被举报么 ,2
8月13日 00:26,说中国也是这样的，的确有带节奏那味了，但是u1s1国内从四月还是五月开始就是体温超过或者等于37.3的不让登机了，至于境外输入，像之前有偷偷吃退烧药瞒报的，也有无症状的，实属没有必要杠，政策需要，也是没有办法的，为了大家好，不懂有什么好吵来吵去的，嘲笑别人和杠之前建议先过过脑子谢谢。        ,2
8月13日 00:58,实事求是，应该赶紧学学中国的“五个一”呀！全球范围内，除了中国，好像还没有哪个国家有“五个一”政策🤗香港台湾澳门的居民现在还可以从全球任何地方只用花很便宜的价钱买到回国的机票呢～        ,2
8月13日 01:20,评论里有几个是病了？五个一和熔断那顶多叫限制不叫禁止。要真禁止了“境外输入”是走地道来的还是游泳来的？五个一也压根算不上是中国单方面的禁止，有的国家早就断航了 就算有五个一的政策人当地机场都得犹豫再三让不让你中国航班落地，要是连五个一都没有 中国航班说不定更难落地        ,2
8月12日 16:46,大水冲了龙王庙，一家人不认一家人 ,2
8月12日 16:47,你们美国不放出那些感染了的人出来就好了        ,2
8月12日 18:36,我觉得好像很多国家都一样吧，不提供核算证明现在也不可以来中国吧，哪怕回来自己包机？跟不让大多数感染的人回来一样，核算证明阳性也不可以回吧不过美国这一手……好像在外面的美国人多想回去一样，回去基本就凉了        ,2
8月12日 17:41,你爱美国，美国爱你吗        ,2
8月12日 16:48,500万了还在乎多几万例？        ,2
8月12日 16:44,阿美莉卡，不愧是你        ,2
8月12日 16:44,美国迟早退出地球 ,2
8月12日 18:29,1. 入境航班旅客需连续14天填报个人情况，上机前要求查验防疫健康码。等到绿码连续填报达到了规定的天数要求，说明您具备了乘机条件 2 乘坐临时航班回国人员需在航班起飞前120小时内进行新冠病毒核酸检测，并持有关检测机构出具的核酸检测阴性证明登机。现有其他防疫要求（健康码、体温检测）依然有效        ,2
8月12日 16:44,啊这？？？        ,2
8月12日 16:44,得了，自己国家都不要了 ,2
8月13日 00:26,瞧瞧评论里和实时话题里有多少恨国精美，美狗大孝子们要气死了可惜有什么用呢哈哈哈哈哈        ,3
8月12日 16:44,拒绝本国人民回国，千古奇闻        ,3
8月12日 21:45,这些杠精，国内现在每天新增的难道不是主要海外流入的嘛，哪有禁止，这么喜欢杠，咋不上天尼你！        ,3
8月12日 16:53,超疾大国，傻子才会入境 ,3
8月13日 02:21,有些话不要明说 默默推个“五个一”不就好了么        ,3
8月12日 18:07,我特么看见这条微博就在想，这会谁特么想回去？？？里边比外面还要命。        ,3
8月12日 16:46,人权没了        ,3
8月12日 16:44,去吧，脱缰的野马，一千万已经不是问题 ,3
8月12日 18:53,美国不是抨击中国这么做是没人权吗？怎么也实施这个方法了？        ,3
8月13日 07:51,我相信大家都忘了疫情初期的时候同胞们是怎么对待海外同胞得了 ,3
8月13日 07:01,国内的确早就不让有症状的回去了啊……也不知道大家都在喷啥……        ,3
8月12日 16:44,卧槽绝了 ,3
8月12日 23:42,中国也不让啊 ,3
8月12日 18:42,我自己人都不要，这就是你们的mei国 ,3
8月12日 19:12,前排的牧羊犬脑子呢        ,3
8月12日 16:50,或许在国外还能得到救治，回去只能等……        ,4
8月12日 17:51,前几天才解除了国际旅行限制，然后现在又考虑出台这个规定，你品，你细品 ,4
8月12日 16:47,好可怜(´;︵;`)        ,4
8月12日 16:55,这就是自由和民主  ，被抛弃了吧！        ,4
8月12日 16:44,？？？有毒吧，服气        ,4
8月12日 20:08,自由的国度正准备抛弃拥护他的子民 ,4
8月12日 19:52,哈哈哈哈哈那些在外国搞破坏的谍子们你们被抛弃了 ,4
8月12日 18:46,抛弃了？？？        ,4
8月13日 07:16,国外同胞回国的时候，喷子说:别来千里投毒了。今天美国考虑禁止感染新冠公民回国，杠精们又说:中国不早就这样了吗 这是对国家有贡献了还是对社会有付出了每天没得干就在这叭叭叭的喷叭叭叭的杠，啥话都让你说了        ,4
8月12日 17:07,真有意思        ,4
8月12日 16:43,第一        ,4
8月12日 17:20,被感染了回去和不回都一个样        ,4
8月12日 18:12,漂亮国这样岂不是没有人权和民主了吗 ,4
8月12日 21:41,孟子对曰,4
8月12日 18:58,@方方 来来来        ,4
8月13日 08:33,我国亦如此，经历过买票难＋贵、连续14天按时且正确的填健康小程序、现在又要短期内的核酸检测阴性证明，能顺利回来真是不容易，很多人不小心填错了或者超时了，小程序上的小飞机说没就没，即使没病也是硬生生上不了飞机，不管你的机票是多少钱买的，没用。        ,5
8月12日 18:21,禁止疑似新冠患者回国？然后把国门打开，让人到处跑？毒跑了，就没毒了？        ,5
8月12日 17:50,这就是所谓的人权？自由？民主？ ,5
8月13日 01:06,现在所有国家都比美国安全吧，谁疯了吗，还要回美国，他也是有毛病，宣扬自己还存在吗，这个操作这的神！        ,5
8月12日 16:47,禁止毒物入毒窝？        ,5
8月13日 09:15,先不说双不双标的问题，这微博下多少人在喷从国外回来必须要健康码要检测证明才能回来这一点，我想问这有问题吗？你从高风险地区回来要这些才是正常的吧！你们出国了的，难道没听自己家人说过国内严重的时候跨省跨市也是得要健康码健康证明的吗？难道不知道一开始连进商场都要测体温看健康码的吗？        ,5
8月13日 07:42,哈哈，狠母遗弃病孩！！ ,5
8月13日 05:42,何必呢，也不差那一个俩的。 ,5
8月13日 02:09,自由 自己人都回不去了 这下真的自由了 彻底放飞了 哈哈哈        ,5
8月13日 00:32,死猪也怕开水烫吗 ,5
8月12日 18:40,差那点嘛？？？ ,5
8月12日 18:34,明白了，自己还进不了自己家了☝👐🙌👌        ,5
8月12日 18:19,有毒        ,5
8月12日 16:50,美国从来不会让我们失望。        ,5
8月12日 16:46,就这？        ,5
8月12日 16:44,哦豁，亲爸不要病孩子了        ,6
8月12日 16:44,这真是狠起来连自己都打 ,6
8月12日 19:38,美国不要美国人了🐮        ,6
8月12日 16:44,没有人性        ,6
8月13日 09:40,评论就别洗咋们国内了...我们国内早就这样了...喷之前先了解一下五个一政策。而且现在国外飞国内航班登机前都需要阴性证明...        ,6
8月12日 18:48,妈啊，谁他妈回美国啊，不要命了        ,6
8月13日 07:42,美国这种废国配和中国比吗？中国禁了也能回来治疗。走流程就行。改了国籍的你。美国不给你飞回来怪中国了？楼顶还有2000赞的那个(中国一样)样你飞机一样。多看点国外新闻了解下。傻瓜子。        ,6
8月12日 21:48,感觉更像是在保护要入境国民 ,6
8月12日 18:28,其实“五个一”一搞，从本质上来说不也是“禁止回国”了吗？先别骂，我给你算算，我从墨尔本飞回国最便宜机票单程是800，最贵的时候5000多，现在到10月底机票基本都是25000+还有回国隔离的费用，七七八八算下来快3-4W了，其它国家可能更贵，将心比心，你觉得几个人回得起，心里不算计算计        ,6
8月12日 16:53,自由呢？？？民主呢？？？        ,6
8月12日 16:50,自由、民主、人权……呵呵！        ,6
8月12日 16:49,公民说，我还不想回美国        ,6
8月14日 08:11,国民都不要了吗？？真🐮，美国真是颠覆了我的三观 ,6
8月13日 09:30,如果是疑似病例或者确诊病例那么在当地直接隔离治疗不能随意出行是常识吧 这点在国内国外都一样的吧 怎么就偏要说在外面有病回不来呢 你在国内得病了也是不让你出门的更何况是乘坐交通工具！评论还拿这个喷自己国家呢？你要没病又买得到机票想回就回了谁禁止了？就算航班熔断不是照样有国外转机回国的        ,6
8月13日 09:28,虽然疑似感染病毒的美国公民无法回美国，但是如果建国同志感染了病毒，中国还是欢迎你的 ,6
8月13日 07:42,先废除禁游令都放出去，再禁止国民回国，这操作骚啊哈哈哈哈哈        ,7
8月13日 07:02,不能回家了        ,7
8月13日 06:55,没人权 ,7
8月13日 06:54,你们别出来就行了        ,7
8月13日 06:35,把川普逼急了不知又会闹出什么幺蛾子        ,7
8月13日 05:53,哈哈，貌似没有人愿意回去，本来没啥，回去变疑似啦 ,7
8月13日 01:07,自从疫情开始到现在我就从没看到美国做对决策过，怎么回事儿？一次也没有，难道这是巧合 ,7
8月13日 00:26,果然是自由美利坚，自由每一天 ,7
8月13日 00:24,美国把你们抛弃了，还舔，真的狗        ,7
8月13日 00:23,唉每次这种帖子下总有人先反思中国，你好棒棒喔⊙ω⊙        ,7
8月12日 23:15,美国现在是地狱  谁还想回去？        ,7
8月12日 23:05,服服服服服🤗        ,7
8月12日 22:51,自由呢？人权呢？公知呢？ ,7
8月12日 22:50,还差这一个半个的吗？        ,7
8月12日 22:50,放公知        ,7
8月12日 22:33,你也不差那点回国得了。        ,8
8月12日 22:01,现在哪有人要去美国啊 ,8
8月12日 20:48,病毒也想回家吖，你不能阻止他和家乡的大部队汇合啊 ,8
8月12日 19:26,哈哈哈哈哈，自己孩子都不要了 ,8
8月12日 19:02,大水冲了龙王庙，一家人不认一家人了？        ,8
8月12日 18:47,患了病的就不是美国人了呗，真是喜闻乐见呀，川普同志消灭美国人计划1.0 ,8
8月12日 18:40,No human rights！ ,8
8月12日 18:40,也不差这几个啊        ,8
8月12日 18:29,床破:  让你们再说我抗疫不力 ,8
8月12日 18:24,先解开全球旅行禁令，让你出去玩，然后不让你回家。绝了        ,8
8月12日 18:11,我向往美国，我的愿望就是去美国，虽然我来自中国，但我的心在美国，有朝一日我一定要去美国，给那里的部分政客带来光和热，我的名字叫东风-41州际弹道导弹        ,8
8月12日 17:54,方方  来这写日记了   灯塔国连自己的人都不要了 @方方 ,8
8月12日 17:51,都散开！！公知体,8
8月12日 17:08,看到这段新闻，想起了汤姆汉克斯演的“幸福终点站”的剧情了。终于在美国的一部分民众身上要实现了。 ,8
8月12日 17:07,你爱美国，美国爱你吗。 ,8
8月12日 17:05,老特你违背了人权！全世界必须制裁你！！        ,9
8月12日 16:50,自由美利坚原来说的是美国政府的自由        ,9
8月12日 16:49,哈？？？发起狠来自己人都砍啊。        ,9
8月12日 16:49,人权呢？自由呢？灯塔该炸了        ,9
8月12日 16:49,老美你别瞎搞了，给公知留口饭吃吧 ,9
8月12日 16:49,看看吧，这是精美向往美国的自由人权？还有把已感染的同胞抛弃在海外？说真的，还是中国好。        ,9
8月12日 16:49,老美这是要一个亿呀一个亿！ ,9
8月12日 16:47,哈哈哈哈哈美国真的要笑死我啦哈哈哈哈        ,9
8月12日 16:47,当时欧洲的美国人入境的时候没有任何防范，现在看起来真讽刺        ,9
8月12日 16:45,果不其然        ,9
8月12日 16:44,自己国家不就是毒窝吗？        ,9
8月12日 16:44,这就是所谓的美国人权🇺🇸        ,9
8月12日 16:44,自由！民主！万岁！！牛逼 ,9
8月12日 16:44,厉害厉害        ,9
8月12日 16:44,天秀        ,9
8月12日 16:43,对比        ,10
8月13日 04:43,考虑也是新闻？        ,10
8月12日 23:53,中国也是，回国需要提供核酸检测阴性证明，这个核酸检测如果完全准确必须需要多次检测。回国后的输入病例很多是属于二次检测被检测出来的。美利坚不是什么好国家，但是也没必要这么弄。        ,10
8月12日 23:13,只限制染病的美国公民不能回美国?拜托，现在在美国的公民别出国害人才是吧 ,10
8月12日 20:19,哟呵，美国政府干得漂亮，狠起来连本国人都不认，这才是真正的大国风范！下一步把确诊的500多万美国人驱逐出境，这样剩下的人就安全了！加油！        ,10
8月12日 19:35,哈哈，人权呢，自由呢，自己家孩子出了门就被抛弃了 ,10
8月12日 19:01,评论有些人是认真吗 合着政府自掏腰包的钱在你们看来都是理所应当啊？        ,10
8月12日 18:57,哪个国家又会接疑似回国？？        ,10
8月12日 18:27,美国这做法真绝，怨不得被骂        ,10
8月12日 18:00,如果是感染者那哪个国家都回不了因为飞机都上不去，境外输入都是偷吃退烧药或者无症状        ,10
8月12日 17:54,今年美丽国脑子怕是病的不清        ,10
8月12日 17:44,这就是美利坚的自由人权，满世界打着人权的幌子各种挑事 ,10
8月12日 16:47,呢個就係最有人權最自由嘅國家。        ,10
9月28日 20:29,）        ,10
8月14日 20:06,可以去联邦法院告吵架王的        ,10
8月14日 12:30,"哈哈哈哈哈哈哈川普玩""禁止上瘾了        ",11
8月13日 12:40,特朗普越来越离谱了，自己公民都不能回去，不过你也是瞎操心，美国人在中国呆的挺安全，你让他们回去他们都不回去呢。        ,11
8月13日 11:02,疫情期间，中国不但加紧控制疫情，还包机接在外境的市民回家，而美国，不但控制不住本国疫情，还拒绝美国市民回国，一个自私总统和一个把市民高于一切的领袖，差距如此之大！        ,11
8月13日 10:15,可笑        ,11
8月13日 09:55,要不跟他们推荐一下我们的五个一吧 ,11
8月13日 09:28,democracy  ohh freedom  ohh        ,11
8月13日 09:24,厉害厉害啊，自己的国人都不要了        ,11
8月13日 09:15,想把包袱甩给别的国家?        ,11
8月13日 09:14,没有人权美利坚不要美国人啦 ,11
8月13日 09:03,自由、皿煮?        ,11
8月13日 08:58,说得好像美国自己没人感染一样        ,11
8月13日 08:46,哦        ,11
8月13日 08:36,谁会想回去啊 ,11
8月13日 08:35,//@超甜bot:哈哈哈哈 国民都不要，不愧是没有人权的美国        ,11
8月13日 08:31,谁想进毒窟        ,11
8月13日 08:30,@泰熙范德萨: 每天输入的境外病历是你妈生出的？        ,12
8月13日 08:29,人权？        ,12
8月13日 08:22,你们的人权呢？？？？        ,12
8月13日 08:12,美国也不差这点感染者了，为啥弄得大家不愉快呢，为了人权，赶紧让人回去吧 ,12
8月13日 08:07,架不住它的官员到处跑        ,12
8月13日 07:50,如此对待自己的公民……        ,12
8月13日 07:40,不回去正常，美国疫情最严重，谁要回去找死？        ,12
8月13日 07:38,额 有这个必要吗 谁想回去啊 ,12
8月13日 07:36,那让他们去哪里 ,12
8月13日 07:35,确实 出国让你长见识不是让你回来讽刺你老子的//@-Tikiy北丶:我就纳闷了楼中楼有些人成天拿小粉红讽刺人的人，你是二乙子吗？不赞同观点你说就是了，认为国家哪里不好，去努力改变就是了，改变不了国家，你还改变不了自己国籍么？这都改变不了难道不是你自己的能力有问题？        ,12
8月13日 07:25,他们都没有自己的国家        ,12
8月13日 07:17,human right?        ,12
8月13日 07:15,老普这就对了，一来劲‘自己都害怕’。        ,12
8月13日 07:12,啊？这是能说的吗？？ ,12
8月13日 07:01,海外慕洋🐶好多，出了个国连爸爸都不认识了。 ,12
8月13日 07:01,哦豁        ,13
8月13日 06:44,宣布解体吧        ,13
8月13日 06:30,……中国也是一样的        ,13
8月13日 06:25,曾经接回去那些人后悔吧，回去了被感染的可能性更大还不能免费救治就像美国病毒猎手说的，他在武汉没有被感染，结果在纽约被感染了。。        ,13
8月13日 06:17,如果从中国过去能进吗 ,13
8月13日 06:13,好烦一整川建国 川普同志的那种说法  能把家业做的那么大还当得上总统的人 怎么可能是个傻子嘛。        ,13
8月13日 06:01,有人来和我解释一下这和中国的政策有啥差别么        ,13
8月13日 03:40,中国疑似不疑似不都禁止吗？？        ,13
8月13日 02:18,不太好吧，自由的国度这样做，会不会太没人权了        ,13
8月13日 02:01,噗⋯⋯        ,13
8月13日 01:39,自由美利坚应该把国民收集回去喝消毒液啊！        ,13
8月13日 01:22,我真的觉得微博应该好好整顿一下了。美🐶也太多了吧。        ,13
8月13日 01:12,前有美人注销美国籍，今有美国不望美人归        ,13
8月13日 00:57,哈哈哈哈哈哈哈哈哈哈，这么骚操作真的出自太阳系吗？        ,13
8月13日 00:57,可拉倒吧，现在最不能去的就是美国🇺🇸，病毒感染人数最多的国家，去了就是找死，躲还来不及 ,13
8月13日 00:53,对美国来说有用吗？        ,14
8月13日 00:32,美国还差这几个？        ,14
8月12日 23:48,有点搞笑 看了美国的增长数据还回去干嘛呢 疑似病例回USA必然会变成确诊啊哈哈哈哈哈哈傻不傻啊 怎么会回USA呢哈哈哈哈哈哈        ,14
8月12日 23:43,哈哈😄        ,14
8月12日 23:36,美国人权呢？        ,14
8月12日 23:24,国籍一换        ,14
8月12日 23:23,这个时候回美国的就是和自己生命开玩笑        ,14
8月12日 23:18,哈哈哈，        ,14
8月12日 23:13,你们都五百多万了 还差这点儿？        ,14
8月12日 23:06,人民可怜        ,14
8月12日 22:59,谁愿意回去啊？疫情泛滥的毒区        ,14
8月12日 22:38,自由和明主一直是美国的标榜，但是这几年美国越来越不在乎这些东西了，美国将开始走下坡路了。        ,14
8月12日 22:37,他们国家不做人也不是一天两天了        ,14
8月12日 22:36,干得漂亮        ,14
8月12日 22:15,这我是真没想到，我们是不让自己人出门怕被感染，感染的回来了赶紧治疗。你这倒好自己家里的管不住也不让在外面的人回家治疗        ,14
8月12日 21:57,反正在我们这边的你们的米果人，我们都基本保障了。米果你们自己里面的别放出来祸祸地球就行了。        ,15
8月12日 21:53,人权呢?自己的国民都不要了?        ,15
8月12日 21:32,？？？疯了吗？        ,15
8月12日 21:27,人权呢？        ,15
8月12日 21:25,哦？这就是人权吗？懂了 ,15
8月12日 21:05,自己的人民都不要了，想要啥？        ,15
8月12日 20:59,一直标榜的人权呢        ,15
8月12日 20:57,这关中国什么事，评论都有毒吧。不是讨论美国就这一问题的态度吗？不要什么事情都拿来作比较。        ,15
8月12日 20:44,那岂不是被自由民主抛弃在家门外了吗？        ,15
8月12日 20:33,你们的人道主义都被吃了吗 ,15
8月12日 20:23,这是美国防控疫情的手段和办法啊？真厉害！        ,15
8月12日 20:20,必须看看        ,15
8月12日 20:11,他是以为自己国家多安全呢吗        ,15
8月12日 20:06,特朗普,15
8月12日 20:02,回去干嘛？本来没事儿，回去就确诊吗？ ,15
8月12日 19:58,……………………服        ,16
8月12日 19:56,我觉得不太像有人想回去，不管感没感染，除非至亲在        ,16
8月12日 19:53,无家可归，无处可去 ,16
8月12日 19:37,可怜的美国人 ,16
8月12日 19:34,？？        ,16
8月12日 19:28,嗯？美国霸气小护照？        ,16
8月12日 19:26,！？        ,16
8月12日 19:24,说好的人权呢？ ,16
8月12日 19:16,谁会想回去？美国不是最严重的？        ,16
8月12日 19:16,假如特朗普致美国公民的一条推特,16
8月12日 19:14,你爱你的国 你的国爱你吗        ,16
8月12日 19:07,估计是全球不要你们吧        ,16
8月12日 19:06,他最好也不要把他们的人放出来        ,16
8月12日 18:59,美国护照？？ ,16
8月12日 18:55,不会去可能是还有希望，回去了疑似马上被传染为确诊！美国最近各种骚操作不断呃！        ,16
8月12日 18:47,啊，这！        ,17
8月12日 18:46,沒有人權        ,17
8月12日 18:42,哈哈哈，自己国家的人民都被拒绝入境这是想让他们流浪到宇宙去么？真的是太有人权了        ,17
8月12日 18:39,没有人权 ,17
8月12日 18:34,自由的禁止入内        ,17
8月12日 18:34,国内都那么多也没隔离，不让回有什么意义吗 ,17
8月12日 18:29,连自己的孩子都不要了 就因为他们病了吗 不打算救吗 ,17
8月12日 18:28,哈哈哈哈哈！特没谱谁都不要吧！就留下特没谱自己吧…… ,17
8月12日 18:27,加油        ,17
8月12日 18:25,一样的，现在国内也是，感染了也不让登机，航班又少，机票又贵，直接也是等死。        ,17
8月12日 18:25,说的愿意回似的        ,17
8月12日 18:24,啧啧，没有人权！        ,17
8月12日 18:23,回美国干啥？感染新冠吗？        ,17
8月12日 18:21,美国国民在国外还是很安全的 ,17
8月12日 18:20,发烧上不了飞机，航班次数严重限制，可不就是早就禁了？//@你想走路回家吗:是的，中国其实早就禁止疑是病例回国了，实事求是。楼主说的没有错，不明白都在喷什么//@熊二lens:中国不是早就禁了？        ,17
8月12日 18:18,违反不是违法        ,18
8月12日 18:17,哈哈哈哈哈哈哈哈哈        ,18
8月12日 18:17,自由国度的人权呢？        ,18
8月12日 18:16,别出国就行了，还回国呢        ,18
8月12日 18:15,人权呢？这国怎？定体问。        ,18
8月12日 18:13,这是被自己国家抛弃了啊…… ,18
8月12日 18:13,！！！！！！！！！！        ,18
8月12日 18:10,#美国考虑禁止疑似感染新冠公民回国#干得漂亮，怎么不考虑疑似感染病例出国呢？川建国你到底要把美国霍霍成啥样？        ,18
8月12日 18:09,人权～        ,18
8月12日 18:06,哈哈哈知道美国不要脸，没料到会这么不要脸，语文水平有限，不知道怎么形容 ,18
8月12日 18:06, ,18
8月12日 18:05,我的吗耶。厉害了        ,18
8月12日 18:05,哈哈哈哈说好的人权和民主呢？        ,18
8月12日 17:59,公知该出来洗了 ,18
8月12日 17:56,都不给自己家人留条后路的吗？        ,18
8月12日 17:53,双标舔狗和公知呢，怎么不出来骂没人权了        ,19
8月12日 17:52,患新冠回国的人能有500万吗？天大的笑话！        ,19
8月12日 17:49,美国驻外部队里的军人也都不要回去了        ,19
8月12日 17:47,哈哈哈        ,19
8月12日 17:43,真够厉害的了 牛        ,19
8月12日 17:40,完了，孩子心里估计要伤心了，自己的国家都不要自己了        ,19
8月12日 17:40, ,19
8月12日 17:38,回复@SeniorWesley:咱们不是啊。一直以来不断的输入疫情不都是回国的么。。        ,19
8月12日 17:24,转发微博        ,19
